"No.","Time","Source","Destination","Protocol","Length","Info"
"1","0.000000","10.200.2.252","185.91.175.64","TCP","66","61558  >  80 [SYN] Seq=0 Win=8192 Len=0 MSS=1460 WS=256 SACK_PERM=1"
"2","0.175516","185.91.175.64","10.200.2.252","TCP","66","80  >  61558 [SYN, ACK] Seq=0 Ack=1 Win=14600 Len=0 MSS=1367 SACK_PERM=1 WS=128"
"3","0.177379","10.200.2.252","185.91.175.64","TCP","54","61558  >  80 [ACK] Seq=1 Ack=1 Win=65536 Len=0"
"4","0.178280","10.200.2.252","185.91.175.64","HTTP","136","GET /jsaxo8u/g39b2cx.exe HTTP/1.1 "
"5","0.366262","185.91.175.64","10.200.2.252","TCP","54","80  >  61558 [ACK] Seq=1 Ack=83 Win=14720 Len=0"
"6","0.525151","185.91.175.64","10.200.2.252","TCP","1421","80  >  61558 [ACK] Seq=1 Ack=83 Win=14720 Len=1367 [TCP segment of a reassembled PDU]"
"7","0.538803","185.91.175.64","10.200.2.252","TCP","1421","80  >  61558 [ACK] Seq=1368 Ack=83 Win=14720 Len=1367 [TCP segment of a reassembled PDU]"
"8","0.539062","185.91.175.64","10.200.2.252","TCP","1421","80  >  61558 [ACK] Seq=2735 Ack=83 Win=14720 Len=1367 [TCP segment of a reassembled PDU]"
"9","0.539173","185.91.175.64","10.200.2.252","TCP","60","80  >  61558 [PSH, ACK] Seq=4102 Ack=83 Win=14720 Len=6 [TCP segment of a reassembled PDU]"
"10","0.539817","10.200.2.252","185.91.175.64","TCP","54","61558  >  80 [ACK] Seq=83 Ack=2735 Win=65536 Len=0"
"11","0.539898","10.200.2.252","185.91.175.64","TCP","54","61558  >  80 [ACK] Seq=83 Ack=4108 Win=65536 Len=0"
"12","0.607158","185.91.175.64","10.200.2.252","TCP","1421","80  >  61558 [ACK] Seq=4108 Ack=83 Win=14720 Len=1367 [TCP segment of a reassembled PDU]"
"13","0.607459","185.91.175.64","10.200.2.252","TCP","1421","80  >  61558 [ACK] Seq=5475 Ack=83 Win=14720 Len=1367 [TCP segment of a reassembled PDU]"
"14","0.607639","185.91.175.64","10.200.2.252","TCP","1421","80  >  61558 [ACK] Seq=6842 Ack=83 Win=14720 Len=1367 [TCP segment of a reassembled PDU]"
"15","0.608164","10.200.2.252","185.91.175.64","TCP","54","61558  >  80 [ACK] Seq=83 Ack=6842 Win=65536 Len=0"
"16","0.621139","185.91.175.64","10.200.2.252","TCP","1421","80  >  61558 [ACK] Seq=8209 Ack=83 Win=14720 Len=1367 [TCP segment of a reassembled PDU]"
"17","0.621396","185.91.175.64","10.200.2.252","TCP","1421","80  >  61558 [ACK] Seq=9576 Ack=83 Win=14720 Len=1367 [TCP segment of a reassembled PDU]"
"18","0.621573","185.91.175.64","10.200.2.252","TCP","1421","80  >  61558 [ACK] Seq=10943 Ack=83 Win=14720 Len=1367 [TCP segment of a reassembled PDU]"
"19","0.622146","10.200.2.252","185.91.175.64","TCP","54","61558  >  80 [ACK] Seq=83 Ack=9576 Win=65536 Len=0"
"20","0.622223","10.200.2.252","185.91.175.64","TCP","54","61558  >  80 [ACK] Seq=83 Ack=12310 Win=65536 Len=0"
"21","0.716353","185.91.175.64","10.200.2.252","TCP","1421","80  >  61558 [ACK] Seq=12310 Ack=83 Win=14720 Len=1367 [TCP segment of a reassembled PDU]"
"22","0.716628","185.91.175.64","10.200.2.252","TCP","1421","80  >  61558 [ACK] Seq=13677 Ack=83 Win=14720 Len=1367 [TCP segment of a reassembled PDU]"
"23","0.717364","10.200.2.252","185.91.175.64","TCP","54","61558  >  80 [ACK] Seq=83 Ack=15044 Win=65536 Len=0"
"24","0.729919","185.91.175.64","10.200.2.252","TCP","1421","80  >  61558 [ACK] Seq=15044 Ack=83 Win=14720 Len=1367 [TCP segment of a reassembled PDU]"
"25","0.730225","185.91.175.64","10.200.2.252","TCP","1421","80  >  61558 [ACK] Seq=16411 Ack=83 Win=14720 Len=1367 [TCP segment of a reassembled PDU]"
"26","0.730402","185.91.175.64","10.200.2.252","TCP","1421","80  >  61558 [ACK] Seq=17778 Ack=83 Win=14720 Len=1367 [TCP segment of a reassembled PDU]"
"27","0.730590","185.91.175.64","10.200.2.252","TCP","1421","80  >  61558 [ACK] Seq=19145 Ack=83 Win=14720 Len=1367 [TCP segment of a reassembled PDU]"
"28","0.730929","10.200.2.252","185.91.175.64","TCP","54","61558  >  80 [ACK] Seq=83 Ack=17778 Win=65536 Len=0"
"29","0.731850","10.200.2.252","185.91.175.64","TCP","54","61558  >  80 [ACK] Seq=83 Ack=20512 Win=65536 Len=0"
"30","0.784334","185.91.175.64","10.200.2.252","TCP","1421","80  >  61558 [ACK] Seq=20512 Ack=83 Win=14720 Len=1367 [TCP segment of a reassembled PDU]"
"31","0.784641","185.91.175.64","10.200.2.252","TCP","1421","80  >  61558 [ACK] Seq=21879 Ack=83 Win=14720 Len=1367 [TCP segment of a reassembled PDU]"
"32","0.785348","10.200.2.252","185.91.175.64","TCP","54","61558  >  80 [ACK] Seq=83 Ack=23246 Win=65536 Len=0"
"33","0.797919","185.91.175.64","10.200.2.252","TCP","1421","80  >  61558 [ACK] Seq=23246 Ack=83 Win=14720 Len=1367 [TCP segment of a reassembled PDU]"
"34","0.798254","185.91.175.64","10.200.2.252","TCP","1421","80  >  61558 [ACK] Seq=24613 Ack=83 Win=14720 Len=1367 [TCP segment of a reassembled PDU]"
"35","0.798446","185.91.175.64","10.200.2.252","TCP","1421","80  >  61558 [ACK] Seq=25980 Ack=83 Win=14720 Len=1367 [TCP segment of a reassembled PDU]"
"36","0.798941","10.200.2.252","185.91.175.64","TCP","54","61558  >  80 [ACK] Seq=83 Ack=25980 Win=65536 Len=0"
"37","0.811922","185.91.175.64","10.200.2.252","TCP","1421","80  >  61558 [ACK] Seq=27347 Ack=83 Win=14720 Len=1367 [TCP segment of a reassembled PDU]"
"38","0.812250","185.91.175.64","10.200.2.252","TCP","1421","80  >  61558 [ACK] Seq=28714 Ack=83 Win=14720 Len=1367 [TCP segment of a reassembled PDU]"
"39","0.812442","185.91.175.64","10.200.2.252","TCP","1421","80  >  61558 [PSH, ACK] Seq=30081 Ack=83 Win=14720 Len=1367 [TCP segment of a reassembled PDU]"
"40","0.812618","185.91.175.64","10.200.2.252","TCP","1421","80  >  61558 [ACK] Seq=31448 Ack=83 Win=14720 Len=1367 [TCP segment of a reassembled PDU]"
"41","0.812948","10.200.2.252","185.91.175.64","TCP","54","61558  >  80 [ACK] Seq=83 Ack=28714 Win=65536 Len=0"
"42","0.813022","10.200.2.252","185.91.175.64","TCP","54","61558  >  80 [ACK] Seq=83 Ack=31448 Win=65536 Len=0"
"43","0.894855","185.91.175.64","10.200.2.252","TCP","1421","80  >  61558 [ACK] Seq=32815 Ack=83 Win=14720 Len=1367 [TCP segment of a reassembled PDU]"
"44","0.895133","185.91.175.64","10.200.2.252","TCP","1421","80  >  61558 [ACK] Seq=34182 Ack=83 Win=14720 Len=1367 [TCP segment of a reassembled PDU]"
"45","0.895878","10.200.2.252","185.91.175.64","TCP","54","61558  >  80 [ACK] Seq=83 Ack=34182 Win=65536 Len=0"
"46","0.907520","185.91.175.64","10.200.2.252","TCP","1421","80  >  61558 [ACK] Seq=35549 Ack=83 Win=14720 Len=1367 [TCP segment of a reassembled PDU]"
"47","0.907819","185.91.175.64","10.200.2.252","TCP","1421","80  >  61558 [ACK] Seq=36916 Ack=83 Win=14720 Len=1367 [TCP segment of a reassembled PDU]"
"48","0.907998","185.91.175.64","10.200.2.252","TCP","1421","80  >  61558 [ACK] Seq=38283 Ack=83 Win=14720 Len=1367 [TCP segment of a reassembled PDU]"
"49","0.908554","10.200.2.252","185.91.175.64","TCP","54","61558  >  80 [ACK] Seq=83 Ack=36916 Win=65536 Len=0"
"50","0.908625","10.200.2.252","185.91.175.64","TCP","54","61558  >  80 [ACK] Seq=83 Ack=39650 Win=65536 Len=0"
"51","0.908752","185.91.175.64","10.200.2.252","TCP","1421","80  >  61558 [ACK] Seq=39650 Ack=83 Win=14720 Len=1367 [TCP segment of a reassembled PDU]"
"52","0.921093","185.91.175.64","10.200.2.252","TCP","1421","80  >  61558 [ACK] Seq=41017 Ack=83 Win=14720 Len=1367 [TCP segment of a reassembled PDU]"
"53","0.921331","185.91.175.64","10.200.2.252","TCP","1421","80  >  61558 [ACK] Seq=42384 Ack=83 Win=14720 Len=1367 [TCP segment of a reassembled PDU]"
"54","0.922099","10.200.2.252","185.91.175.64","TCP","54","61558  >  80 [ACK] Seq=83 Ack=42384 Win=65536 Len=0"
"55","0.922537","185.91.175.64","10.200.2.252","TCP","1421","80  >  61558 [ACK] Seq=43751 Ack=83 Win=14720 Len=1367 [TCP segment of a reassembled PDU]"
"56","0.923018","10.200.2.252","185.91.175.64","TCP","54","61558  >  80 [ACK] Seq=83 Ack=45118 Win=65536 Len=0"
"57","0.962254","185.91.175.64","10.200.2.252","TCP","1421","80  >  61558 [ACK] Seq=45118 Ack=83 Win=14720 Len=1367 [TCP segment of a reassembled PDU]"
"58","0.962526","185.91.175.64","10.200.2.252","TCP","1421","80  >  61558 [ACK] Seq=46485 Ack=83 Win=14720 Len=1367 [TCP segment of a reassembled PDU]"
"59","0.963262","10.200.2.252","185.91.175.64","TCP","54","61558  >  80 [ACK] Seq=83 Ack=47852 Win=65536 Len=0"
"60","0.976010","185.91.175.64","10.200.2.252","TCP","1421","80  >  61558 [ACK] Seq=47852 Ack=83 Win=14720 Len=1367 [TCP segment of a reassembled PDU]"
"61","0.988184","185.91.175.64","10.200.2.252","TCP","1421","80  >  61558 [ACK] Seq=49219 Ack=83 Win=14720 Len=1367 [TCP segment of a reassembled PDU]"
"62","0.988464","185.91.175.64","10.200.2.252","TCP","1421","80  >  61558 [ACK] Seq=50586 Ack=83 Win=14720 Len=1367 [TCP segment of a reassembled PDU]"
"63","0.989188","10.200.2.252","185.91.175.64","TCP","54","61558  >  80 [ACK] Seq=83 Ack=50586 Win=65536 Len=0"
"64","0.989886","185.91.175.64","10.200.2.252","TCP","1421","80  >  61558 [PSH, ACK] Seq=51953 Ack=83 Win=14720 Len=1367 [TCP segment of a reassembled PDU]"
"65","0.990807","10.200.2.252","185.91.175.64","TCP","54","61558  >  80 [ACK] Seq=83 Ack=53320 Win=65536 Len=0"
"66","1.040029","185.91.175.64","10.200.2.252","TCP","1421","80  >  61558 [ACK] Seq=53320 Ack=83 Win=14720 Len=1367 [TCP segment of a reassembled PDU]"
"67","1.040354","185.91.175.64","10.200.2.252","TCP","1421","80  >  61558 [ACK] Seq=54687 Ack=83 Win=14720 Len=1367 [TCP segment of a reassembled PDU]"
"68","1.040683","185.91.175.64","10.200.2.252","TCP","1421","80  >  61558 [ACK] Seq=56054 Ack=83 Win=14720 Len=1367 [TCP segment of a reassembled PDU]"
"69","1.040779","185.91.175.64","10.200.2.252","TCP","1421","80  >  61558 [ACK] Seq=57421 Ack=83 Win=14720 Len=1367 [TCP segment of a reassembled PDU]"
"70","1.040910","10.200.2.252","185.91.175.64","TCP","54","61558  >  80 [ACK] Seq=83 Ack=56054 Win=65536 Len=0"
"71","1.041045","185.91.175.64","10.200.2.252","TCP","1421","80  >  61558 [ACK] Seq=58788 Ack=83 Win=14720 Len=1367 [TCP segment of a reassembled PDU]"
"72","1.041712","10.200.2.252","185.91.175.64","TCP","54","61558  >  80 [ACK] Seq=83 Ack=58788 Win=65536 Len=0"
"73","1.053780","185.91.175.64","10.200.2.252","TCP","1421","80  >  61558 [ACK] Seq=60155 Ack=83 Win=14720 Len=1367 [TCP segment of a reassembled PDU]"
"74","1.054674","10.200.2.252","185.91.175.64","TCP","54","61558  >  80 [ACK] Seq=83 Ack=61522 Win=65536 Len=0"
"75","1.071867","185.91.175.64","10.200.2.252","TCP","1421","80  >  61558 [ACK] Seq=61522 Ack=83 Win=14720 Len=1367 [TCP segment of a reassembled PDU]"
"76","1.072188","185.91.175.64","10.200.2.252","TCP","1421","80  >  61558 [ACK] Seq=62889 Ack=83 Win=14720 Len=1367 [TCP segment of a reassembled PDU]"
"77","1.072743","10.200.2.252","185.91.175.64","TCP","54","61558  >  80 [ACK] Seq=83 Ack=64256 Win=65536 Len=0"
"78","1.085625","185.91.175.64","10.200.2.252","TCP","1421","80  >  61558 [ACK] Seq=64256 Ack=83 Win=14720 Len=1367 [TCP segment of a reassembled PDU]"
"79","1.097155","185.91.175.64","10.200.2.252","TCP","1421","80  >  61558 [ACK] Seq=65623 Ack=83 Win=14720 Len=1367 [TCP segment of a reassembled PDU]"
"80","1.097460","185.91.175.64","10.200.2.252","TCP","1421","80  >  61558 [ACK] Seq=66990 Ack=83 Win=14720 Len=1367 [TCP segment of a reassembled PDU]"
"81","1.097670","185.91.175.64","10.200.2.252","TCP","1421","80  >  61558 [ACK] Seq=68357 Ack=83 Win=14720 Len=1367 [TCP segment of a reassembled PDU]"
"82","1.097864","185.91.175.64","10.200.2.252","TCP","1421","80  >  61558 [ACK] Seq=69724 Ack=83 Win=14720 Len=1367 [TCP segment of a reassembled PDU]"
"83","1.098046","185.91.175.64","10.200.2.252","TCP","1421","80  >  61558 [ACK] Seq=71091 Ack=83 Win=14720 Len=1367 [TCP segment of a reassembled PDU]"
"84","1.098177","10.200.2.252","185.91.175.64","TCP","54","61558  >  80 [ACK] Seq=83 Ack=66990 Win=65536 Len=0"
"85","1.098250","10.200.2.252","185.91.175.64","TCP","54","61558  >  80 [ACK] Seq=83 Ack=69724 Win=65536 Len=0"
"86","1.099154","10.200.2.252","185.91.175.64","TCP","54","61558  >  80 [ACK] Seq=83 Ack=72458 Win=65536 Len=0"
"87","1.099599","185.91.175.64","10.200.2.252","TCP","1421","80  >  61558 [ACK] Seq=72458 Ack=83 Win=14720 Len=1367 [TCP segment of a reassembled PDU]"
"88","1.138110","185.91.175.64","10.200.2.252","TCP","1421","80  >  61558 [ACK] Seq=73825 Ack=83 Win=14720 Len=1367 [TCP segment of a reassembled PDU]"
"89","1.138414","185.91.175.64","10.200.2.252","TCP","1421","80  >  61558 [ACK] Seq=75192 Ack=83 Win=14720 Len=1367 [TCP segment of a reassembled PDU]"
"90","1.138625","185.91.175.64","10.200.2.252","TCP","1421","80  >  61558 [ACK] Seq=76559 Ack=83 Win=14720 Len=1367 [TCP segment of a reassembled PDU]"
"91","1.138811","185.91.175.64","10.200.2.252","TCP","1421","80  >  61558 [ACK] Seq=77926 Ack=83 Win=14720 Len=1367 [TCP segment of a reassembled PDU]"
"92","1.138990","185.91.175.64","10.200.2.252","TCP","1421","80  >  61558 [ACK] Seq=79293 Ack=83 Win=14720 Len=1367 [TCP segment of a reassembled PDU]"
"93","1.139118","10.200.2.252","185.91.175.64","TCP","54","61558  >  80 [ACK] Seq=83 Ack=75192 Win=65536 Len=0"
"94","1.139190","10.200.2.252","185.91.175.64","TCP","54","61558  >  80 [ACK] Seq=83 Ack=77926 Win=65536 Len=0"
"95","1.140094","10.200.2.252","185.91.175.64","TCP","54","61558  >  80 [ACK] Seq=83 Ack=80660 Win=65536 Len=0"
"96","1.152055","185.91.175.64","10.200.2.252","TCP","1421","80  >  61558 [ACK] Seq=80660 Ack=83 Win=14720 Len=1367 [TCP segment of a reassembled PDU]"
"97","1.152324","185.91.175.64","10.200.2.252","TCP","1421","80  >  61558 [ACK] Seq=82027 Ack=83 Win=14720 Len=1367 [TCP segment of a reassembled PDU]"
"98","1.152502","185.91.175.64","10.200.2.252","HTTP","1416","HTTP/1.1 200 OK "
"99","1.153049","10.200.2.252","185.91.175.64","TCP","54","61558  >  80 [ACK] Seq=83 Ack=83394 Win=65536 Len=0"
"100","1.364900","10.200.2.252","185.91.175.64","TCP","54","61558  >  80 [ACK] Seq=83 Ack=84756 Win=64000 Len=0"
"101","1.557035","10.200.2.252","185.91.175.64","TCP","54","61558  >  80 [RST, ACK] Seq=83 Ack=84756 Win=0 Len=0"
"102","4.392914","10.200.2.252","188.120.225.17","TCP","66","61559  >  8080 [SYN] Seq=0 Win=40960 Len=0 MSS=1460 WS=1 SACK_PERM=1"
"103","4.565754","188.120.225.17","10.200.2.252","TCP","66","8080  >  61559 [SYN, ACK] Seq=0 Ack=1 Win=65535 Len=0 MSS=1367 WS=8 SACK_PERM=1"
"104","4.566782","10.200.2.252","188.120.225.17","TCP","54","61559  >  8080 [ACK] Seq=1 Ack=1 Win=40960 Len=0"
"105","4.569784","10.200.2.252","188.120.225.17","TCP","266","61559  >  8080 [PSH, ACK] Seq=1 Ack=1 Win=40960 Len=212 [TCP segment of a reassembled PDU]"
"106","4.852391","188.120.225.17","10.200.2.252","TCP","54","8080  >  61559 [ACK] Seq=1 Ack=213 Win=65616 Len=0"
"107","4.853413","10.200.2.252","188.120.225.17","HTTP","556","POST / HTTP/1.1  (image/gif)"
"108","5.126483","188.120.225.17","10.200.2.252","TCP","54","8080  >  61559 [ACK] Seq=1 Ack=715 Win=65616 Len=0"
"109","5.818892","188.120.225.17","10.200.2.252","TCP","1421","8080  >  61559 [ACK] Seq=1 Ack=715 Win=65616 Len=1367 [TCP segment of a reassembled PDU]"
"110","5.833047","188.120.225.17","10.200.2.252","TCP","1421","8080  >  61559 [ACK] Seq=1368 Ack=715 Win=65616 Len=1367 [TCP segment of a reassembled PDU]"
"111","5.833313","188.120.225.17","10.200.2.252","TCP","1421","8080  >  61559 [ACK] Seq=2735 Ack=715 Win=65616 Len=1367 [TCP segment of a reassembled PDU]"
"112","5.833423","188.120.225.17","10.200.2.252","TCP","59","8080  >  61559 [PSH, ACK] Seq=4102 Ack=715 Win=65616 Len=5 [TCP segment of a reassembled PDU]"
"113","5.834062","10.200.2.252","188.120.225.17","TCP","54","61559  >  8080 [ACK] Seq=715 Ack=2735 Win=40960 Len=0"
"114","5.834142","10.200.2.252","188.120.225.17","TCP","54","61559  >  8080 [ACK] Seq=715 Ack=4107 Win=40960 Len=0"
"115","6.209242","188.120.225.17","10.200.2.252","TCP","1421","8080  >  61559 [ACK] Seq=4107 Ack=715 Win=65616 Len=1367 [TCP segment of a reassembled PDU]"
"116","6.223099","188.120.225.17","10.200.2.252","TCP","1421","8080  >  61559 [ACK] Seq=5474 Ack=715 Win=65616 Len=1367 [TCP segment of a reassembled PDU]"
"117","6.223405","188.120.225.17","10.200.2.252","TCP","1421","8080  >  61559 [ACK] Seq=6841 Ack=715 Win=65616 Len=1367 [TCP segment of a reassembled PDU]"
"118","6.223595","188.120.225.17","10.200.2.252","TCP","1421","8080  >  61559 [ACK] Seq=8208 Ack=715 Win=65616 Len=1367 [TCP segment of a reassembled PDU]"
"119","6.223771","188.120.225.17","10.200.2.252","TCP","1421","8080  >  61559 [ACK] Seq=9575 Ack=715 Win=65616 Len=1367 [TCP segment of a reassembled PDU]"
"120","6.224128","10.200.2.252","188.120.225.17","TCP","54","61559  >  8080 [ACK] Seq=715 Ack=6841 Win=40960 Len=0"
"121","6.224210","10.200.2.252","188.120.225.17","TCP","54","61559  >  8080 [ACK] Seq=715 Ack=9575 Win=40960 Len=0"
"122","6.237205","188.120.225.17","10.200.2.252","TCP","1421","8080  >  61559 [ACK] Seq=10942 Ack=715 Win=65616 Len=1367 [TCP segment of a reassembled PDU]"
"123","6.237429","188.120.225.17","10.200.2.252","TCP","339","8080  >  61559 [ACK] Seq=12309 Ack=715 Win=65616 Len=285 [TCP segment of a reassembled PDU]"
"124","6.238221","10.200.2.252","188.120.225.17","TCP","54","61559  >  8080 [ACK] Seq=715 Ack=12309 Win=40960 Len=0"
"125","6.398204","188.120.225.17","10.200.2.252","TCP","1421","8080  >  61559 [ACK] Seq=12594 Ack=715 Win=65616 Len=1367 [TCP segment of a reassembled PDU]"
"126","6.398447","188.120.225.17","10.200.2.252","TCP","1421","8080  >  61559 [ACK] Seq=13961 Ack=715 Win=65616 Len=1367 [TCP segment of a reassembled PDU]"
"127","6.398635","188.120.225.17","10.200.2.252","TCP","1421","8080  >  61559 [ACK] Seq=15328 Ack=715 Win=65616 Len=1367 [TCP segment of a reassembled PDU]"
"128","6.399222","10.200.2.252","188.120.225.17","TCP","54","61559  >  8080 [ACK] Seq=715 Ack=13961 Win=40960 Len=0"
"129","6.399302","10.200.2.252","188.120.225.17","TCP","54","61559  >  8080 [ACK] Seq=715 Ack=16695 Win=40960 Len=0"
"130","6.411943","188.120.225.17","10.200.2.252","TCP","1421","8080  >  61559 [ACK] Seq=16695 Ack=715 Win=65616 Len=1367 [TCP segment of a reassembled PDU]"
"131","6.413723","188.120.225.17","10.200.2.252","TCP","1421","8080  >  61559 [ACK] Seq=18062 Ack=715 Win=65616 Len=1367 [TCP segment of a reassembled PDU]"
"132","6.414026","188.120.225.17","10.200.2.252","TCP","1421","8080  >  61559 [ACK] Seq=19429 Ack=715 Win=65616 Len=1367 [TCP segment of a reassembled PDU]"
"133","6.414224","188.120.225.17","10.200.2.252","TCP","1421","8080  >  61559 [ACK] Seq=20796 Ack=715 Win=65616 Len=1367 [TCP segment of a reassembled PDU]"
"134","6.414789","10.200.2.252","188.120.225.17","TCP","54","61559  >  8080 [ACK] Seq=715 Ack=19429 Win=40960 Len=0"
"135","6.414867","10.200.2.252","188.120.225.17","TCP","54","61559  >  8080 [ACK] Seq=715 Ack=22163 Win=40960 Len=0"
"136","6.426086","188.120.225.17","10.200.2.252","TCP","1421","8080  >  61559 [ACK] Seq=22163 Ack=715 Win=65616 Len=1367 [TCP segment of a reassembled PDU]"
"137","6.426382","188.120.225.17","10.200.2.252","TCP","1421","8080  >  61559 [ACK] Seq=23530 Ack=715 Win=65616 Len=1367 [TCP segment of a reassembled PDU]"
"138","6.426569","188.120.225.17","10.200.2.252","TCP","1421","8080  >  61559 [ACK] Seq=24897 Ack=715 Win=65616 Len=1367 [TCP segment of a reassembled PDU]"
"139","6.426753","188.120.225.17","10.200.2.252","TCP","1421","8080  >  61559 [ACK] Seq=26264 Ack=715 Win=65616 Len=1367 [TCP segment of a reassembled PDU]"
"140","6.427147","10.200.2.252","188.120.225.17","TCP","54","61559  >  8080 [ACK] Seq=715 Ack=24897 Win=40960 Len=0"
"141","6.427225","10.200.2.252","188.120.225.17","TCP","54","61559  >  8080 [ACK] Seq=715 Ack=27631 Win=40960 Len=0"
"142","6.427745","188.120.225.17","10.200.2.252","TCP","1421","8080  >  61559 [ACK] Seq=27631 Ack=715 Win=65616 Len=1367 [TCP segment of a reassembled PDU]"
"143","6.573801","188.120.225.17","10.200.2.252","TCP","1421","8080  >  61559 [ACK] Seq=28998 Ack=715 Win=65616 Len=1367 [TCP segment of a reassembled PDU]"
"144","6.574807","10.200.2.252","188.120.225.17","TCP","54","61559  >  8080 [ACK] Seq=715 Ack=30365 Win=40960 Len=0"
"145","6.585773","188.120.225.17","10.200.2.252","TCP","1421","8080  >  61559 [ACK] Seq=30365 Ack=715 Win=65616 Len=1367 [TCP segment of a reassembled PDU]"
"146","6.586045","188.120.225.17","10.200.2.252","TCP","624","8080  >  61559 [ACK] Seq=31732 Ack=715 Win=65616 Len=570 [TCP segment of a reassembled PDU]"
"147","6.586219","188.120.225.17","10.200.2.252","TCP","1421","8080  >  61559 [ACK] Seq=32302 Ack=715 Win=65616 Len=1367 [TCP segment of a reassembled PDU]"
"148","6.586405","188.120.225.17","10.200.2.252","TCP","1421","8080  >  61559 [ACK] Seq=33669 Ack=715 Win=65616 Len=1367 [TCP segment of a reassembled PDU]"
"149","6.586580","188.120.225.17","10.200.2.252","TCP","1421","8080  >  61559 [ACK] Seq=35036 Ack=715 Win=65616 Len=1367 [TCP segment of a reassembled PDU]"
"150","6.586800","10.200.2.252","188.120.225.17","TCP","54","61559  >  8080 [ACK] Seq=715 Ack=32302 Win=40960 Len=0"
"151","6.587735","10.200.2.252","188.120.225.17","TCP","54","61559  >  8080 [ACK] Seq=715 Ack=35036 Win=40960 Len=0"
"152","6.587757","188.120.225.17","10.200.2.252","TCP","1421","8080  >  61559 [ACK] Seq=36403 Ack=715 Win=65616 Len=1367 [TCP segment of a reassembled PDU]"
"153","6.588631","10.200.2.252","188.120.225.17","TCP","54","61559  >  8080 [ACK] Seq=715 Ack=37770 Win=40960 Len=0"
"154","6.600881","188.120.225.17","10.200.2.252","TCP","1421","8080  >  61559 [ACK] Seq=37770 Ack=715 Win=65616 Len=1367 [TCP segment of a reassembled PDU]"
"155","6.601183","188.120.225.17","10.200.2.252","TCP","1421","8080  >  61559 [ACK] Seq=39137 Ack=715 Win=65616 Len=1367 [TCP segment of a reassembled PDU]"
"156","6.601401","188.120.225.17","10.200.2.252","TCP","1421","8080  >  61559 [ACK] Seq=40504 Ack=715 Win=65616 Len=1367 [TCP segment of a reassembled PDU]"
"157","6.601576","188.120.225.17","10.200.2.252","TCP","1421","8080  >  61559 [ACK] Seq=41871 Ack=715 Win=65616 Len=1367 [TCP segment of a reassembled PDU]"
"158","6.601814","188.120.225.17","10.200.2.252","TCP","1421","8080  >  61559 [ACK] Seq=43238 Ack=715 Win=65616 Len=1367 [TCP segment of a reassembled PDU]"
"159","6.601901","10.200.2.252","188.120.225.17","TCP","54","61559  >  8080 [ACK] Seq=715 Ack=40504 Win=40960 Len=0"
"160","6.602077","188.120.225.17","10.200.2.252","TCP","1421","8080  >  61559 [ACK] Seq=44605 Ack=715 Win=65616 Len=1367 [TCP segment of a reassembled PDU]"
"161","6.602262","188.120.225.17","10.200.2.252","TCP","1421","8080  >  61559 [ACK] Seq=45972 Ack=715 Win=65616 Len=1367 [TCP segment of a reassembled PDU]"
"162","6.602450","188.120.225.17","10.200.2.252","TCP","1421","8080  >  61559 [ACK] Seq=47339 Ack=715 Win=65616 Len=1367 [TCP segment of a reassembled PDU]"
"163","6.602625","188.120.225.17","10.200.2.252","TCP","1421","8080  >  61559 [ACK] Seq=48706 Ack=715 Win=65616 Len=1367 [TCP segment of a reassembled PDU]"
"164","6.602805","188.120.225.17","10.200.2.252","TCP","1421","8080  >  61559 [ACK] Seq=50073 Ack=715 Win=65616 Len=1367 [TCP segment of a reassembled PDU]"
"165","6.602837","10.200.2.252","188.120.225.17","TCP","54","61559  >  8080 [ACK] Seq=715 Ack=43238 Win=40960 Len=0"
"166","6.602899","10.200.2.252","188.120.225.17","TCP","54","61559  >  8080 [ACK] Seq=715 Ack=45972 Win=40960 Len=0"
"167","6.602992","188.120.225.17","10.200.2.252","TCP","1421","8080  >  61559 [ACK] Seq=51440 Ack=715 Win=65616 Len=1367 [TCP segment of a reassembled PDU]"
"168","6.603816","10.200.2.252","188.120.225.17","TCP","54","61559  >  8080 [ACK] Seq=715 Ack=48706 Win=40960 Len=0"
"169","6.603893","10.200.2.252","188.120.225.17","TCP","54","61559  >  8080 [ACK] Seq=715 Ack=51440 Win=40960 Len=0"
"170","6.615408","188.120.225.17","10.200.2.252","TCP","1421","8080  >  61559 [ACK] Seq=52807 Ack=715 Win=65616 Len=1367 [TCP segment of a reassembled PDU]"
"171","6.615658","188.120.225.17","10.200.2.252","TCP","1421","8080  >  61559 [ACK] Seq=54174 Ack=715 Win=65616 Len=1367 [TCP segment of a reassembled PDU]"
"172","6.615874","188.120.225.17","10.200.2.252","TCP","1421","8080  >  61559 [ACK] Seq=55541 Ack=715 Win=65616 Len=1367 [TCP segment of a reassembled PDU]"
"173","6.616050","188.120.225.17","10.200.2.252","TCP","1421","8080  >  61559 [ACK] Seq=56908 Ack=715 Win=65616 Len=1367 [TCP segment of a reassembled PDU]"
"174","6.616224","188.120.225.17","10.200.2.252","TCP","1421","8080  >  61559 [ACK] Seq=58275 Ack=715 Win=65616 Len=1367 [TCP segment of a reassembled PDU]"
"175","6.616436","10.200.2.252","188.120.225.17","TCP","54","61559  >  8080 [ACK] Seq=715 Ack=54174 Win=40960 Len=0"
"176","6.616510","10.200.2.252","188.120.225.17","TCP","54","61559  >  8080 [ACK] Seq=715 Ack=56908 Win=40960 Len=0"
"177","6.617404","10.200.2.252","188.120.225.17","TCP","54","61559  >  8080 [ACK] Seq=715 Ack=59642 Win=40960 Len=0"
"178","6.748496","188.120.225.17","10.200.2.252","TCP","1421","8080  >  61559 [ACK] Seq=59642 Ack=715 Win=65616 Len=1367 [TCP segment of a reassembled PDU]"
"179","6.748734","188.120.225.17","10.200.2.252","TCP","1421","8080  >  61559 [ACK] Seq=61009 Ack=715 Win=65616 Len=1367 [TCP segment of a reassembled PDU]"
"180","6.748932","188.120.225.17","10.200.2.252","TCP","1421","8080  >  61559 [ACK] Seq=62376 Ack=715 Win=65616 Len=1367 [TCP segment of a reassembled PDU]"
"181","6.749496","10.200.2.252","188.120.225.17","TCP","54","61559  >  8080 [ACK] Seq=715 Ack=62376 Win=40960 Len=0"
"182","6.761799","188.120.225.17","10.200.2.252","TCP","1421","8080  >  61559 [ACK] Seq=63743 Ack=715 Win=65616 Len=1367 [TCP segment of a reassembled PDU]"
"183","6.762102","188.120.225.17","10.200.2.252","TCP","1421","8080  >  61559 [ACK] Seq=65110 Ack=715 Win=65616 Len=1367 [TCP segment of a reassembled PDU]"
"184","6.762281","188.120.225.17","10.200.2.252","TCP","1421","8080  >  61559 [ACK] Seq=66477 Ack=715 Win=65616 Len=1367 [TCP segment of a reassembled PDU]"
"185","6.762453","188.120.225.17","10.200.2.252","TCP","1194","8080  >  61559 [ACK] Seq=67844 Ack=715 Win=65616 Len=1140 [TCP segment of a reassembled PDU]"
"186","6.762814","10.200.2.252","188.120.225.17","TCP","54","61559  >  8080 [ACK] Seq=715 Ack=65110 Win=40960 Len=0"
"187","6.762890","10.200.2.252","188.120.225.17","TCP","54","61559  >  8080 [ACK] Seq=715 Ack=67844 Win=40960 Len=0"
"188","6.774100","188.120.225.17","10.200.2.252","TCP","1421","8080  >  61559 [ACK] Seq=68984 Ack=715 Win=65616 Len=1367 [TCP segment of a reassembled PDU]"
"189","6.774385","188.120.225.17","10.200.2.252","TCP","1421","8080  >  61559 [ACK] Seq=70351 Ack=715 Win=65616 Len=1367 [TCP segment of a reassembled PDU]"
"190","6.774685","188.120.225.17","10.200.2.252","TCP","1421","8080  >  61559 [ACK] Seq=71718 Ack=715 Win=65616 Len=1367 [TCP segment of a reassembled PDU]"
"191","6.774908","188.120.225.17","10.200.2.252","TCP","1421","8080  >  61559 [ACK] Seq=73085 Ack=715 Win=65616 Len=1367 [TCP segment of a reassembled PDU]"
"192","6.775094","188.120.225.17","10.200.2.252","TCP","1421","8080  >  61559 [ACK] Seq=74452 Ack=715 Win=65616 Len=1367 [TCP segment of a reassembled PDU]"
"193","6.775120","10.200.2.252","188.120.225.17","TCP","54","61559  >  8080 [ACK] Seq=715 Ack=70351 Win=40960 Len=0"
"194","6.775194","10.200.2.252","188.120.225.17","TCP","54","61559  >  8080 [ACK] Seq=715 Ack=73085 Win=40960 Len=0"
"195","6.775433","188.120.225.17","10.200.2.252","TCP","1421","8080  >  61559 [ACK] Seq=75819 Ack=715 Win=65616 Len=1367 [TCP segment of a reassembled PDU]"
"196","6.775981","188.120.225.17","10.200.2.252","TCP","1421","8080  >  61559 [ACK] Seq=77186 Ack=715 Win=65616 Len=1367 [TCP segment of a reassembled PDU]"
"197","6.776105","10.200.2.252","188.120.225.17","TCP","54","61559  >  8080 [ACK] Seq=715 Ack=75819 Win=40960 Len=0"
"198","6.776144","188.120.225.17","10.200.2.252","TCP","231","8080  >  61559 [ACK] Seq=78553 Ack=715 Win=65616 Len=177 [TCP segment of a reassembled PDU]"
"199","6.777019","10.200.2.252","188.120.225.17","TCP","54","61559  >  8080 [ACK] Seq=715 Ack=78553 Win=40960 Len=0"
"200","6.788861","188.120.225.17","10.200.2.252","TCP","1421","8080  >  61559 [ACK] Seq=78730 Ack=715 Win=65616 Len=1367 [TCP segment of a reassembled PDU]"
"201","6.789771","188.120.225.17","10.200.2.252","TCP","1421","8080  >  61559 [ACK] Seq=80097 Ack=715 Win=65616 Len=1367 [TCP segment of a reassembled PDU]"
"202","6.789888","10.200.2.252","188.120.225.17","TCP","54","61559  >  8080 [ACK] Seq=715 Ack=80097 Win=40960 Len=0"
"203","6.794755","188.120.225.17","10.200.2.252","TCP","1421","8080  >  61559 [ACK] Seq=81464 Ack=715 Win=65616 Len=1367 [TCP segment of a reassembled PDU]"
"204","6.795034","188.120.225.17","10.200.2.252","TCP","1421","8080  >  61559 [ACK] Seq=82831 Ack=715 Win=65616 Len=1367 [TCP segment of a reassembled PDU]"
"205","6.795208","188.120.225.17","10.200.2.252","TCP","1421","8080  >  61559 [ACK] Seq=84198 Ack=715 Win=65616 Len=1367 [TCP segment of a reassembled PDU]"
"206","6.795440","188.120.225.17","10.200.2.252","TCP","1421","8080  >  61559 [ACK] Seq=85565 Ack=715 Win=65616 Len=1367 [TCP segment of a reassembled PDU]"
"207","6.795630","188.120.225.17","10.200.2.252","TCP","1421","8080  >  61559 [ACK] Seq=86932 Ack=715 Win=65616 Len=1367 [TCP segment of a reassembled PDU]"
"208","6.795768","10.200.2.252","188.120.225.17","TCP","54","61559  >  8080 [ACK] Seq=715 Ack=82831 Win=40960 Len=0"
"209","6.795834","10.200.2.252","188.120.225.17","TCP","54","61559  >  8080 [ACK] Seq=715 Ack=85565 Win=40960 Len=0"
"210","6.795860","188.120.225.17","10.200.2.252","TCP","1421","8080  >  61559 [ACK] Seq=88299 Ack=715 Win=65616 Len=1367 [TCP segment of a reassembled PDU]"
"211","6.796045","188.120.225.17","10.200.2.252","TCP","1421","8080  >  61559 [ACK] Seq=89666 Ack=715 Win=65616 Len=1367 [TCP segment of a reassembled PDU]"
"212","6.796750","10.200.2.252","188.120.225.17","TCP","54","61559  >  8080 [ACK] Seq=715 Ack=88299 Win=40960 Len=0"
"213","6.796826","10.200.2.252","188.120.225.17","TCP","54","61559  >  8080 [ACK] Seq=715 Ack=91033 Win=40960 Len=0"
"214","6.803482","188.120.225.17","10.200.2.252","TCP","1421","8080  >  61559 [ACK] Seq=91033 Ack=715 Win=65616 Len=1367 [TCP segment of a reassembled PDU]"
"215","6.840345","188.120.225.17","10.200.2.252","TCP","1421","8080  >  61559 [ACK] Seq=92400 Ack=715 Win=65616 Len=1367 [TCP segment of a reassembled PDU]"
"216","6.840586","188.120.225.17","10.200.2.252","TCP","1421","8080  >  61559 [ACK] Seq=93767 Ack=715 Win=65616 Len=1367 [TCP segment of a reassembled PDU]"
"217","6.840805","188.120.225.17","10.200.2.252","TCP","1421","8080  >  61559 [ACK] Seq=95134 Ack=715 Win=65616 Len=1367 [TCP segment of a reassembled PDU]"
"218","6.840981","188.120.225.17","10.200.2.252","TCP","1421","8080  >  61559 [ACK] Seq=96501 Ack=715 Win=65616 Len=1367 [TCP segment of a reassembled PDU]"
"219","6.841153","188.120.225.17","10.200.2.252","TCP","1421","8080  >  61559 [ACK] Seq=97868 Ack=715 Win=65616 Len=1367 [TCP segment of a reassembled PDU]"
"220","6.841373","10.200.2.252","188.120.225.17","TCP","54","61559  >  8080 [ACK] Seq=715 Ack=93767 Win=40960 Len=0"
"221","6.841448","10.200.2.252","188.120.225.17","TCP","54","61559  >  8080 [ACK] Seq=715 Ack=96501 Win=40960 Len=0"
"222","6.842342","10.200.2.252","188.120.225.17","TCP","54","61559  >  8080 [ACK] Seq=715 Ack=99235 Win=40960 Len=0"
"223","6.854457","188.120.225.17","10.200.2.252","TCP","1421","8080  >  61559 [ACK] Seq=99235 Ack=715 Win=65616 Len=1367 [TCP segment of a reassembled PDU]"
"224","6.925226","188.120.225.17","10.200.2.252","TCP","1421","8080  >  61559 [ACK] Seq=100602 Ack=715 Win=65616 Len=1367 [TCP segment of a reassembled PDU]"
"225","6.926115","10.200.2.252","188.120.225.17","TCP","54","61559  >  8080 [ACK] Seq=715 Ack=101969 Win=40960 Len=0"
"226","6.939168","188.120.225.17","10.200.2.252","TCP","1421","8080  >  61559 [ACK] Seq=101969 Ack=715 Win=65616 Len=1367 [TCP segment of a reassembled PDU]"
"227","6.939273","188.120.225.17","10.200.2.252","TCP","1421","8080  >  61559 [ACK] Seq=103336 Ack=715 Win=65616 Len=1367 [TCP segment of a reassembled PDU]"
"228","6.939406","188.120.225.17","10.200.2.252","TCP","1421","8080  >  61559 [ACK] Seq=104703 Ack=715 Win=65616 Len=1367 [TCP segment of a reassembled PDU]"
"229","6.939470","188.120.225.17","10.200.2.252","TCP","1421","8080  >  61559 [ACK] Seq=106070 Ack=715 Win=65616 Len=1367 [TCP segment of a reassembled PDU]"
"230","6.940042","10.200.2.252","188.120.225.17","TCP","54","61559  >  8080 [ACK] Seq=715 Ack=104703 Win=40960 Len=0"
"231","6.940072","10.200.2.252","188.120.225.17","TCP","54","61559  >  8080 [ACK] Seq=715 Ack=107437 Win=40960 Len=0"
"232","6.948949","188.120.225.17","10.200.2.252","TCP","1421","8080  >  61559 [ACK] Seq=107437 Ack=715 Win=65616 Len=1367 [TCP segment of a reassembled PDU]"
"233","6.949048","188.120.225.17","10.200.2.252","TCP","1421","8080  >  61559 [ACK] Seq=108804 Ack=715 Win=65616 Len=1367 [TCP segment of a reassembled PDU]"
"234","6.949104","188.120.225.17","10.200.2.252","TCP","1194","8080  >  61559 [ACK] Seq=110171 Ack=715 Win=65616 Len=1140 [TCP segment of a reassembled PDU]"
"235","6.949194","188.120.225.17","10.200.2.252","TCP","1421","8080  >  61559 [ACK] Seq=111311 Ack=715 Win=65616 Len=1367 [TCP segment of a reassembled PDU]"
"236","6.949827","10.200.2.252","188.120.225.17","TCP","54","61559  >  8080 [ACK] Seq=715 Ack=110171 Win=40960 Len=0"
"237","6.949862","10.200.2.252","188.120.225.17","TCP","54","61559  >  8080 [ACK] Seq=715 Ack=112678 Win=40960 Len=0"
"238","6.953010","188.120.225.17","10.200.2.252","TCP","1421","8080  >  61559 [ACK] Seq=112678 Ack=715 Win=65616 Len=1367 [TCP segment of a reassembled PDU]"
"239","6.962077","188.120.225.17","10.200.2.252","TCP","1421","8080  >  61559 [ACK] Seq=114045 Ack=715 Win=65616 Len=1367 [TCP segment of a reassembled PDU]"
"240","6.962404","188.120.225.17","10.200.2.252","TCP","1421","8080  >  61559 [ACK] Seq=115412 Ack=715 Win=65616 Len=1367 [TCP segment of a reassembled PDU]"
"241","6.962496","188.120.225.17","10.200.2.252","TCP","1421","8080  >  61559 [ACK] Seq=116779 Ack=715 Win=65616 Len=1367 [TCP segment of a reassembled PDU]"
"242","6.962954","10.200.2.252","188.120.225.17","TCP","54","61559  >  8080 [ACK] Seq=715 Ack=115412 Win=40960 Len=0"
"243","6.962989","10.200.2.252","188.120.225.17","TCP","54","61559  >  8080 [ACK] Seq=715 Ack=118146 Win=40960 Len=0"
"244","6.967044","188.120.225.17","10.200.2.252","TCP","1421","8080  >  61559 [ACK] Seq=118146 Ack=715 Win=65616 Len=1367 [TCP segment of a reassembled PDU]"
"245","6.977778","188.120.225.17","10.200.2.252","TCP","1421","8080  >  61559 [ACK] Seq=119513 Ack=715 Win=65616 Len=1367 [TCP segment of a reassembled PDU]"
"246","6.978029","188.120.225.17","10.200.2.252","TCP","231","8080  >  61559 [ACK] Seq=120880 Ack=715 Win=65616 Len=177 [TCP segment of a reassembled PDU]"
"247","6.978205","188.120.225.17","10.200.2.252","TCP","1421","8080  >  61559 [ACK] Seq=121057 Ack=715 Win=65616 Len=1367 [TCP segment of a reassembled PDU]"
"248","6.978451","188.120.225.17","10.200.2.252","TCP","1421","8080  >  61559 [ACK] Seq=122424 Ack=715 Win=65616 Len=1367 [TCP segment of a reassembled PDU]"
"249","6.978667","188.120.225.17","10.200.2.252","TCP","1421","8080  >  61559 [ACK] Seq=123791 Ack=715 Win=65616 Len=1367 [TCP segment of a reassembled PDU]"
"250","6.978797","10.200.2.252","188.120.225.17","TCP","54","61559  >  8080 [ACK] Seq=715 Ack=120880 Win=40960 Len=0"
"251","6.978857","188.120.225.17","10.200.2.252","TCP","1421","8080  >  61559 [ACK] Seq=125158 Ack=715 Win=65616 Len=1367 [TCP segment of a reassembled PDU]"
"252","6.978869","10.200.2.252","188.120.225.17","TCP","54","61559  >  8080 [ACK] Seq=715 Ack=122424 Win=40960 Len=0"
"253","6.979041","188.120.225.17","10.200.2.252","TCP","1421","8080  >  61559 [ACK] Seq=126525 Ack=715 Win=65616 Len=1367 [TCP segment of a reassembled PDU]"
"254","6.979223","188.120.225.17","10.200.2.252","TCP","1421","8080  >  61559 [ACK] Seq=127892 Ack=715 Win=65616 Len=1367 [TCP segment of a reassembled PDU]"
"255","6.979397","188.120.225.17","10.200.2.252","TCP","1421","8080  >  61559 [ACK] Seq=129259 Ack=715 Win=65616 Len=1367 [TCP segment of a reassembled PDU]"
"256","6.979804","10.200.2.252","188.120.225.17","TCP","54","61559  >  8080 [ACK] Seq=715 Ack=125158 Win=40960 Len=0"
"257","6.979880","10.200.2.252","188.120.225.17","TCP","54","61559  >  8080 [ACK] Seq=715 Ack=127892 Win=40960 Len=0"
"258","6.979921","10.200.2.252","188.120.225.17","TCP","54","61559  >  8080 [ACK] Seq=715 Ack=130626 Win=40960 Len=0"
"259","6.981195","188.120.225.17","10.200.2.252","TCP","1421","8080  >  61559 [ACK] Seq=130626 Ack=715 Win=65616 Len=1367 [TCP segment of a reassembled PDU]"
"260","7.017405","188.120.225.17","10.200.2.252","TCP","1421","8080  >  61559 [ACK] Seq=131993 Ack=715 Win=65616 Len=1367 [TCP segment of a reassembled PDU]"
"261","7.018413","10.200.2.252","188.120.225.17","TCP","54","61559  >  8080 [ACK] Seq=715 Ack=133360 Win=40960 Len=0"
"262","7.027914","188.120.225.17","10.200.2.252","TCP","1421","8080  >  61559 [ACK] Seq=133360 Ack=715 Win=65616 Len=1367 [TCP segment of a reassembled PDU]"
"263","7.028218","188.120.225.17","10.200.2.252","TCP","1421","8080  >  61559 [ACK] Seq=134727 Ack=715 Win=65616 Len=1367 [TCP segment of a reassembled PDU]"
"264","7.028416","188.120.225.17","10.200.2.252","TCP","1421","8080  >  61559 [ACK] Seq=136094 Ack=715 Win=65616 Len=1367 [TCP segment of a reassembled PDU]"
"265","7.028592","188.120.225.17","10.200.2.252","TCP","1421","8080  >  61559 [ACK] Seq=137461 Ack=715 Win=65616 Len=1367 [TCP segment of a reassembled PDU]"
"266","7.028932","10.200.2.252","188.120.225.17","TCP","54","61559  >  8080 [ACK] Seq=715 Ack=136094 Win=40960 Len=0"
"267","7.029846","10.200.2.252","188.120.225.17","TCP","54","61559  >  8080 [ACK] Seq=715 Ack=138828 Win=40960 Len=0"
"268","7.031208","188.120.225.17","10.200.2.252","TCP","1421","8080  >  61559 [ACK] Seq=138828 Ack=715 Win=65616 Len=1367 [TCP segment of a reassembled PDU]"
"269","7.099486","188.120.225.17","10.200.2.252","TCP","1421","8080  >  61559 [ACK] Seq=140195 Ack=715 Win=65616 Len=1367 [TCP segment of a reassembled PDU]"
"270","7.100490","10.200.2.252","188.120.225.17","TCP","54","61559  >  8080 [ACK] Seq=715 Ack=141562 Win=40960 Len=0"
"271","7.113228","188.120.225.17","10.200.2.252","TCP","1421","8080  >  61559 [ACK] Seq=141562 Ack=715 Win=65616 Len=1367 [TCP segment of a reassembled PDU]"
"272","7.122354","188.120.225.17","10.200.2.252","TCP","1421","8080  >  61559 [ACK] Seq=142929 Ack=715 Win=65616 Len=1367 [TCP segment of a reassembled PDU]"
"273","7.122653","188.120.225.17","10.200.2.252","TCP","1421","8080  >  61559 [ACK] Seq=144296 Ack=715 Win=65616 Len=1367 [TCP segment of a reassembled PDU]"
"274","7.122843","188.120.225.17","10.200.2.252","TCP","1421","8080  >  61559 [ACK] Seq=145663 Ack=715 Win=65616 Len=1367 [TCP segment of a reassembled PDU]"
"275","7.123418","10.200.2.252","188.120.225.17","TCP","54","61559  >  8080 [ACK] Seq=715 Ack=144296 Win=40960 Len=0"
"276","7.123493","10.200.2.252","188.120.225.17","TCP","54","61559  >  8080 [ACK] Seq=715 Ack=147030 Win=40960 Len=0"
"277","7.127903","188.120.225.17","10.200.2.252","TCP","1421","8080  >  61559 [ACK] Seq=147030 Ack=715 Win=65616 Len=1367 [TCP segment of a reassembled PDU]"
"278","7.128696","188.120.225.17","10.200.2.252","TCP","1421","8080  >  61559 [ACK] Seq=148397 Ack=715 Win=65616 Len=1367 [TCP segment of a reassembled PDU]"
"279","7.128953","188.120.225.17","10.200.2.252","TCP","1421","8080  >  61559 [ACK] Seq=149764 Ack=715 Win=65616 Len=1367 [TCP segment of a reassembled PDU]"
"280","7.129127","188.120.225.17","10.200.2.252","TCP","1421","8080  >  61559 [ACK] Seq=151131 Ack=715 Win=65616 Len=1367 [TCP segment of a reassembled PDU]"
"281","7.129695","10.200.2.252","188.120.225.17","TCP","54","61559  >  8080 [ACK] Seq=715 Ack=149764 Win=40960 Len=0"
"282","7.129771","10.200.2.252","188.120.225.17","TCP","54","61559  >  8080 [ACK] Seq=715 Ack=152498 Win=40960 Len=0"
"283","7.136164","188.120.225.17","10.200.2.252","TCP","1194","8080  >  61559 [ACK] Seq=152498 Ack=715 Win=65616 Len=1140 [TCP segment of a reassembled PDU]"
