"No.","Time","Source","Destination","Protocol","Length","Info"
"1","0.000000","192.168.137.83","224.0.0.22","IGMPv3","60","Membership Report / Join group 224.0.0.252 for any sources"
"2","0.000790","192.168.137.83","224.0.0.22","IGMPv3","60","Membership Report / Leave group 224.0.0.252"
"3","0.003006","192.168.137.83","224.0.0.22","IGMPv3","60","Membership Report / Join group 224.0.0.252 for any sources"
"4","0.003007","192.168.137.83","224.0.0.22","IGMPv3","60","Membership Report / Leave group 224.0.0.252"
"5","0.003008","192.168.137.83","224.0.0.22","IGMPv3","60","Membership Report / Join group 224.0.0.252 for any sources"
"6","0.003783","192.168.137.83","224.0.0.252","LLMNR","71","Standard query 0x9cfb ANY Pyndrine-PC"
"7","0.026949","192.168.137.83","224.0.0.22","IGMPv3","60","Membership Report / Join group 224.0.0.252 for any sources"
"8","0.105113","192.168.137.83","224.0.0.252","LLMNR","71","Standard query 0x9cfb ANY Pyndrine-PC"
"9","0.716519","192.168.137.83","192.168.137.1","DNS","77","Standard query 0x30f6 A isatap.mshome.net"
"10","0.720191","192.168.137.1","192.168.137.83","DNS","77","Standard query response 0x30f6 No such name A isatap.mshome.net"
"11","0.721006","192.168.137.83","224.0.0.252","LLMNR","66","Standard query 0xa5bd A isatap"
"12","0.822817","192.168.137.83","224.0.0.252","LLMNR","66","Standard query 0xa5bd A isatap"
"13","0.976835","192.168.137.83","192.168.137.1","DNS","91","Standard query 0x3def SRV _ldap._tcp.dc._msdcs.mshome.net"
"14","0.977396","192.168.137.1","192.168.137.83","DNS","91","Standard query response 0x3def No such name SRV _ldap._tcp.dc._msdcs.mshome.net"
"15","0.978735","192.168.137.83","192.168.137.1","DNS","91","Standard query 0x80dc SRV _ldap._tcp.dc._msdcs.mshome.net"
"16","0.979235","192.168.137.1","192.168.137.83","DNS","91","Standard query response 0x80dc No such name SRV _ldap._tcp.dc._msdcs.mshome.net"
"17","1.384064","192.168.137.83","192.168.137.255","NBNS","110","Registration NB PYNDRINE-PC<00>"
"18","1.384855","192.168.137.83","192.168.137.255","NBNS","110","Registration NB WORKGROUP<00>"
"19","1.394602","192.168.137.83","192.168.137.255","NBNS","110","Registration NB PYNDRINE-PC<20>"
"20","1.494067","192.168.137.83","192.168.137.1","DNS","91","Standard query 0xf076 SRV _ldap._tcp.dc._msdcs.mshome.net"
"21","1.495015","192.168.137.1","192.168.137.83","DNS","91","Standard query response 0xf076 No such name SRV _ldap._tcp.dc._msdcs.mshome.net"
"22","1.789027","192.168.137.83","192.168.137.255","NBNS","92","Name query NB ISATAP<00>"
"23","2.147832","192.168.137.83","192.168.137.255","NBNS","110","Registration NB PYNDRINE-PC<20>"
"24","2.148639","192.168.137.83","192.168.137.255","NBNS","110","Registration NB WORKGROUP<00>"
"25","2.148639","192.168.137.83","192.168.137.255","NBNS","110","Registration NB PYNDRINE-PC<00>"
"26","2.553409","192.168.137.83","192.168.137.255","NBNS","92","Name query NB ISATAP<00>"
"27","2.903829","192.168.137.83","192.168.137.255","NBNS","110","Registration NB PYNDRINE-PC<00>"
"28","2.904705","192.168.137.83","192.168.137.255","NBNS","110","Registration NB WORKGROUP<00>"
"29","2.904707","192.168.137.83","192.168.137.255","NBNS","110","Registration NB PYNDRINE-PC<20>"
"30","3.019670","192.168.137.83","224.0.0.22","IGMPv3","60","Membership Report / Leave group 224.0.0.252"
"31","3.021605","192.168.137.83","224.0.0.22","IGMPv3","60","Membership Report / Join group 224.0.0.252 for any sources"
"32","3.021606","192.168.137.83","224.0.0.252","LLMNR","71","Standard query 0xc715 ANY Pyndrine-PC"
"33","3.026256","192.168.137.83","255.255.255.255","DHCP","342","DHCP Inform   - Transaction ID 0xe878647b"
"34","3.037660","192.168.137.83","192.168.137.1","DNS","75","Standard query 0x6dd4 A wpad.mshome.net"
"35","3.038090","192.168.137.1","192.168.137.83","DNS","75","Standard query response 0x6dd4 No such name A wpad.mshome.net"
"36","3.039285","192.168.137.83","224.0.0.252","LLMNR","64","Standard query 0x9d1d A wpad"
"37","3.114631","192.168.137.83","224.0.0.252","LLMNR","71","Standard query 0xc715 ANY Pyndrine-PC"
"38","3.134740","192.168.137.83","224.0.0.252","LLMNR","64","Standard query 0x9d1d A wpad"
"39","3.304403","192.168.137.83","192.168.137.1","DNS","77","Standard query 0x3c0a A isatap.mshome.net"
"40","3.304813","192.168.137.1","192.168.137.83","DNS","77","Standard query response 0x3c0a No such name A isatap.mshome.net"
"41","3.305986","192.168.137.83","224.0.0.252","LLMNR","66","Standard query 0x8219 A isatap"
"42","3.334026","192.168.137.83","192.168.137.255","NBNS","92","Name query NB WPAD<00>"
"43","3.404739","192.168.137.83","224.0.0.252","LLMNR","66","Standard query 0x8219 A isatap"
"44","3.513775","192.168.137.83","224.0.0.22","IGMPv3","60","Membership Report / Join group 224.0.0.252 for any sources"
"45","3.604013","192.168.137.83","192.168.137.255","NBNS","92","Name query NB ISATAP<00>"
"46","3.653802","192.168.137.83","192.168.137.255","NBNS","110","Registration NB PYNDRINE-PC<20>"
"47","3.653803","192.168.137.83","192.168.137.255","NBNS","110","Registration NB WORKGROUP<00>"
"48","3.654622","192.168.137.83","192.168.137.255","NBNS","110","Registration NB PYNDRINE-PC<00>"
"49","4.083792","192.168.137.83","192.168.137.255","NBNS","92","Name query NB WPAD<00>"
"50","4.106256","192.168.137.83","192.168.137.1","DNS","85","Standard query 0xccda A teredo.ipv6.microsoft.com"
"51","4.156112","192.168.137.1","192.168.137.83","DNS","187","Standard query response 0xccda No such name A teredo.ipv6.microsoft.com CNAME teredo.ipv6.microsoft.com.nsatc.net SOA admin.nsatc.net"
"52","4.353786","192.168.137.83","192.168.137.255","NBNS","92","Name query NB ISATAP<00>"
"53","4.365545","192.168.137.1","192.168.137.83","DNS","187","Standard query response 0xccda No such name A teredo.ipv6.microsoft.com CNAME teredo.ipv6.microsoft.com.nsatc.net SOA admin.nsatc.net"
"54","4.365608","192.168.137.1","192.168.137.83","DNS","187","Standard query response 0xccda No such name A teredo.ipv6.microsoft.com CNAME teredo.ipv6.microsoft.com.nsatc.net SOA admin.nsatc.net"
"55","4.365627","192.168.137.1","192.168.137.83","DNS","187","Standard query response 0xccda No such name A teredo.ipv6.microsoft.com CNAME teredo.ipv6.microsoft.com.nsatc.net SOA admin.nsatc.net"
"56","4.833785","192.168.137.83","192.168.137.255","NBNS","92","Name query NB WPAD<00>"
"57","5.103806","192.168.137.83","192.168.137.255","NBNS","92","Name query NB ISATAP<00>"
"58","5.606378","192.168.137.83","192.168.137.1","DNS","76","Standard query 0x719c A www.msftncsi.com"
"59","5.635050","192.168.137.1","192.168.137.83","DNS","181","Standard query response 0x719c A www.msftncsi.com CNAME www.msftncsi.com.edgesuite.net CNAME a1961.g.akamai.net A 23.67.252.63 A 23.67.253.34"
"60","5.636791","192.168.137.83","23.67.252.63","TCP","66","49157  >  80 [SYN] Seq=0 Win=8192 Len=0 MSS=1460 WS=256 SACK_PERM=1"
"61","5.666769","23.67.252.63","192.168.137.83","TCP","66","80  >  49157 [SYN, ACK] Seq=0 Ack=1 Win=14600 Len=0 MSS=1367 SACK_PERM=1 WS=32"
"62","5.667561","192.168.137.83","23.67.252.63","TCP","60","49157  >  80 [ACK] Seq=1 Ack=1 Win=65536 Len=0"
"63","5.667562","192.168.137.83","23.67.252.63","HTTP","151","GET /ncsi.txt HTTP/1.1 "
"64","5.688501","23.67.252.63","192.168.137.83","TCP","54","80  >  49157 [ACK] Seq=1 Ack=98 Win=14624 Len=0"
"65","5.834823","23.67.252.63","192.168.137.83","HTTP","233","HTTP/1.1 200 OK  (text/plain)"
"66","5.834883","23.67.252.63","192.168.137.83","TCP","54","80  >  49157 [FIN, ACK] Seq=180 Ack=98 Win=14624 Len=0"
"67","5.835596","192.168.137.83","23.67.252.63","TCP","60","49157  >  80 [ACK] Seq=98 Ack=181 Win=65280 Len=0"
"68","5.835597","192.168.137.83","23.67.252.63","TCP","60","49157  >  80 [FIN, ACK] Seq=98 Ack=181 Win=65280 Len=0"
"69","5.895373","23.67.252.63","192.168.137.83","TCP","54","80  >  49157 [ACK] Seq=181 Ack=99 Win=14624 Len=0"
"70","7.118825","192.168.137.1","192.168.137.83","DNS","187","Standard query response 0xccda No such name A teredo.ipv6.microsoft.com CNAME teredo.ipv6.microsoft.com.nsatc.net SOA admin.nsatc.net"
"71","7.322379","192.168.137.1","192.168.137.83","DNS","187","Standard query response 0xccda No such name A teredo.ipv6.microsoft.com CNAME teredo.ipv6.microsoft.com.nsatc.net SOA admin.nsatc.net"
"72","7.322437","192.168.137.1","192.168.137.83","DNS","187","Standard query response 0xccda No such name A teredo.ipv6.microsoft.com CNAME teredo.ipv6.microsoft.com.nsatc.net SOA admin.nsatc.net"
"73","7.322454","192.168.137.1","192.168.137.83","DNS","187","Standard query response 0xccda No such name A teredo.ipv6.microsoft.com CNAME teredo.ipv6.microsoft.com.nsatc.net SOA admin.nsatc.net"
"74","10.118419","192.168.137.1","192.168.137.83","DNS","187","Standard query response 0xccda No such name A teredo.ipv6.microsoft.com CNAME teredo.ipv6.microsoft.com.nsatc.net SOA admin.nsatc.net"
"75","10.327652","192.168.137.1","192.168.137.83","DNS","187","Standard query response 0xccda No such name A teredo.ipv6.microsoft.com CNAME teredo.ipv6.microsoft.com.nsatc.net SOA admin.nsatc.net"
"76","10.327836","192.168.137.1","192.168.137.83","DNS","187","Standard query response 0xccda No such name A teredo.ipv6.microsoft.com CNAME teredo.ipv6.microsoft.com.nsatc.net SOA admin.nsatc.net"
"77","10.328003","192.168.137.1","192.168.137.83","DNS","187","Standard query response 0xccda No such name A teredo.ipv6.microsoft.com CNAME teredo.ipv6.microsoft.com.nsatc.net SOA admin.nsatc.net"
"78","10.631779","192.168.137.83","192.168.137.1","DNS","77","Standard query 0x1cee A isatap.mshome.net"
"79","10.632210","192.168.137.1","192.168.137.83","DNS","77","Standard query response 0x1cee No such name A isatap.mshome.net"
"80","13.127936","192.168.137.1","192.168.137.83","DNS","187","Standard query response 0xccda No such name A teredo.ipv6.microsoft.com CNAME teredo.ipv6.microsoft.com.nsatc.net SOA admin.nsatc.net"
"81","13.339806","192.168.137.1","192.168.137.83","DNS","187","Standard query response 0xccda No such name A teredo.ipv6.microsoft.com CNAME teredo.ipv6.microsoft.com.nsatc.net SOA admin.nsatc.net"
"82","119.288226","192.168.137.83","224.0.0.22","IGMPv3","60","Membership Report / Join group 239.255.255.250 for any sources"
"83","119.509757","192.168.137.83","224.0.0.22","IGMPv3","60","Membership Report / Join group 239.255.255.250 for any sources"
"84","161.381997","192.168.137.83","192.168.137.255","NBNS","92","Name query NB WPAD<00>"
"85","161.390251","192.168.137.83","255.255.255.255","DHCP","342","DHCP Inform   - Transaction ID 0xddb62774"
"86","162.145013","192.168.137.83","192.168.137.255","NBNS","92","Name query NB WPAD<00>"
"87","162.909388","192.168.137.83","192.168.137.255","NBNS","92","Name query NB WPAD<00>"
"88","163.706579","192.168.137.83","192.168.137.1","DNS","73","Standard query 0xf558 A icanhazip.com"
"89","163.731488","192.168.137.1","192.168.137.83","DNS","121","Standard query response 0xf558 A icanhazip.com A 104.238.141.75 A 64.182.208.183 A 104.238.136.31"
"90","163.732981","192.168.137.83","104.238.141.75","TCP","66","49158  >  80 [SYN] Seq=0 Win=8192 Len=0 MSS=1460 WS=4 SACK_PERM=1"
"91","163.950208","104.238.141.75","192.168.137.83","TCP","66","80  >  49158 [SYN, ACK] Seq=0 Ack=1 Win=29200 Len=0 MSS=1367 SACK_PERM=1 WS=128"
"92","163.950982","192.168.137.83","104.238.141.75","TCP","60","49158  >  80 [ACK] Seq=1 Ack=1 Win=65616 Len=0"
"93","163.950982","192.168.137.83","104.238.141.75","HTTP","228","GET / HTTP/1.1 "
"94","164.053047","104.238.141.75","192.168.137.83","TCP","54","80  >  49158 [ACK] Seq=1 Ack=175 Win=30336 Len=0"
"95","164.259552","104.238.141.75","192.168.137.83","HTTP","457","HTTP/1.1 200 OK  (text/plain)"
"96","164.259622","104.238.141.75","192.168.137.83","TCP","54","80  >  49158 [FIN, ACK] Seq=404 Ack=175 Win=30336 Len=0"
"97","164.260356","192.168.137.83","104.238.141.75","TCP","60","49158  >  80 [ACK] Seq=175 Ack=405 Win=65212 Len=0"
"98","164.261389","192.168.137.83","104.238.141.75","TCP","60","49158  >  80 [FIN, ACK] Seq=175 Ack=405 Win=65212 Len=0"
"99","164.317372","104.238.141.75","192.168.137.83","TCP","54","80  >  49158 [ACK] Seq=405 Ack=176 Win=30336 Len=0"
"100","164.330228","192.168.137.83","38.65.142.12","TCP","66","49159  >  12572 [SYN] Seq=0 Win=8192 Len=0 MSS=1460 WS=4 SACK_PERM=1"
"101","164.530359","38.65.142.12","192.168.137.83","TCP","66","12572  >  49159 [SYN, ACK] Seq=0 Ack=1 Win=14600 Len=0 MSS=1367 SACK_PERM=1 WS=128"
"102","164.531197","192.168.137.83","38.65.142.12","TCP","60","49159  >  12572 [ACK] Seq=1 Ack=1 Win=65616 Len=0"
"103","164.531200","192.168.137.83","38.65.142.12","HTTP","243","GET /WY22/PYNDRINE-PC/0/61-SP1/0/FGBFHKBEHLBMG HTTP/1.1 "
"104","164.727106","38.65.142.12","192.168.137.83","TCP","54","12572  >  49159 [ACK] Seq=1 Ack=190 Win=15744 Len=0"
"105","164.930116","38.65.142.12","192.168.137.83","TCP","54","12572  >  49159 [RST, ACK] Seq=1 Ack=190 Win=15744 Len=0"
"106","164.964558","192.168.137.83","173.216.240.56","TCP","66","49160  >  443 [SYN] Seq=0 Win=8192 Len=0 MSS=1460 WS=4 SACK_PERM=1"
"107","165.069526","173.216.240.56","192.168.137.83","TCP","66","443  >  49160 [SYN, ACK] Seq=0 Ack=1 Win=14600 Len=0 MSS=1367 SACK_PERM=1 WS=64"
"108","165.070316","192.168.137.83","173.216.240.56","TCP","60","49160  >  443 [ACK] Seq=1 Ack=1 Win=65616 Len=0"
"109","165.148777","192.168.137.83","173.216.240.56","TLSv1.2","187","Client Hello"
"110","165.254602","173.216.240.56","192.168.137.83","TCP","54","443  >  49160 [ACK] Seq=1 Ack=134 Win=15680 Len=0"
"111","165.468984","173.216.240.56","192.168.137.83","TLSv1.2","1036","Server Hello, Certificate, Server Hello Done"
"112","165.496912","192.168.137.83","173.216.240.56","TLSv1.2","412","Client Key Exchange, Change Cipher Spec, Encrypted Handshake Message"
"113","165.622171","173.216.240.56","192.168.137.83","TLSv1.2","145","Change Cipher Spec, Encrypted Handshake Message"
"114","165.711348","192.168.137.83","192.168.137.1","DNS","90","Standard query 0x7d88 A www.download.windowsupdate.com"
"115","165.748032","192.168.137.1","192.168.137.83","DNS","251","Standard query response 0x7d88 A www.download.windowsupdate.com CNAME www.download.windowsupdate.nsatc.net CNAME download.windowsupdate.com.edgesuite.net CNAME a767.g.akamai.net A 23.67.252.42 A 23.67.253.43"
"116","165.750316","192.168.137.83","23.67.252.42","TCP","66","49161  >  80 [SYN] Seq=0 Win=8192 Len=0 MSS=1460 WS=256 SACK_PERM=1"
"117","165.826479","192.168.137.83","173.216.240.56","TCP","60","49160  >  443 [ACK] Seq=492 Ack=1074 Win=64540 Len=0"
"118","165.838504","23.67.252.42","192.168.137.83","TCP","66","80  >  49161 [SYN, ACK] Seq=0 Ack=1 Win=14600 Len=0 MSS=1367 SACK_PERM=1 WS=32"
"119","165.839281","192.168.137.83","23.67.252.42","TCP","60","49161  >  80 [ACK] Seq=1 Ack=1 Win=65536 Len=0"
"120","165.839282","192.168.137.83","23.67.252.42","HTTP","271","GET /msdownload/update/v3/static/trustedr/en/authrootstl.cab HTTP/1.1 "
"121","165.899860","23.67.252.42","192.168.137.83","TCP","54","80  >  49161 [ACK] Seq=1 Ack=218 Win=15680 Len=0"
"122","165.901156","23.67.252.42","192.168.137.83","TCP","1421","80  >  49161 [ACK] Seq=1 Ack=218 Win=15680 Len=1367 [TCP segment of a reassembled PDU]"
"123","165.901492","23.67.252.42","192.168.137.83","TCP","1421","80  >  49161 [ACK] Seq=1368 Ack=218 Win=15680 Len=1367 [TCP segment of a reassembled PDU]"
"124","165.901919","23.67.252.42","192.168.137.83","TCP","1421","80  >  49161 [ACK] Seq=2735 Ack=218 Win=15680 Len=1367 [TCP segment of a reassembled PDU]"
"125","165.901952","192.168.137.83","23.67.252.42","TCP","60","49161  >  80 [ACK] Seq=218 Ack=2735 Win=65536 Len=0"
"126","165.917190","23.67.252.42","192.168.137.83","TCP","1421","80  >  49161 [ACK] Seq=4102 Ack=218 Win=15680 Len=1367 [TCP segment of a reassembled PDU]"
"127","165.917276","23.67.252.42","192.168.137.83","TCP","1421","80  >  49161 [ACK] Seq=5469 Ack=218 Win=15680 Len=1367 [TCP segment of a reassembled PDU]"
"128","165.917402","23.67.252.42","192.168.137.83","TCP","1421","80  >  49161 [ACK] Seq=6836 Ack=218 Win=15680 Len=1367 [TCP segment of a reassembled PDU]"
"129","165.917457","23.67.252.42","192.168.137.83","TCP","1421","80  >  49161 [ACK] Seq=8203 Ack=218 Win=15680 Len=1367 [TCP segment of a reassembled PDU]"
"130","165.917965","192.168.137.83","23.67.252.42","TCP","60","49161  >  80 [ACK] Seq=218 Ack=5469 Win=65536 Len=0"
"131","165.917966","192.168.137.83","23.67.252.42","TCP","60","49161  >  80 [ACK] Seq=218 Ack=8203 Win=65536 Len=0"
"132","165.922113","23.67.252.42","192.168.137.83","TCP","1421","80  >  49161 [ACK] Seq=9570 Ack=218 Win=15680 Len=1367 [TCP segment of a reassembled PDU]"
"133","165.922883","192.168.137.83","23.67.252.42","TCP","60","49161  >  80 [ACK] Seq=218 Ack=10937 Win=65536 Len=0"
"134","165.927715","23.67.252.42","192.168.137.83","TCP","1421","80  >  49161 [ACK] Seq=10937 Ack=218 Win=15680 Len=1367 [TCP segment of a reassembled PDU]"
"135","165.927802","23.67.252.42","192.168.137.83","TCP","1421","80  >  49161 [ACK] Seq=12304 Ack=218 Win=15680 Len=1367 [TCP segment of a reassembled PDU]"
"136","165.927988","23.67.252.42","192.168.137.83","TCP","1421","80  >  49161 [ACK] Seq=13671 Ack=218 Win=15680 Len=1367 [TCP segment of a reassembled PDU]"
"137","165.928054","23.67.252.42","192.168.137.83","TCP","1421","80  >  49161 [ACK] Seq=15038 Ack=218 Win=15680 Len=1367 [TCP segment of a reassembled PDU]"
"138","165.928104","23.67.252.42","192.168.137.83","TCP","1421","80  >  49161 [ACK] Seq=16405 Ack=218 Win=15680 Len=1367 [TCP segment of a reassembled PDU]"
"139","165.928500","192.168.137.83","23.67.252.42","TCP","60","49161  >  80 [ACK] Seq=218 Ack=13671 Win=65536 Len=0"
"140","165.928500","192.168.137.83","23.67.252.42","TCP","60","49161  >  80 [ACK] Seq=218 Ack=16405 Win=65536 Len=0"
"141","165.931745","23.67.252.42","192.168.137.83","TCP","1421","80  >  49161 [ACK] Seq=17772 Ack=218 Win=15680 Len=1367 [TCP segment of a reassembled PDU]"
"142","165.931820","23.67.252.42","192.168.137.83","TCP","1421","80  >  49161 [ACK] Seq=19139 Ack=218 Win=15680 Len=1367 [TCP segment of a reassembled PDU]"
"143","165.932537","192.168.137.83","23.67.252.42","TCP","60","49161  >  80 [ACK] Seq=218 Ack=19139 Win=65536 Len=0"
"144","165.937457","23.67.252.42","192.168.137.83","TCP","1421","80  >  49161 [ACK] Seq=20506 Ack=218 Win=15680 Len=1367 [TCP segment of a reassembled PDU]"
"145","165.937531","23.67.252.42","192.168.137.83","TCP","1421","80  >  49161 [ACK] Seq=21873 Ack=218 Win=15680 Len=1367 [TCP segment of a reassembled PDU]"
"146","165.937754","23.67.252.42","192.168.137.83","TCP","1421","80  >  49161 [ACK] Seq=23240 Ack=218 Win=15680 Len=1367 [TCP segment of a reassembled PDU]"
"147","165.937819","23.67.252.42","192.168.137.83","TCP","1421","80  >  49161 [ACK] Seq=24607 Ack=218 Win=15680 Len=1367 [TCP segment of a reassembled PDU]"
"148","165.937881","23.67.252.42","192.168.137.83","TCP","1421","80  >  49161 [ACK] Seq=25974 Ack=218 Win=15680 Len=1367 [TCP segment of a reassembled PDU]"
"149","165.938252","192.168.137.83","23.67.252.42","TCP","60","49161  >  80 [ACK] Seq=218 Ack=21873 Win=65536 Len=0"
"150","165.938253","192.168.137.83","23.67.252.42","TCP","60","49161  >  80 [ACK] Seq=218 Ack=24607 Win=65536 Len=0"
"151","165.938254","192.168.137.83","23.67.252.42","TCP","60","49161  >  80 [ACK] Seq=218 Ack=27341 Win=65536 Len=0"
"152","165.941556","23.67.252.42","192.168.137.83","TCP","1421","80  >  49161 [ACK] Seq=27341 Ack=218 Win=15680 Len=1367 [TCP segment of a reassembled PDU]"
"153","165.941633","23.67.252.42","192.168.137.83","TCP","1421","80  >  49161 [ACK] Seq=28708 Ack=218 Win=15680 Len=1367 [TCP segment of a reassembled PDU]"
"154","165.942349","192.168.137.83","23.67.252.42","TCP","60","49161  >  80 [ACK] Seq=218 Ack=30075 Win=65536 Len=0"
"155","165.946990","23.67.252.42","192.168.137.83","TCP","1421","80  >  49161 [ACK] Seq=30075 Ack=218 Win=15680 Len=1367 [TCP segment of a reassembled PDU]"
"156","165.947058","23.67.252.42","192.168.137.83","TCP","1421","80  >  49161 [PSH, ACK] Seq=31442 Ack=218 Win=15680 Len=1367 [TCP segment of a reassembled PDU]"
"157","165.947374","23.67.252.42","192.168.137.83","TCP","1421","80  >  49161 [ACK] Seq=32809 Ack=218 Win=15680 Len=1367 [TCP segment of a reassembled PDU]"
"158","165.947450","23.67.252.42","192.168.137.83","TCP","1421","80  >  49161 [ACK] Seq=34176 Ack=218 Win=15680 Len=1367 [TCP segment of a reassembled PDU]"
"159","165.947653","23.67.252.42","192.168.137.83","TCP","1421","80  >  49161 [ACK] Seq=35543 Ack=218 Win=15680 Len=1367 [TCP segment of a reassembled PDU]"
"160","165.947712","23.67.252.42","192.168.137.83","TCP","1421","80  >  49161 [ACK] Seq=36910 Ack=218 Win=15680 Len=1367 [TCP segment of a reassembled PDU]"
"161","165.947779","192.168.137.83","23.67.252.42","TCP","60","49161  >  80 [ACK] Seq=218 Ack=32809 Win=65536 Len=0"
"162","165.947779","192.168.137.83","23.67.252.42","TCP","60","49161  >  80 [ACK] Seq=218 Ack=35543 Win=65536 Len=0"
"163","165.948627","192.168.137.83","23.67.252.42","TCP","60","49161  >  80 [ACK] Seq=218 Ack=38277 Win=65536 Len=0"
"164","165.951139","23.67.252.42","192.168.137.83","TCP","1421","80  >  49161 [ACK] Seq=38277 Ack=218 Win=15680 Len=1367 [TCP segment of a reassembled PDU]"
"165","165.951224","23.67.252.42","192.168.137.83","TCP","1421","80  >  49161 [ACK] Seq=39644 Ack=218 Win=15680 Len=1367 [TCP segment of a reassembled PDU]"
"166","165.951469","23.67.252.42","192.168.137.83","TCP","1421","80  >  49161 [ACK] Seq=41011 Ack=218 Win=15680 Len=1367 [TCP segment of a reassembled PDU]"
"167","165.951533","23.67.252.42","192.168.137.83","TCP","1421","80  >  49161 [ACK] Seq=42378 Ack=218 Win=15680 Len=1367 [TCP segment of a reassembled PDU]"
"168","165.951923","192.168.137.83","23.67.252.42","TCP","60","49161  >  80 [ACK] Seq=218 Ack=41011 Win=65536 Len=0"
"169","165.951923","192.168.137.83","23.67.252.42","TCP","60","49161  >  80 [ACK] Seq=218 Ack=43745 Win=65536 Len=0"
"170","165.956778","23.67.252.42","192.168.137.83","TCP","1421","80  >  49161 [ACK] Seq=43745 Ack=218 Win=15680 Len=1367 [TCP segment of a reassembled PDU]"
"171","165.956853","23.67.252.42","192.168.137.83","TCP","1421","80  >  49161 [ACK] Seq=45112 Ack=218 Win=15680 Len=1367 [TCP segment of a reassembled PDU]"
"172","165.957584","192.168.137.83","23.67.252.42","TCP","60","49161  >  80 [ACK] Seq=218 Ack=46479 Win=65536 Len=0"
"173","165.957742","23.67.252.42","192.168.137.83","TCP","1421","80  >  49161 [ACK] Seq=46479 Ack=218 Win=15680 Len=1367 [TCP segment of a reassembled PDU]"
"174","165.957979","23.67.252.42","192.168.137.83","TCP","1421","80  >  49161 [ACK] Seq=47846 Ack=218 Win=15680 Len=1367 [TCP segment of a reassembled PDU]"
"175","165.958154","23.67.252.42","192.168.137.83","HTTP","1195","HTTP/1.1 200 OK "
"176","165.958489","192.168.137.83","23.67.252.42","TCP","60","49161  >  80 [ACK] Seq=218 Ack=49213 Win=65536 Len=0"
"177","165.988354","23.67.252.42","192.168.137.83","TCP","1195","[TCP Retransmission] 80  >  49161 [PSH, ACK] Seq=49213 Ack=218 Win=15680 Len=1141"
"178","165.989139","192.168.137.83","23.67.252.42","TCP","66","49161  >  80 [ACK] Seq=218 Ack=50354 Win=64256 Len=0 SLE=49213 SRE=50354"
"179","166.022301","192.168.137.83","173.216.240.56","TLSv1.2","299","Application Data"
"180","166.148924","173.216.240.56","192.168.137.83","TCP","1421","443  >  49160 [ACK] Seq=1074 Ack=737 Win=17856 Len=1367 [TCP segment of a reassembled PDU]"
"181","166.149796","173.216.240.56","192.168.137.83","TCP","1421","443  >  49160 [ACK] Seq=2441 Ack=737 Win=17856 Len=1367 [TCP segment of a reassembled PDU]"
"182","166.149901","173.216.240.56","192.168.137.83","TCP","1421","443  >  49160 [ACK] Seq=3808 Ack=737 Win=17856 Len=1367 [TCP segment of a reassembled PDU]"
"183","166.150581","192.168.137.83","173.216.240.56","TCP","60","49160  >  443 [ACK] Seq=737 Ack=3808 Win=65616 Len=0"
"184","166.153720","173.216.240.56","192.168.137.83","TCP","1421","443  >  49160 [ACK] Seq=5175 Ack=737 Win=17856 Len=1367 [TCP segment of a reassembled PDU]"
"185","166.153847","173.216.240.56","192.168.137.83","TCP","1421","443  >  49160 [ACK] Seq=6542 Ack=737 Win=17856 Len=1367 [TCP segment of a reassembled PDU]"
"186","166.154506","192.168.137.83","173.216.240.56","TCP","60","49160  >  443 [ACK] Seq=737 Ack=6542 Win=65616 Len=0"
"187","166.155156","173.216.240.56","192.168.137.83","TCP","1421","443  >  49160 [ACK] Seq=7909 Ack=737 Win=17856 Len=1367 [TCP segment of a reassembled PDU]"
"188","166.155262","173.216.240.56","192.168.137.83","TCP","1421","443  >  49160 [ACK] Seq=9276 Ack=737 Win=17856 Len=1367 [TCP segment of a reassembled PDU]"
"189","166.155384","173.216.240.56","192.168.137.83","TCP","1421","443  >  49160 [ACK] Seq=10643 Ack=737 Win=17856 Len=1367 [TCP segment of a reassembled PDU]"
"190","166.156087","192.168.137.83","173.216.240.56","TCP","60","49160  >  443 [ACK] Seq=737 Ack=9276 Win=65616 Len=0"
"191","166.156088","192.168.137.83","173.216.240.56","TCP","60","49160  >  443 [ACK] Seq=737 Ack=12010 Win=65616 Len=0"
"192","166.156142","173.216.240.56","192.168.137.83","TCP","1421","443  >  49160 [ACK] Seq=12010 Ack=737 Win=17856 Len=1367 [TCP segment of a reassembled PDU]"
"193","166.159570","173.216.240.56","192.168.137.83","TCP","1421","443  >  49160 [ACK] Seq=13377 Ack=737 Win=17856 Len=1367 [TCP segment of a reassembled PDU]"
"194","166.159688","173.216.240.56","192.168.137.83","TCP","1421","443  >  49160 [ACK] Seq=14744 Ack=737 Win=17856 Len=1367 [TCP segment of a reassembled PDU]"
"195","166.159769","173.216.240.56","192.168.137.83","TCP","1421","443  >  49160 [ACK] Seq=16111 Ack=737 Win=17856 Len=1367 [TCP segment of a reassembled PDU]"
"196","166.160338","192.168.137.83","173.216.240.56","TCP","60","49160  >  443 [ACK] Seq=737 Ack=14744 Win=65616 Len=0"
"197","166.160339","192.168.137.83","173.216.240.56","TCP","60","49160  >  443 [ACK] Seq=737 Ack=17478 Win=65616 Len=0"
"198","166.259142","173.216.240.56","192.168.137.83","TLSv1.2","1421","Application Data [TCP segment of a reassembled PDU]"
"199","166.263992","173.216.240.56","192.168.137.83","TCP","1421","443  >  49160 [ACK] Seq=18845 Ack=737 Win=17856 Len=1367 [TCP segment of a reassembled PDU]"
"200","166.264765","192.168.137.83","173.216.240.56","TCP","60","49160  >  443 [ACK] Seq=737 Ack=20212 Win=65616 Len=0"
"201","166.264978","173.216.240.56","192.168.137.83","TCP","1421","443  >  49160 [ACK] Seq=20212 Ack=737 Win=17856 Len=1367 [TCP segment of a reassembled PDU]"
"202","166.265041","173.216.240.56","192.168.137.83","TCP","1421","443  >  49160 [ACK] Seq=21579 Ack=737 Win=17856 Len=1367 [TCP segment of a reassembled PDU]"
"203","166.265222","173.216.240.56","192.168.137.83","TCP","1421","443  >  49160 [ACK] Seq=22946 Ack=737 Win=17856 Len=1367 [TCP segment of a reassembled PDU]"
"204","166.265555","192.168.137.83","173.216.240.56","TCP","60","49160  >  443 [ACK] Seq=737 Ack=22946 Win=65616 Len=0"
"205","166.265948","173.216.240.56","192.168.137.83","TCP","1421","443  >  49160 [ACK] Seq=24313 Ack=737 Win=17856 Len=1367 [TCP segment of a reassembled PDU]"
"206","166.266017","173.216.240.56","192.168.137.83","TCP","1421","443  >  49160 [ACK] Seq=25680 Ack=737 Win=17856 Len=1367 [TCP segment of a reassembled PDU]"
"207","166.266313","192.168.137.83","173.216.240.56","TCP","60","49160  >  443 [ACK] Seq=737 Ack=25680 Win=65616 Len=0"
"208","166.268632","173.216.240.56","192.168.137.83","TCP","1421","443  >  49160 [ACK] Seq=27047 Ack=737 Win=17856 Len=1367 [TCP segment of a reassembled PDU]"
"209","166.268973","173.216.240.56","192.168.137.83","TCP","1421","443  >  49160 [ACK] Seq=28414 Ack=737 Win=17856 Len=1367 [TCP segment of a reassembled PDU]"
"210","166.269234","173.216.240.56","192.168.137.83","TCP","1421","443  >  49160 [ACK] Seq=29781 Ack=737 Win=17856 Len=1367 [TCP segment of a reassembled PDU]"
"211","166.269403","192.168.137.83","173.216.240.56","TCP","60","49160  >  443 [ACK] Seq=737 Ack=28414 Win=65616 Len=0"
"212","166.270179","192.168.137.83","173.216.240.56","TCP","60","49160  >  443 [ACK] Seq=737 Ack=31148 Win=65616 Len=0"
"213","166.273694","173.216.240.56","192.168.137.83","TCP","1421","443  >  49160 [ACK] Seq=31148 Ack=737 Win=17856 Len=1367 [TCP segment of a reassembled PDU]"
"214","166.273853","173.216.240.56","192.168.137.83","TCP","1421","443  >  49160 [ACK] Seq=32515 Ack=737 Win=17856 Len=1367 [TCP segment of a reassembled PDU]"
"215","166.274488","192.168.137.83","173.216.240.56","TCP","60","49160  >  443 [ACK] Seq=737 Ack=33882 Win=65616 Len=0"
"216","166.274630","173.216.240.56","192.168.137.83","TLSv1.2","1421","Application Data [TCP segment of a reassembled PDU]"
"217","166.274696","173.216.240.56","192.168.137.83","TCP","1421","443  >  49160 [ACK] Seq=35249 Ack=737 Win=17856 Len=1367 [TCP segment of a reassembled PDU]"
"218","166.275300","192.168.137.83","173.216.240.56","TCP","60","49160  >  443 [ACK] Seq=737 Ack=36616 Win=65616 Len=0"
"219","166.275571","173.216.240.56","192.168.137.83","TCP","1421","443  >  49160 [ACK] Seq=36616 Ack=737 Win=17856 Len=1367 [TCP segment of a reassembled PDU]"
"220","166.275634","173.216.240.56","192.168.137.83","TCP","1421","443  >  49160 [ACK] Seq=37983 Ack=737 Win=17856 Len=1367 [TCP segment of a reassembled PDU]"
"221","166.276113","192.168.137.83","173.216.240.56","TCP","60","49160  >  443 [ACK] Seq=737 Ack=39350 Win=65616 Len=0"
"222","166.278171","173.216.240.56","192.168.137.83","TCP","1421","443  >  49160 [ACK] Seq=39350 Ack=737 Win=17856 Len=1367 [TCP segment of a reassembled PDU]"
"223","166.278545","173.216.240.56","192.168.137.83","TCP","1421","443  >  49160 [ACK] Seq=40717 Ack=737 Win=17856 Len=1367 [TCP segment of a reassembled PDU]"
"224","166.278963","192.168.137.83","173.216.240.56","TCP","60","49160  >  443 [ACK] Seq=737 Ack=42084 Win=65616 Len=0"
"225","166.372029","173.216.240.56","192.168.137.83","TCP","1421","443  >  49160 [ACK] Seq=42084 Ack=737 Win=17856 Len=1367 [TCP segment of a reassembled PDU]"
"226","166.381429","173.216.240.56","192.168.137.83","TCP","1421","443  >  49160 [ACK] Seq=43451 Ack=737 Win=17856 Len=1367 [TCP segment of a reassembled PDU]"
"227","166.382264","192.168.137.83","173.216.240.56","TCP","60","49160  >  443 [ACK] Seq=737 Ack=44818 Win=65616 Len=0"
"228","166.384011","173.216.240.56","192.168.137.83","TCP","1421","443  >  49160 [ACK] Seq=44818 Ack=737 Win=17856 Len=1367 [TCP segment of a reassembled PDU]"
"229","166.384274","173.216.240.56","192.168.137.83","TCP","1421","443  >  49160 [ACK] Seq=46185 Ack=737 Win=17856 Len=1367 [TCP segment of a reassembled PDU]"
"230","166.384485","173.216.240.56","192.168.137.83","TCP","1421","443  >  49160 [ACK] Seq=47552 Ack=737 Win=17856 Len=1367 [TCP segment of a reassembled PDU]"
"231","166.384846","192.168.137.83","173.216.240.56","TCP","60","49160  >  443 [ACK] Seq=737 Ack=47552 Win=65616 Len=0"
"232","166.385308","173.216.240.56","192.168.137.83","TCP","1421","443  >  49160 [PSH, ACK] Seq=48919 Ack=737 Win=17856 Len=1367 [TCP segment of a reassembled PDU]"
"233","166.385785","192.168.137.83","173.216.240.56","TCP","60","49160  >  443 [ACK] Seq=737 Ack=50286 Win=65616 Len=0"
"234","166.397639","173.216.240.56","192.168.137.83","TLSv1.2","1421","Application Data [TCP segment of a reassembled PDU]"
"235","166.397894","173.216.240.56","192.168.137.83","TCP","1421","443  >  49160 [ACK] Seq=51653 Ack=737 Win=17856 Len=1367 [TCP segment of a reassembled PDU]"
"236","166.398081","173.216.240.56","192.168.137.83","TCP","1421","443  >  49160 [ACK] Seq=53020 Ack=737 Win=17856 Len=1367 [TCP segment of a reassembled PDU]"
"237","166.398260","173.216.240.56","192.168.137.83","TCP","1421","443  >  49160 [ACK] Seq=54387 Ack=737 Win=17856 Len=1367 [TCP segment of a reassembled PDU]"
"238","166.398445","173.216.240.56","192.168.137.83","TCP","1421","443  >  49160 [ACK] Seq=55754 Ack=737 Win=17856 Len=1367 [TCP segment of a reassembled PDU]"
"239","166.398470","192.168.137.83","173.216.240.56","TCP","60","49160  >  443 [ACK] Seq=737 Ack=53020 Win=65616 Len=0"
"240","166.398472","192.168.137.83","173.216.240.56","TCP","60","49160  >  443 [ACK] Seq=737 Ack=55754 Win=65616 Len=0"
"241","166.398765","173.216.240.56","192.168.137.83","TCP","1421","443  >  49160 [ACK] Seq=57121 Ack=737 Win=17856 Len=1367 [TCP segment of a reassembled PDU]"
"242","166.398999","173.216.240.56","192.168.137.83","TCP","1421","443  >  49160 [ACK] Seq=58488 Ack=737 Win=17856 Len=1367 [TCP segment of a reassembled PDU]"
"243","166.399199","173.216.240.56","192.168.137.83","TCP","1421","443  >  49160 [ACK] Seq=59855 Ack=737 Win=17856 Len=1367 [TCP segment of a reassembled PDU]"
"244","166.399328","192.168.137.83","173.216.240.56","TCP","60","49160  >  443 [ACK] Seq=737 Ack=58488 Win=65616 Len=0"
"245","166.399451","173.216.240.56","192.168.137.83","TCP","1421","443  >  49160 [ACK] Seq=61222 Ack=737 Win=17856 Len=1367 [TCP segment of a reassembled PDU]"
"246","166.399629","173.216.240.56","192.168.137.83","TCP","1421","443  >  49160 [ACK] Seq=62589 Ack=737 Win=17856 Len=1367 [TCP segment of a reassembled PDU]"
"247","166.399804","173.216.240.56","192.168.137.83","TCP","1421","443  >  49160 [ACK] Seq=63956 Ack=737 Win=17856 Len=1367 [TCP segment of a reassembled PDU]"
"248","166.399984","173.216.240.56","192.168.137.83","TCP","1421","443  >  49160 [ACK] Seq=65323 Ack=737 Win=17856 Len=1367 [TCP segment of a reassembled PDU]"
"249","166.400128","192.168.137.83","173.216.240.56","TCP","60","49160  >  443 [ACK] Seq=737 Ack=61222 Win=65616 Len=0"
"250","166.400129","192.168.137.83","173.216.240.56","TCP","60","49160  >  443 [ACK] Seq=737 Ack=63956 Win=65616 Len=0"
"251","166.400970","192.168.137.83","173.216.240.56","TCP","60","49160  >  443 [ACK] Seq=737 Ack=66690 Win=65616 Len=0"
"252","166.404531","173.216.240.56","192.168.137.83","TLSv1.2","1421","Application Data [TCP segment of a reassembled PDU]"
"253","166.404773","173.216.240.56","192.168.137.83","TCP","1421","443  >  49160 [ACK] Seq=68057 Ack=737 Win=17856 Len=1367 [TCP segment of a reassembled PDU]"
"254","166.404954","173.216.240.56","192.168.137.83","TCP","1421","443  >  49160 [ACK] Seq=69424 Ack=737 Win=17856 Len=1367 [TCP segment of a reassembled PDU]"
"255","166.405182","173.216.240.56","192.168.137.83","TCP","1421","443  >  49160 [ACK] Seq=70791 Ack=737 Win=17856 Len=1367 [TCP segment of a reassembled PDU]"
"256","166.405332","192.168.137.83","173.216.240.56","TCP","60","49160  >  443 [ACK] Seq=737 Ack=69424 Win=65616 Len=0"
"257","166.406165","192.168.137.83","173.216.240.56","TCP","60","49160  >  443 [ACK] Seq=737 Ack=72158 Win=65616 Len=0"
"258","166.406723","173.216.240.56","192.168.137.83","TCP","1421","443  >  49160 [ACK] Seq=72158 Ack=737 Win=17856 Len=1367 [TCP segment of a reassembled PDU]"
"259","166.407001","173.216.240.56","192.168.137.83","TCP","1421","443  >  49160 [ACK] Seq=73525 Ack=737 Win=17856 Len=1367 [TCP segment of a reassembled PDU]"
"260","166.407719","192.168.137.83","173.216.240.56","TCP","60","49160  >  443 [ACK] Seq=737 Ack=74892 Win=65616 Len=0"
"261","166.488929","173.216.240.56","192.168.137.83","TCP","1421","443  >  49160 [ACK] Seq=74892 Ack=737 Win=17856 Len=1367 [TCP segment of a reassembled PDU]"
"262","166.489242","173.216.240.56","192.168.137.83","TCP","1421","443  >  49160 [ACK] Seq=76259 Ack=737 Win=17856 Len=1367 [TCP segment of a reassembled PDU]"
"263","166.489727","192.168.137.83","173.216.240.56","TCP","60","49160  >  443 [ACK] Seq=737 Ack=77626 Win=65616 Len=0"
"264","166.492635","173.216.240.56","192.168.137.83","TCP","1421","443  >  49160 [ACK] Seq=77626 Ack=737 Win=17856 Len=1367 [TCP segment of a reassembled PDU]"
"265","166.492705","173.216.240.56","192.168.137.83","TCP","1421","443  >  49160 [ACK] Seq=78993 Ack=737 Win=17856 Len=1367 [TCP segment of a reassembled PDU]"
"266","166.492785","173.216.240.56","192.168.137.83","TCP","1421","443  >  49160 [ACK] Seq=80360 Ack=737 Win=17856 Len=1367 [TCP segment of a reassembled PDU]"
"267","166.493416","192.168.137.83","173.216.240.56","TCP","60","49160  >  443 [ACK] Seq=737 Ack=80360 Win=65616 Len=0"
"268","166.498526","173.216.240.56","192.168.137.83","TCP","1421","443  >  49160 [ACK] Seq=81727 Ack=737 Win=17856 Len=1367 [TCP segment of a reassembled PDU]"
"269","166.499346","192.168.137.83","173.216.240.56","TCP","60","49160  >  443 [ACK] Seq=737 Ack=83094 Win=65616 Len=0"
"270","166.510080","173.216.240.56","192.168.137.83","TLSv1.2","1421","Application Data [TCP segment of a reassembled PDU]"
"271","166.516320","173.216.240.56","192.168.137.83","TCP","1421","443  >  49160 [ACK] Seq=84461 Ack=737 Win=17856 Len=1367 [TCP segment of a reassembled PDU]"
"272","166.516547","173.216.240.56","192.168.137.83","TCP","1421","443  >  49160 [ACK] Seq=85828 Ack=737 Win=17856 Len=1367 [TCP segment of a reassembled PDU]"
"273","166.517122","192.168.137.83","173.216.240.56","TCP","60","49160  >  443 [ACK] Seq=737 Ack=85828 Win=65616 Len=0"
"274","166.517991","173.216.240.56","192.168.137.83","TCP","1421","443  >  49160 [ACK] Seq=87195 Ack=737 Win=17856 Len=1367 [TCP segment of a reassembled PDU]"
"275","166.518269","173.216.240.56","192.168.137.83","TCP","1421","443  >  49160 [ACK] Seq=88562 Ack=737 Win=17856 Len=1367 [TCP segment of a reassembled PDU]"
"276","166.518487","173.216.240.56","192.168.137.83","TCP","1421","443  >  49160 [ACK] Seq=89929 Ack=737 Win=17856 Len=1367 [TCP segment of a reassembled PDU]"
"277","166.518683","173.216.240.56","192.168.137.83","TCP","1421","443  >  49160 [ACK] Seq=91296 Ack=737 Win=17856 Len=1367 [TCP segment of a reassembled PDU]"
"278","166.518788","192.168.137.83","173.216.240.56","TCP","60","49160  >  443 [ACK] Seq=737 Ack=88562 Win=65616 Len=0"
"279","166.518790","192.168.137.83","173.216.240.56","TCP","60","49160  >  443 [ACK] Seq=737 Ack=91296 Win=65616 Len=0"
"280","166.521749","173.216.240.56","192.168.137.83","TCP","1421","443  >  49160 [ACK] Seq=92663 Ack=737 Win=17856 Len=1367 [TCP segment of a reassembled PDU]"
"281","166.521977","173.216.240.56","192.168.137.83","TCP","1421","443  >  49160 [ACK] Seq=94030 Ack=737 Win=17856 Len=1367 [TCP segment of a reassembled PDU]"
"282","166.522554","192.168.137.83","173.216.240.56","TCP","60","49160  >  443 [ACK] Seq=737 Ack=94030 Win=65616 Len=0"
"283","166.530465","173.216.240.56","192.168.137.83","TCP","1421","443  >  49160 [ACK] Seq=95397 Ack=737 Win=17856 Len=1367 [TCP segment of a reassembled PDU]"
"284","166.530602","173.216.240.56","192.168.137.83","TCP","1421","443  >  49160 [ACK] Seq=96764 Ack=737 Win=17856 Len=1367 [TCP segment of a reassembled PDU]"
"285","166.530681","173.216.240.56","192.168.137.83","TCP","1421","443  >  49160 [ACK] Seq=98131 Ack=737 Win=17856 Len=1367 [TCP segment of a reassembled PDU]"
"286","166.530760","173.216.240.56","192.168.137.83","TLSv1.2","1421","Application Data [TCP segment of a reassembled PDU]"
"287","166.531236","192.168.137.83","173.216.240.56","TCP","60","49160  >  443 [ACK] Seq=737 Ack=96764 Win=65616 Len=0"
"288","166.531237","192.168.137.83","173.216.240.56","TCP","60","49160  >  443 [ACK] Seq=737 Ack=99498 Win=65616 Len=0"
"289","166.531445","173.216.240.56","192.168.137.83","TCP","1421","443  >  49160 [ACK] Seq=100865 Ack=737 Win=17856 Len=1367 [TCP segment of a reassembled PDU]"
"290","166.532030","192.168.137.83","173.216.240.56","TCP","60","49160  >  443 [ACK] Seq=737 Ack=102232 Win=65616 Len=0"
"291","166.596984","173.216.240.56","192.168.137.83","TCP","1421","443  >  49160 [ACK] Seq=102232 Ack=737 Win=17856 Len=1367 [TCP segment of a reassembled PDU]"
"292","166.598394","173.216.240.56","192.168.137.83","TCP","1421","443  >  49160 [ACK] Seq=103599 Ack=737 Win=17856 Len=1367 [TCP segment of a reassembled PDU]"
"293","166.598470","173.216.240.56","192.168.137.83","TCP","1421","443  >  49160 [ACK] Seq=104966 Ack=737 Win=17856 Len=1367 [TCP segment of a reassembled PDU]"
"294","166.598710","173.216.240.56","192.168.137.83","TCP","1421","443  >  49160 [ACK] Seq=106333 Ack=737 Win=17856 Len=1367 [TCP segment of a reassembled PDU]"
