"No.","Time","Source","Destination","Protocol","Length","Info"
"1","0.000000","192.168.138.158","192.168.138.2","DNS","137","Standard query 0x47ae A va872g.g90e1h.b8.642b63u.j985a2.v33e.37.pa269cc.e8mfzdgrf7g0.groupprograms.in"
"2","0.150951","192.168.138.2","192.168.138.158","DNS","153","Standard query response 0x47ae A va872g.g90e1h.b8.642b63u.j985a2.v33e.37.pa269cc.e8mfzdgrf7g0.groupprograms.in A 62.75.195.236"
"3","0.234945","192.168.138.158","62.75.195.236","TCP","66","49184  >  80 [SYN] Seq=0 Win=8192 Len=0 MSS=1460 WS=4 SACK_PERM=1"
"4","0.366978","62.75.195.236","192.168.138.158","TCP","60","80  >  49184 [SYN, ACK] Seq=0 Ack=1 Win=64240 Len=0 MSS=1460"
"5","0.367073","192.168.138.158","62.75.195.236","TCP","60","49184  >  80 [ACK] Seq=1 Ack=1 Win=64240 Len=0"
"6","0.367947","192.168.138.158","62.75.195.236","HTTP","647","GET /?285a4d4e4e5a4d4d4649584c5d43064b4745 HTTP/1.1 "
"7","0.368007","62.75.195.236","192.168.138.158","TCP","60","80  >  49184 [ACK] Seq=1 Ack=594 Win=64240 Len=0"
"8","0.730531","62.75.195.236","192.168.138.158","HTTP","816","HTTP/1.1 200 OK  (text/html)"
"9","0.730710","192.168.138.158","62.75.195.236","TCP","60","49184  >  80 [FIN, ACK] Seq=594 Ack=763 Win=63478 Len=0"
"10","0.730775","62.75.195.236","192.168.138.158","TCP","60","80  >  49184 [ACK] Seq=763 Ack=595 Win=64239 Len=0"
"11","0.743705","62.75.195.236","192.168.138.158","TCP","60","80  >  49184 [FIN, PSH, ACK] Seq=763 Ack=595 Win=64239 Len=0"
"12","0.744737","192.168.138.158","62.75.195.236","TCP","60","49184  >  80 [ACK] Seq=595 Ack=764 Win=63478 Len=0"
"13","0.788952","192.168.138.158","192.168.138.2","DNS","136","Standard query 0x6a70 A ubb67.3c147o.u806a4.w07d919.o5f.f1.b80w.r0faf9.e8mfzdgrf7g0.groupprograms.in"
"14","0.789094","192.168.138.158","192.168.138.2","DNS","135","Standard query 0xf2bb A r03afd2.c3008e.xc07r.b0f.a39.h7f0fa5eu.vb8fbl.e8mfzdgrf7g0.groupprograms.in"
"15","0.932551","192.168.138.2","192.168.138.158","DNS","152","Standard query response 0x6a70 A ubb67.3c147o.u806a4.w07d919.o5f.f1.b80w.r0faf9.e8mfzdgrf7g0.groupprograms.in A 62.75.195.236"
"16","0.932984","192.168.138.158","62.75.195.236","TCP","66","49185  >  80 [SYN] Seq=0 Win=8192 Len=0 MSS=1460 WS=4 SACK_PERM=1"
"17","0.946469","192.168.138.2","192.168.138.158","DNS","151","Standard query response 0xf2bb A r03afd2.c3008e.xc07r.b0f.a39.h7f0fa5eu.vb8fbl.e8mfzdgrf7g0.groupprograms.in A 62.75.195.236"
"18","0.946891","192.168.138.158","62.75.195.236","TCP","66","49186  >  80 [SYN] Seq=0 Win=8192 Len=0 MSS=1460 WS=4 SACK_PERM=1"
"19","1.064582","62.75.195.236","192.168.138.158","TCP","60","80  >  49185 [SYN, ACK] Seq=0 Ack=1 Win=64240 Len=0 MSS=1460"
"20","1.064842","192.168.138.158","62.75.195.236","TCP","60","49185  >  80 [ACK] Seq=1 Ack=1 Win=64240 Len=0"
"21","1.065059","192.168.138.158","62.75.195.236","HTTP","584","GET / HTTP/1.1 "
"22","1.065142","62.75.195.236","192.168.138.158","TCP","60","80  >  49185 [ACK] Seq=1 Ack=531 Win=64240 Len=0"
"23","1.077772","62.75.195.236","192.168.138.158","TCP","60","80  >  49186 [SYN, ACK] Seq=0 Ack=1 Win=64240 Len=0 MSS=1460"
"24","1.077872","192.168.138.158","62.75.195.236","TCP","60","49186  >  80 [ACK] Seq=1 Ack=1 Win=64240 Len=0"
"25","1.078720","192.168.138.158","62.75.195.236","HTTP","741","GET / HTTP/1.1 "
"26","1.078805","62.75.195.236","192.168.138.158","TCP","60","80  >  49186 [ACK] Seq=1 Ack=688 Win=64240 Len=0"
"27","1.222729","62.75.195.236","192.168.138.158","TCP","1421","80  >  49186 [PSH, ACK] Seq=1 Ack=688 Win=64240 Len=1367 [TCP segment of a reassembled PDU]"
"28","1.222897","62.75.195.236","192.168.138.158","TCP","1421","80  >  49186 [PSH, ACK] Seq=1368 Ack=688 Win=64240 Len=1367 [TCP segment of a reassembled PDU]"
"29","1.223440","62.75.195.236","192.168.138.158","TCP","1421","80  >  49186 [PSH, ACK] Seq=2735 Ack=688 Win=64240 Len=1367 [TCP segment of a reassembled PDU]"
"30","1.223541","192.168.138.158","62.75.195.236","TCP","60","49186  >  80 [ACK] Seq=688 Ack=4102 Win=64240 Len=0"
"31","1.223546","62.75.195.236","192.168.138.158","TCP","1421","80  >  49186 [PSH, ACK] Seq=4102 Ack=688 Win=64240 Len=1367 [TCP segment of a reassembled PDU]"
"32","1.223660","62.75.195.236","192.168.138.158","TCP","1421","80  >  49186 [PSH, ACK] Seq=5469 Ack=688 Win=64240 Len=1367 [TCP segment of a reassembled PDU]"
"33","1.223817","192.168.138.158","62.75.195.236","TCP","60","49186  >  80 [ACK] Seq=688 Ack=6836 Win=64240 Len=0"
"34","1.236463","62.75.195.236","192.168.138.158","TCP","1514","80  >  49186 [ACK] Seq=6836 Ack=688 Win=64240 Len=1460 [TCP segment of a reassembled PDU]"
"35","1.236480","62.75.195.236","192.168.138.158","TCP","156","80  >  49186 [PSH, ACK] Seq=8296 Ack=688 Win=64240 Len=102 [TCP segment of a reassembled PDU]"
"36","1.236566","192.168.138.158","62.75.195.236","TCP","60","49186  >  80 [ACK] Seq=688 Ack=8398 Win=64240 Len=0"
"37","1.236660","62.75.195.236","192.168.138.158","TCP","1421","80  >  49186 [PSH, ACK] Seq=8398 Ack=688 Win=64240 Len=1367 [TCP segment of a reassembled PDU]"
"38","1.236756","62.75.195.236","192.168.138.158","TCP","1421","80  >  49186 [PSH, ACK] Seq=9765 Ack=688 Win=64240 Len=1367 [TCP segment of a reassembled PDU]"
"39","1.236814","192.168.138.158","62.75.195.236","TCP","60","49186  >  80 [ACK] Seq=688 Ack=11132 Win=64240 Len=0"
"40","1.236872","62.75.195.236","192.168.138.158","TCP","1421","80  >  49186 [PSH, ACK] Seq=11132 Ack=688 Win=64240 Len=1367 [TCP segment of a reassembled PDU]"
"41","1.327637","62.75.195.236","192.168.138.158","TCP","1421","80  >  49185 [PSH, ACK] Seq=1 Ack=531 Win=64240 Len=1367 [TCP segment of a reassembled PDU]"
"42","1.328118","62.75.195.236","192.168.138.158","TCP","1421","80  >  49185 [PSH, ACK] Seq=1368 Ack=531 Win=64240 Len=1367 [TCP segment of a reassembled PDU]"
"43","1.328210","62.75.195.236","192.168.138.158","TCP","1421","80  >  49185 [PSH, ACK] Seq=2735 Ack=531 Win=64240 Len=1367 [TCP segment of a reassembled PDU]"
"44","1.328318","62.75.195.236","192.168.138.158","TCP","1421","80  >  49185 [PSH, ACK] Seq=4102 Ack=531 Win=64240 Len=1367 [TCP segment of a reassembled PDU]"
"45","1.328430","62.75.195.236","192.168.138.158","TCP","1421","80  >  49185 [PSH, ACK] Seq=5469 Ack=531 Win=64240 Len=1367 [TCP segment of a reassembled PDU]"
"46","1.328438","192.168.138.158","62.75.195.236","TCP","60","49185  >  80 [ACK] Seq=531 Ack=5469 Win=64240 Len=0"
"47","1.338380","192.168.138.158","62.75.195.236","TCP","60","49186  >  80 [ACK] Seq=688 Ack=12499 Win=62873 Len=0"
"48","1.341112","62.75.195.236","192.168.138.158","TCP","1514","80  >  49185 [ACK] Seq=6836 Ack=531 Win=64240 Len=1460 [TCP segment of a reassembled PDU]"
"49","1.341121","62.75.195.236","192.168.138.158","HTTP","955","HTTP/1.1 200 OK  (application/x-shockwave-flash)"
"50","1.341228","192.168.138.158","62.75.195.236","TCP","60","49185  >  80 [ACK] Seq=531 Ack=9198 Win=64240 Len=0"
"51","1.344307","192.168.138.158","62.75.195.236","TCP","60","49185  >  80 [FIN, ACK] Seq=531 Ack=9198 Win=64240 Len=0"
"52","1.344319","62.75.195.236","192.168.138.158","TCP","60","80  >  49185 [ACK] Seq=9198 Ack=532 Win=64239 Len=0"
"53","1.352290","62.75.195.236","192.168.138.158","TCP","1421","80  >  49186 [PSH, ACK] Seq=12499 Ack=688 Win=64240 Len=1367 [TCP segment of a reassembled PDU]"
"54","1.352512","62.75.195.236","192.168.138.158","TCP","1421","80  >  49186 [PSH, ACK] Seq=13866 Ack=688 Win=64240 Len=1367 [TCP segment of a reassembled PDU]"
"55","1.352620","62.75.195.236","192.168.138.158","TCP","1411","80  >  49186 [PSH, ACK] Seq=15233 Ack=688 Win=64240 Len=1357 [TCP segment of a reassembled PDU]"
"56","1.352788","192.168.138.158","62.75.195.236","TCP","60","49186  >  80 [ACK] Seq=688 Ack=16590 Win=64240 Len=0"
"57","1.352793","62.75.195.236","192.168.138.158","TCP","1421","80  >  49186 [PSH, ACK] Seq=16590 Ack=688 Win=64240 Len=1367 [TCP segment of a reassembled PDU]"
"58","1.355279","62.75.195.236","192.168.138.158","TCP","1421","80  >  49186 [PSH, ACK] Seq=17957 Ack=688 Win=64240 Len=1367 [TCP segment of a reassembled PDU]"
"59","1.355524","192.168.138.158","62.75.195.236","TCP","60","49186  >  80 [ACK] Seq=688 Ack=19324 Win=64240 Len=0"
"60","1.365958","62.75.195.236","192.168.138.158","TCP","1421","80  >  49186 [PSH, ACK] Seq=19324 Ack=688 Win=64240 Len=1367 [TCP segment of a reassembled PDU]"
"61","1.366396","62.75.195.236","192.168.138.158","TCP","1421","80  >  49186 [PSH, ACK] Seq=20691 Ack=688 Win=64240 Len=1367 [TCP segment of a reassembled PDU]"
"62","1.366715","62.75.195.236","192.168.138.158","TCP","1514","80  >  49186 [ACK] Seq=22058 Ack=688 Win=64240 Len=1460 [TCP segment of a reassembled PDU]"
"63","1.366732","62.75.195.236","192.168.138.158","TCP","1328","80  >  49186 [PSH, ACK] Seq=23518 Ack=688 Win=64240 Len=1274 [TCP segment of a reassembled PDU]"
"64","1.366738","192.168.138.158","62.75.195.236","TCP","60","49186  >  80 [ACK] Seq=688 Ack=24792 Win=64240 Len=0"
"65","1.367215","62.75.195.236","192.168.138.158","TCP","1421","80  >  49186 [PSH, ACK] Seq=24792 Ack=688 Win=64240 Len=1367 [TCP segment of a reassembled PDU]"
"66","1.368780","62.75.195.236","192.168.138.158","TCP","1421","80  >  49186 [PSH, ACK] Seq=26159 Ack=688 Win=64240 Len=1367 [TCP segment of a reassembled PDU]"
"67","1.369228","192.168.138.158","62.75.195.236","TCP","60","49186  >  80 [ACK] Seq=688 Ack=27526 Win=64240 Len=0"
"68","1.379549","62.75.195.236","192.168.138.158","TCP","1421","80  >  49186 [PSH, ACK] Seq=27526 Ack=688 Win=64240 Len=1367 [TCP segment of a reassembled PDU]"
"69","1.382135","62.75.195.236","192.168.138.158","TCP","1421","80  >  49186 [PSH, ACK] Seq=28893 Ack=688 Win=64240 Len=1367 [TCP segment of a reassembled PDU]"
"70","1.383664","192.168.138.158","62.75.195.236","TCP","60","49186  >  80 [ACK] Seq=688 Ack=30260 Win=64240 Len=0"
"71","1.471040","62.75.195.236","192.168.138.158","TCP","1421","80  >  49186 [PSH, ACK] Seq=30260 Ack=688 Win=64240 Len=1367 [TCP segment of a reassembled PDU]"
"72","1.482517","62.75.195.236","192.168.138.158","TCP","1514","80  >  49186 [ACK] Seq=31627 Ack=688 Win=64240 Len=1460 [TCP segment of a reassembled PDU]"
"73","1.482532","62.75.195.236","192.168.138.158","TCP","1328","80  >  49186 [PSH, ACK] Seq=33087 Ack=688 Win=64240 Len=1274 [TCP segment of a reassembled PDU]"
"74","1.482534","62.75.195.236","192.168.138.158","TCP","1421","80  >  49186 [PSH, ACK] Seq=34361 Ack=688 Win=64240 Len=1367 [TCP segment of a reassembled PDU]"
"75","1.482537","192.168.138.158","62.75.195.236","TCP","60","49186  >  80 [ACK] Seq=688 Ack=34361 Win=64240 Len=0"
"76","1.482730","62.75.195.236","192.168.138.158","TCP","1421","80  >  49186 [PSH, ACK] Seq=35728 Ack=688 Win=64240 Len=1367 [TCP segment of a reassembled PDU]"
"77","1.482887","192.168.138.158","62.75.195.236","TCP","60","49186  >  80 [ACK] Seq=688 Ack=37095 Win=64240 Len=0"
"78","1.484428","62.75.195.236","192.168.138.158","TCP","1421","80  >  49186 [PSH, ACK] Seq=37095 Ack=688 Win=64240 Len=1367 [TCP segment of a reassembled PDU]"
"79","1.484974","62.75.195.236","192.168.138.158","TCP","1421","80  >  49186 [PSH, ACK] Seq=38462 Ack=688 Win=64240 Len=1367 [TCP segment of a reassembled PDU]"
"80","1.485023","192.168.138.158","62.75.195.236","TCP","60","49186  >  80 [ACK] Seq=688 Ack=39829 Win=61506 Len=0"
"81","1.494973","62.75.195.236","192.168.138.158","TCP","1421","80  >  49186 [PSH, ACK] Seq=39829 Ack=688 Win=64240 Len=1367 [TCP segment of a reassembled PDU]"
"82","1.494987","62.75.195.236","192.168.138.158","TCP","1421","80  >  49186 [PSH, ACK] Seq=41196 Ack=688 Win=64240 Len=1367 [TCP segment of a reassembled PDU]"
"83","1.495088","192.168.138.158","62.75.195.236","TCP","60","49186  >  80 [ACK] Seq=688 Ack=42563 Win=58772 Len=0"
"84","1.495743","62.75.195.236","192.168.138.158","TCP","1421","80  >  49186 [PSH, ACK] Seq=42563 Ack=688 Win=64240 Len=1367 [TCP segment of a reassembled PDU]"
"85","1.495854","62.75.195.236","192.168.138.158","TCP","1421","80  >  49186 [PSH, ACK] Seq=43930 Ack=688 Win=64240 Len=1367 [TCP segment of a reassembled PDU]"
"86","1.495939","192.168.138.158","62.75.195.236","TCP","60","49186  >  80 [ACK] Seq=688 Ack=45297 Win=56038 Len=0"
"87","1.495943","62.75.195.236","192.168.138.158","TCP","1421","80  >  49186 [PSH, ACK] Seq=45297 Ack=688 Win=64240 Len=1367 [TCP segment of a reassembled PDU]"
"88","1.496086","62.75.195.236","192.168.138.158","TCP","1421","80  >  49186 [PSH, ACK] Seq=46664 Ack=688 Win=64240 Len=1367 [TCP segment of a reassembled PDU]"
"89","1.496150","192.168.138.158","62.75.195.236","TCP","60","49186  >  80 [ACK] Seq=688 Ack=48031 Win=53304 Len=0"
"90","1.496369","62.75.195.236","192.168.138.158","TCP","1421","80  >  49186 [PSH, ACK] Seq=48031 Ack=688 Win=64240 Len=1367 [TCP segment of a reassembled PDU]"
"91","1.496468","62.75.195.236","192.168.138.158","TCP","1421","80  >  49186 [PSH, ACK] Seq=49398 Ack=688 Win=64240 Len=1367 [TCP segment of a reassembled PDU]"
"92","1.496731","192.168.138.158","62.75.195.236","TCP","60","49186  >  80 [ACK] Seq=688 Ack=50765 Win=50570 Len=0"
"93","1.497963","62.75.195.236","192.168.138.158","TCP","1421","80  >  49186 [PSH, ACK] Seq=50765 Ack=688 Win=64240 Len=1367 [TCP segment of a reassembled PDU]"
"94","1.509036","62.75.195.236","192.168.138.158","TCP","1514","80  >  49186 [ACK] Seq=52132 Ack=688 Win=64240 Len=1460 [TCP segment of a reassembled PDU]"
"95","1.509047","62.75.195.236","192.168.138.158","TCP","1328","80  >  49186 [PSH, ACK] Seq=53592 Ack=688 Win=64240 Len=1274 [TCP segment of a reassembled PDU]"
"96","1.509183","62.75.195.236","192.168.138.158","TCP","1421","80  >  49186 [PSH, ACK] Seq=54866 Ack=688 Win=64240 Len=1367 [TCP segment of a reassembled PDU]"
"97","1.511054","192.168.138.158","62.75.195.236","TCP","60","49186  >  80 [ACK] Seq=688 Ack=56233 Win=45102 Len=0"
"98","1.511200","62.75.195.236","192.168.138.158","TCP","1421","80  >  49186 [PSH, ACK] Seq=56233 Ack=688 Win=64240 Len=1367 [TCP segment of a reassembled PDU]"
"99","1.522056","192.168.138.158","62.75.195.236","TCP","60","49186  >  80 [ACK] Seq=688 Ack=57600 Win=64240 Len=0"
"100","1.524814","62.75.195.236","192.168.138.158","TCP","1514","80  >  49186 [ACK] Seq=57600 Ack=688 Win=64240 Len=1460 [TCP segment of a reassembled PDU]"
"101","1.524821","62.75.195.236","192.168.138.158","TCP","1328","80  >  49186 [PSH, ACK] Seq=59060 Ack=688 Win=64240 Len=1274 [TCP segment of a reassembled PDU]"
"102","1.524903","192.168.138.158","62.75.195.236","TCP","60","49186  >  80 [ACK] Seq=688 Ack=60334 Win=61506 Len=0"
"103","1.612139","62.75.195.236","192.168.138.158","TCP","1421","80  >  49186 [PSH, ACK] Seq=60334 Ack=688 Win=64240 Len=1367 [TCP segment of a reassembled PDU]"
"104","1.612221","62.75.195.236","192.168.138.158","TCP","1421","80  >  49186 [PSH, ACK] Seq=61701 Ack=688 Win=64240 Len=1367 [TCP segment of a reassembled PDU]"
"105","1.612411","192.168.138.158","62.75.195.236","TCP","60","49186  >  80 [ACK] Seq=688 Ack=63068 Win=58772 Len=0"
"106","1.612465","62.75.195.236","192.168.138.158","TCP","1421","80  >  49186 [PSH, ACK] Seq=63068 Ack=688 Win=64240 Len=1367 [TCP segment of a reassembled PDU]"
"107","1.612697","62.75.195.236","192.168.138.158","TCP","1421","80  >  49186 [PSH, ACK] Seq=64435 Ack=688 Win=64240 Len=1367 [TCP segment of a reassembled PDU]"
"108","1.612796","192.168.138.158","62.75.195.236","TCP","60","49186  >  80 [ACK] Seq=688 Ack=65802 Win=56038 Len=0"
"109","1.612799","62.75.195.236","192.168.138.158","TCP","1421","80  >  49186 [PSH, ACK] Seq=65802 Ack=688 Win=64240 Len=1367 [TCP segment of a reassembled PDU]"
"110","1.614004","62.75.195.236","192.168.138.158","TCP","1421","80  >  49186 [PSH, ACK] Seq=67169 Ack=688 Win=64240 Len=1367 [TCP segment of a reassembled PDU]"
"111","1.614053","62.75.195.236","192.168.138.158","TCP","1421","80  >  49186 [PSH, ACK] Seq=68536 Ack=688 Win=64240 Len=1367 [TCP segment of a reassembled PDU]"
"112","1.614100","192.168.138.158","62.75.195.236","TCP","60","49186  >  80 [ACK] Seq=688 Ack=69903 Win=51937 Len=0"
"113","1.614359","62.75.195.236","192.168.138.158","TCP","1421","80  >  49186 [PSH, ACK] Seq=69903 Ack=688 Win=64240 Len=1367 [TCP segment of a reassembled PDU]"
"114","1.614569","62.75.195.236","192.168.138.158","TCP","1421","80  >  49186 [PSH, ACK] Seq=71270 Ack=688 Win=64240 Len=1367 [TCP segment of a reassembled PDU]"
"115","1.614622","192.168.138.158","62.75.195.236","TCP","60","49186  >  80 [ACK] Seq=688 Ack=72637 Win=49203 Len=0"
"116","1.625601","62.75.195.236","192.168.138.158","TCP","1421","80  >  49186 [PSH, ACK] Seq=72637 Ack=688 Win=64240 Len=1367 [TCP segment of a reassembled PDU]"
"117","1.625802","62.75.195.236","192.168.138.158","TCP","1421","80  >  49186 [PSH, ACK] Seq=74004 Ack=688 Win=64240 Len=1367 [TCP segment of a reassembled PDU]"
"118","1.625879","192.168.138.158","62.75.195.236","TCP","60","49186  >  80 [ACK] Seq=688 Ack=75371 Win=46469 Len=0"
"119","1.625953","62.75.195.236","192.168.138.158","TCP","1421","80  >  49186 [PSH, ACK] Seq=75371 Ack=688 Win=64240 Len=1367 [TCP segment of a reassembled PDU]"
"120","1.626055","62.75.195.236","192.168.138.158","TCP","1421","80  >  49186 [PSH, ACK] Seq=76738 Ack=688 Win=64240 Len=1367 [TCP segment of a reassembled PDU]"
"121","1.626149","62.75.195.236","192.168.138.158","TCP","1421","80  >  49186 [PSH, ACK] Seq=78105 Ack=688 Win=64240 Len=1367 [TCP segment of a reassembled PDU]"
"122","1.626218","192.168.138.158","62.75.195.236","TCP","60","49186  >  80 [ACK] Seq=688 Ack=79472 Win=42368 Len=0"
"123","1.626313","62.75.195.236","192.168.138.158","TCP","1421","80  >  49186 [PSH, ACK] Seq=79472 Ack=688 Win=64240 Len=1367 [TCP segment of a reassembled PDU]"
"124","1.626387","62.75.195.236","192.168.138.158","TCP","1421","80  >  49186 [PSH, ACK] Seq=80839 Ack=688 Win=64240 Len=1367 [TCP segment of a reassembled PDU]"
"125","1.626496","192.168.138.158","62.75.195.236","TCP","60","49186  >  80 [ACK] Seq=688 Ack=82206 Win=39634 Len=0"
"126","1.626618","62.75.195.236","192.168.138.158","TCP","1421","80  >  49186 [PSH, ACK] Seq=82206 Ack=688 Win=64240 Len=1367 [TCP segment of a reassembled PDU]"
"127","1.628622","62.75.195.236","192.168.138.158","TCP","1421","80  >  49186 [PSH, ACK] Seq=83573 Ack=688 Win=64240 Len=1367 [TCP segment of a reassembled PDU]"
"128","1.628693","192.168.138.158","62.75.195.236","TCP","60","49186  >  80 [ACK] Seq=688 Ack=84940 Win=36900 Len=0"
"129","1.628697","62.75.195.236","192.168.138.158","TCP","1421","80  >  49186 [PSH, ACK] Seq=84940 Ack=688 Win=64240 Len=1367 [TCP segment of a reassembled PDU]"
"130","1.628844","62.75.195.236","192.168.138.158","TCP","1421","80  >  49186 [PSH, ACK] Seq=86307 Ack=688 Win=64240 Len=1367 [TCP segment of a reassembled PDU]"
"131","1.628900","192.168.138.158","62.75.195.236","TCP","60","49186  >  80 [ACK] Seq=688 Ack=87674 Win=34166 Len=0"
"132","1.628982","62.75.195.236","192.168.138.158","TCP","1421","80  >  49186 [PSH, ACK] Seq=87674 Ack=688 Win=64240 Len=1367 [TCP segment of a reassembled PDU]"
"133","1.639696","62.75.195.236","192.168.138.158","TCP","1421","80  >  49186 [PSH, ACK] Seq=89041 Ack=688 Win=64240 Len=1367 [TCP segment of a reassembled PDU]"
"134","1.639748","62.75.195.236","192.168.138.158","TCP","1421","80  >  49186 [PSH, ACK] Seq=90408 Ack=688 Win=64240 Len=1367 [TCP segment of a reassembled PDU]"
"135","1.639754","192.168.138.158","62.75.195.236","TCP","60","49186  >  80 [ACK] Seq=688 Ack=90408 Win=31432 Len=0"
"136","1.640119","62.75.195.236","192.168.138.158","TCP","1421","80  >  49186 [PSH, ACK] Seq=91775 Ack=688 Win=64240 Len=1367 [TCP segment of a reassembled PDU]"
"137","1.640168","192.168.138.158","62.75.195.236","TCP","60","49186  >  80 [ACK] Seq=688 Ack=93142 Win=28698 Len=0"
"138","1.640275","62.75.195.236","192.168.138.158","TCP","1421","80  >  49186 [PSH, ACK] Seq=93142 Ack=688 Win=64240 Len=1367 [TCP segment of a reassembled PDU]"
"139","1.640324","62.75.195.236","192.168.138.158","TCP","1421","80  >  49186 [PSH, ACK] Seq=94509 Ack=688 Win=64240 Len=1367 [TCP segment of a reassembled PDU]"
"140","1.640391","192.168.138.158","62.75.195.236","TCP","60","49186  >  80 [ACK] Seq=688 Ack=95876 Win=25964 Len=0"
"141","1.640547","62.75.195.236","192.168.138.158","TCP","1421","80  >  49186 [PSH, ACK] Seq=95876 Ack=688 Win=64240 Len=1367 [TCP segment of a reassembled PDU]"
"142","1.653652","62.75.195.236","192.168.138.158","TCP","1421","80  >  49186 [PSH, ACK] Seq=97243 Ack=688 Win=64240 Len=1367 [TCP segment of a reassembled PDU]"
"143","1.653743","192.168.138.158","62.75.195.236","TCP","60","49186  >  80 [ACK] Seq=688 Ack=98610 Win=23230 Len=0"
"144","1.654177","62.75.195.236","192.168.138.158","TCP","1421","80  >  49186 [PSH, ACK] Seq=98610 Ack=688 Win=64240 Len=1367 [TCP segment of a reassembled PDU]"
"145","1.666933","62.75.195.236","192.168.138.158","TCP","1421","80  >  49186 [PSH, ACK] Seq=99977 Ack=688 Win=64240 Len=1367 [TCP segment of a reassembled PDU]"
"146","1.666991","192.168.138.158","62.75.195.236","TCP","60","49186  >  80 [ACK] Seq=688 Ack=101344 Win=20496 Len=0"
"147","1.700600","62.75.195.236","192.168.138.158","TCP","1421","80  >  49186 [PSH, ACK] Seq=101344 Ack=688 Win=64240 Len=1367 [TCP segment of a reassembled PDU]"
"148","1.700829","62.75.195.236","192.168.138.158","TCP","1421","80  >  49186 [PSH, ACK] Seq=102711 Ack=688 Win=64240 Len=1367 [TCP segment of a reassembled PDU]"
"149","1.700915","62.75.195.236","192.168.138.158","TCP","1421","80  >  49186 [PSH, ACK] Seq=104078 Ack=688 Win=64240 Len=1367 [TCP segment of a reassembled PDU]"
"150","1.703453","192.168.138.158","62.75.195.236","TCP","60","49186  >  80 [ACK] Seq=688 Ack=105445 Win=16395 Len=0"
"151","1.713943","62.75.195.236","192.168.138.158","TCP","1421","80  >  49186 [PSH, ACK] Seq=105445 Ack=688 Win=64240 Len=1367 [TCP segment of a reassembled PDU]"
"152","1.742283","62.75.195.236","192.168.138.158","TCP","1421","80  >  49186 [PSH, ACK] Seq=106812 Ack=688 Win=64240 Len=1367 [TCP segment of a reassembled PDU]"
"153","1.742395","192.168.138.158","62.75.195.236","TCP","60","49186  >  80 [ACK] Seq=688 Ack=108179 Win=13661 Len=0"
"154","1.744057","62.75.195.236","192.168.138.158","TCP","1421","80  >  49186 [PSH, ACK] Seq=108179 Ack=688 Win=64240 Len=1367 [TCP segment of a reassembled PDU]"
"155","1.744194","62.75.195.236","192.168.138.158","TCP","1421","80  >  49186 [PSH, ACK] Seq=109546 Ack=688 Win=64240 Len=1367 [TCP segment of a reassembled PDU]"
"156","1.744298","62.75.195.236","192.168.138.158","TCP","1421","80  >  49186 [PSH, ACK] Seq=110913 Ack=688 Win=64240 Len=1367 [TCP segment of a reassembled PDU]"
"157","1.744406","62.75.195.236","192.168.138.158","TCP","1421","80  >  49186 [PSH, ACK] Seq=112280 Ack=688 Win=64240 Len=1367 [TCP segment of a reassembled PDU]"
"158","1.744746","62.75.195.236","192.168.138.158","TCP","1421","80  >  49186 [PSH, ACK] Seq=113647 Ack=688 Win=64240 Len=1367 [TCP segment of a reassembled PDU]"
"159","1.744855","62.75.195.236","192.168.138.158","TCP","1421","80  >  49186 [PSH, ACK] Seq=115014 Ack=688 Win=64240 Len=1367 [TCP segment of a reassembled PDU]"
"160","1.746380","192.168.138.158","62.75.195.236","TCP","60","49186  >  80 [ACK] Seq=688 Ack=116381 Win=5459 Len=0"
"161","1.754639","62.75.195.236","192.168.138.158","TCP","1421","80  >  49186 [PSH, ACK] Seq=116381 Ack=688 Win=64240 Len=1367 [TCP segment of a reassembled PDU]"
"162","1.754655","62.75.195.236","192.168.138.158","TCP","1421","80  >  49186 [PSH, ACK] Seq=117748 Ack=688 Win=64240 Len=1367 [TCP segment of a reassembled PDU]"
"163","1.754693","192.168.138.158","62.75.195.236","TCP","60","49186  >  80 [ACK] Seq=688 Ack=119115 Win=2725 Len=0"
"164","1.754695","62.75.195.236","192.168.138.158","TCP","1421","80  >  49186 [PSH, ACK] Seq=119115 Ack=688 Win=64240 Len=1367 [TCP segment of a reassembled PDU]"
"165","1.755570","62.75.195.236","192.168.138.158","TCP","1412","[TCP Window Full] 80  >  49186 [PSH, ACK] Seq=120482 Ack=688 Win=64240 Len=1358 [TCP segment of a reassembled PDU]"
"166","1.757942","192.168.138.158","62.75.195.236","TCP","60","[TCP ZeroWindow] 49186  >  80 [ACK] Seq=688 Ack=121840 Win=0 Len=0"
"167","1.758002","62.75.195.236","192.168.138.158","TCP","60","[TCP ZeroWindowProbe] 80  >  49186 [PSH, ACK] Seq=121840 Ack=688 Win=64240 Len=1 [TCP segment of a reassembled PDU]"
"168","1.758043","192.168.138.158","62.75.195.236","TCP","60","[TCP ZeroWindowProbeAck] [TCP ZeroWindow] 49186  >  80 [ACK] Seq=688 Ack=121840 Win=0 Len=0"
"169","2.010995","192.168.138.158","62.75.195.236","TCP","66","49188  >  80 [SYN] Seq=0 Win=8192 Len=0 MSS=1460 WS=4 SACK_PERM=1"
"170","2.146652","62.75.195.236","192.168.138.158","TCP","60","80  >  49188 [SYN, ACK] Seq=0 Ack=1 Win=64240 Len=0 MSS=1460"
"171","2.146841","192.168.138.158","62.75.195.236","TCP","60","49188  >  80 [ACK] Seq=1 Ack=1 Win=64240 Len=0"
"172","2.146846","192.168.138.158","62.75.195.236","HTTP","125","GET /aa25f5fe2875e3d0a244e6969e589cc4 HTTP/1.1 "
"173","2.146915","62.75.195.236","192.168.138.158","TCP","60","80  >  49188 [ACK] Seq=1 Ack=72 Win=64240 Len=0"
"174","2.259980","62.75.195.236","192.168.138.158","TCP","60","[TCP ZeroWindowProbe] 80  >  49186 [PSH, ACK] Seq=121840 Ack=688 Win=64240 Len=1 [TCP segment of a reassembled PDU]"
"175","2.260086","192.168.138.158","62.75.195.236","TCP","60","[TCP ZeroWindowProbeAck] [TCP ZeroWindow] 49186  >  80 [ACK] Seq=688 Ack=121840 Win=0 Len=0"
"176","2.409528","62.75.195.236","192.168.138.158","HTTP","1117","HTTP/1.1 200 OK  (text/html)"
"177","2.410238","192.168.138.158","62.75.195.236","TCP","60","49188  >  80 [FIN, ACK] Seq=72 Ack=1064 Win=63177 Len=0"
"178","2.410290","62.75.195.236","192.168.138.158","TCP","60","80  >  49188 [ACK] Seq=1064 Ack=73 Win=64239 Len=0"
"179","2.414023","192.168.138.158","62.75.195.236","TCP","66","49189  >  80 [SYN] Seq=0 Win=8192 Len=0 MSS=1460 WS=4 SACK_PERM=1"
"180","2.422810","62.75.195.236","192.168.138.158","TCP","60","80  >  49188 [FIN, PSH, ACK] Seq=1064 Ack=73 Win=64239 Len=0"
"181","2.422975","192.168.138.158","62.75.195.236","TCP","60","49188  >  80 [ACK] Seq=73 Ack=1065 Win=63177 Len=0"
"182","2.548981","62.75.195.236","192.168.138.158","TCP","60","80  >  49189 [SYN, ACK] Seq=0 Ack=1 Win=64240 Len=0 MSS=1460"
"183","2.549128","192.168.138.158","62.75.195.236","TCP","60","49189  >  80 [ACK] Seq=1 Ack=1 Win=64240 Len=0"
"184","2.549295","192.168.138.158","62.75.195.236","HTTP","367","GET /?b514ee6f0fe486009a6d83b035a4c0bd HTTP/1.1 "
"185","2.549367","62.75.195.236","192.168.138.158","TCP","60","80  >  49189 [ACK] Seq=1 Ack=314 Win=64240 Len=0"
"186","2.691032","62.75.195.236","192.168.138.158","TCP","1421","80  >  49189 [PSH, ACK] Seq=1 Ack=314 Win=64240 Len=1367 [TCP segment of a reassembled PDU]"
"187","2.691046","62.75.195.236","192.168.138.158","TCP","1421","80  >  49189 [PSH, ACK] Seq=1368 Ack=314 Win=64240 Len=1367 [TCP segment of a reassembled PDU]"
"188","2.691079","62.75.195.236","192.168.138.158","TCP","1421","80  >  49189 [PSH, ACK] Seq=2735 Ack=314 Win=64240 Len=1367 [TCP segment of a reassembled PDU]"
"189","2.691171","192.168.138.158","62.75.195.236","TCP","60","49189  >  80 [ACK] Seq=314 Ack=4102 Win=64240 Len=0"
"190","2.691331","62.75.195.236","192.168.138.158","TCP","1421","80  >  49189 [PSH, ACK] Seq=4102 Ack=314 Win=64240 Len=1367 [TCP segment of a reassembled PDU]"
"191","2.703189","62.75.195.236","192.168.138.158","TCP","1421","80  >  49189 [PSH, ACK] Seq=5469 Ack=314 Win=64240 Len=1367 [TCP segment of a reassembled PDU]"
"192","2.703201","62.75.195.236","192.168.138.158","TCP","1514","80  >  49189 [ACK] Seq=6836 Ack=314 Win=64240 Len=1460 [TCP segment of a reassembled PDU]"
"193","2.703214","62.75.195.236","192.168.138.158","TCP","156","80  >  49189 [PSH, ACK] Seq=8296 Ack=314 Win=64240 Len=102 [TCP segment of a reassembled PDU]"
"194","2.703289","62.75.195.236","192.168.138.158","TCP","1421","80  >  49189 [PSH, ACK] Seq=8398 Ack=314 Win=64240 Len=1367 [TCP segment of a reassembled PDU]"
"195","2.703296","192.168.138.158","62.75.195.236","TCP","60","49189  >  80 [ACK] Seq=314 Ack=8398 Win=64240 Len=0"
"196","2.703720","62.75.195.236","192.168.138.158","TCP","1421","80  >  49189 [PSH, ACK] Seq=9765 Ack=314 Win=64240 Len=1367 [TCP segment of a reassembled PDU]"
"197","2.703754","192.168.138.158","62.75.195.236","TCP","60","49189  >  80 [ACK] Seq=314 Ack=11132 Win=64240 Len=0"
"198","2.703952","62.75.195.236","192.168.138.158","TCP","1421","80  >  49189 [PSH, ACK] Seq=11132 Ack=314 Win=64240 Len=1367 [TCP segment of a reassembled PDU]"
"199","2.803675","62.75.195.236","192.168.138.158","TCP","1421","[TCP Retransmission] 80  >  49189 [PSH, ACK] Seq=11132 Ack=314 Win=64240 Len=1367"
"200","2.803802","192.168.138.158","62.75.195.236","TCP","60","49189  >  80 [ACK] Seq=314 Ack=12499 Win=62873 Len=0"
"201","2.816020","62.75.195.236","192.168.138.158","TCP","1421","80  >  49189 [PSH, ACK] Seq=12499 Ack=314 Win=64240 Len=1367 [TCP segment of a reassembled PDU]"
"202","2.816036","62.75.195.236","192.168.138.158","TCP","1421","80  >  49189 [PSH, ACK] Seq=13866 Ack=314 Win=64240 Len=1367 [TCP segment of a reassembled PDU]"
"203","2.816162","192.168.138.158","62.75.195.236","TCP","60","49189  >  80 [ACK] Seq=314 Ack=15233 Win=64240 Len=0"
"204","2.827879","62.75.195.236","192.168.138.158","TCP","1411","80  >  49189 [PSH, ACK] Seq=15233 Ack=314 Win=64240 Len=1357 [TCP segment of a reassembled PDU]"
"205","2.828256","62.75.195.236","192.168.138.158","TCP","1421","80  >  49189 [PSH, ACK] Seq=16590 Ack=314 Win=64240 Len=1367 [TCP segment of a reassembled PDU]"
"206","2.828306","192.168.138.158","62.75.195.236","TCP","60","49189  >  80 [ACK] Seq=314 Ack=17957 Win=64240 Len=0"
"207","2.828965","62.75.195.236","192.168.138.158","TCP","1421","80  >  49189 [PSH, ACK] Seq=17957 Ack=314 Win=64240 Len=1367 [TCP segment of a reassembled PDU]"
"208","2.829049","62.75.195.236","192.168.138.158","TCP","1421","80  >  49189 [PSH, ACK] Seq=19324 Ack=314 Win=64240 Len=1367 [TCP segment of a reassembled PDU]"
"209","2.829152","192.168.138.158","62.75.195.236","TCP","60","49189  >  80 [ACK] Seq=314 Ack=20691 Win=64240 Len=0"
"210","2.829260","62.75.195.236","192.168.138.158","TCP","1421","80  >  49189 [PSH, ACK] Seq=20691 Ack=314 Win=64240 Len=1367 [TCP segment of a reassembled PDU]"
"211","2.829347","62.75.195.236","192.168.138.158","TCP","1421","80  >  49189 [PSH, ACK] Seq=22058 Ack=314 Win=64240 Len=1367 [TCP segment of a reassembled PDU]"
"212","2.829380","192.168.138.158","62.75.195.236","TCP","60","49189  >  80 [ACK] Seq=314 Ack=23425 Win=64240 Len=0"
"213","2.829496","62.75.195.236","192.168.138.158","TCP","1421","80  >  49189 [PSH, ACK] Seq=23425 Ack=314 Win=64240 Len=1367 [TCP segment of a reassembled PDU]"
"214","2.829593","62.75.195.236","192.168.138.158","TCP","1421","80  >  49189 [PSH, ACK] Seq=24792 Ack=314 Win=64240 Len=1367 [TCP segment of a reassembled PDU]"
"215","2.829688","62.75.195.236","192.168.138.158","TCP","1421","80  >  49189 [PSH, ACK] Seq=26159 Ack=314 Win=64240 Len=1367 [TCP segment of a reassembled PDU]"
"216","2.829692","192.168.138.158","62.75.195.236","TCP","60","49189  >  80 [ACK] Seq=314 Ack=26159 Win=64240 Len=0"
"217","2.830828","62.75.195.236","192.168.138.158","TCP","1421","80  >  49189 [PSH, ACK] Seq=27526 Ack=314 Win=64240 Len=1367 [TCP segment of a reassembled PDU]"
"218","2.830908","192.168.138.158","62.75.195.236","TCP","60","49189  >  80 [ACK] Seq=314 Ack=28893 Win=64240 Len=0"
"219","2.843100","62.75.195.236","192.168.138.158","TCP","1421","80  >  49189 [PSH, ACK] Seq=28893 Ack=314 Win=64240 Len=1367 [TCP segment of a reassembled PDU]"
"220","2.934548","62.75.195.236","192.168.138.158","TCP","1421","80  >  49189 [PSH, ACK] Seq=30260 Ack=314 Win=64240 Len=1367 [TCP segment of a reassembled PDU]"
"221","2.934603","192.168.138.158","62.75.195.236","TCP","60","49189  >  80 [ACK] Seq=314 Ack=31627 Win=64240 Len=0"
"222","2.943997","62.75.195.236","192.168.138.158","TCP","1421","80  >  49189 [PSH, ACK] Seq=31627 Ack=314 Win=64240 Len=1367 [TCP segment of a reassembled PDU]"
"223","2.944076","62.75.195.236","192.168.138.158","TCP","1421","80  >  49189 [PSH, ACK] Seq=32994 Ack=314 Win=64240 Len=1367 [TCP segment of a reassembled PDU]"
"224","2.944221","192.168.138.158","62.75.195.236","TCP","60","49189  >  80 [ACK] Seq=314 Ack=34361 Win=64240 Len=0"
"225","2.944227","62.75.195.236","192.168.138.158","TCP","1421","80  >  49189 [PSH, ACK] Seq=34361 Ack=314 Win=64240 Len=1367 [TCP segment of a reassembled PDU]"
"226","2.944370","62.75.195.236","192.168.138.158","TCP","1421","80  >  49189 [PSH, ACK] Seq=35728 Ack=314 Win=64240 Len=1367 [TCP segment of a reassembled PDU]"
"227","2.944580","192.168.138.158","62.75.195.236","TCP","60","49189  >  80 [ACK] Seq=314 Ack=37095 Win=64240 Len=0"
"228","2.948086","62.75.195.236","192.168.138.158","TCP","1421","80  >  49189 [PSH, ACK] Seq=37095 Ack=314 Win=64240 Len=1367 [TCP segment of a reassembled PDU]"
"229","2.953595","62.75.195.236","192.168.138.158","TCP","1421","80  >  49189 [PSH, ACK] Seq=38462 Ack=314 Win=64240 Len=1367 [TCP segment of a reassembled PDU]"
"230","2.954465","192.168.138.158","62.75.195.236","TCP","60","49189  >  80 [ACK] Seq=314 Ack=39829 Win=64240 Len=0"
"231","2.954469","62.75.195.236","192.168.138.158","TCP","1421","80  >  49189 [PSH, ACK] Seq=39829 Ack=314 Win=64240 Len=1367 [TCP segment of a reassembled PDU]"
"232","2.954471","62.75.195.236","192.168.138.158","TCP","1421","80  >  49189 [PSH, ACK] Seq=41196 Ack=314 Win=64240 Len=1367 [TCP segment of a reassembled PDU]"
"233","2.954473","192.168.138.158","62.75.195.236","TCP","60","49189  >  80 [ACK] Seq=314 Ack=42563 Win=64240 Len=0"
"234","2.954474","62.75.195.236","192.168.138.158","TCP","1421","80  >  49189 [PSH, ACK] Seq=42563 Ack=314 Win=64240 Len=1367 [TCP segment of a reassembled PDU]"
"235","2.954475","62.75.195.236","192.168.138.158","TCP","1421","80  >  49189 [PSH, ACK] Seq=43930 Ack=314 Win=64240 Len=1367 [TCP segment of a reassembled PDU]"
"236","2.954477","192.168.138.158","62.75.195.236","TCP","60","49189  >  80 [ACK] Seq=314 Ack=45297 Win=64240 Len=0"
"237","2.958223","62.75.195.236","192.168.138.158","TCP","1421","80  >  49189 [PSH, ACK] Seq=45297 Ack=314 Win=64240 Len=1367 [TCP segment of a reassembled PDU]"
"238","2.958344","62.75.195.236","192.168.138.158","TCP","1421","80  >  49189 [PSH, ACK] Seq=46664 Ack=314 Win=64240 Len=1367 [TCP segment of a reassembled PDU]"
"239","2.958347","62.75.195.236","192.168.138.158","TCP","1421","80  >  49189 [PSH, ACK] Seq=48031 Ack=314 Win=64240 Len=1367 [TCP segment of a reassembled PDU]"
"240","2.958420","62.75.195.236","192.168.138.158","TCP","1421","80  >  49189 [PSH, ACK] Seq=49398 Ack=314 Win=64240 Len=1367 [TCP segment of a reassembled PDU]"
"241","2.958432","192.168.138.158","62.75.195.236","TCP","60","49189  >  80 [ACK] Seq=314 Ack=48031 Win=64240 Len=0"
"242","2.958476","192.168.138.158","62.75.195.236","TCP","60","49189  >  80 [ACK] Seq=314 Ack=50765 Win=64240 Len=0"
"243","2.958609","62.75.195.236","192.168.138.158","TCP","1421","80  >  49189 [PSH, ACK] Seq=50765 Ack=314 Win=64240 Len=1367 [TCP segment of a reassembled PDU]"
"244","2.958715","62.75.195.236","192.168.138.158","TCP","1421","80  >  49189 [PSH, ACK] Seq=52132 Ack=314 Win=64240 Len=1367 [TCP segment of a reassembled PDU]"
"245","2.958841","192.168.138.158","62.75.195.236","TCP","60","49189  >  80 [ACK] Seq=314 Ack=53499 Win=64240 Len=0"
"246","2.958847","62.75.195.236","192.168.138.158","TCP","1421","80  >  49189 [PSH, ACK] Seq=53499 Ack=314 Win=64240 Len=1367 [TCP segment of a reassembled PDU]"
"247","2.958921","62.75.195.236","192.168.138.158","TCP","1421","80  >  49189 [PSH, ACK] Seq=54866 Ack=314 Win=64240 Len=1367 [TCP segment of a reassembled PDU]"
"248","2.959054","192.168.138.158","62.75.195.236","TCP","60","49189  >  80 [ACK] Seq=314 Ack=56233 Win=61506 Len=0"
"249","2.959922","192.168.138.158","62.75.195.236","TCP","60","[TCP Window Update] 49189  >  80 [ACK] Seq=314 Ack=56233 Win=64240 Len=0"
"250","2.961755","62.75.195.236","192.168.138.158","TCP","1421","80  >  49189 [PSH, ACK] Seq=56233 Ack=314 Win=64240 Len=1367 [TCP segment of a reassembled PDU]"
"251","3.009176","62.75.195.236","192.168.138.158","TCP","1421","80  >  49189 [PSH, ACK] Seq=57600 Ack=314 Win=64240 Len=1367 [TCP segment of a reassembled PDU]"
"252","3.009440","192.168.138.158","62.75.195.236","TCP","60","49189  >  80 [ACK] Seq=314 Ack=58967 Win=64240 Len=0"
"253","3.023756","62.75.195.236","192.168.138.158","TCP","1421","80  >  49189 [PSH, ACK] Seq=58967 Ack=314 Win=64240 Len=1367 [TCP segment of a reassembled PDU]"
"254","3.071004","62.75.195.236","192.168.138.158","TCP","1421","80  >  49189 [PSH, ACK] Seq=60334 Ack=314 Win=64240 Len=1367 [TCP segment of a reassembled PDU]"
"255","3.071118","192.168.138.158","62.75.195.236","TCP","60","49189  >  80 [ACK] Seq=314 Ack=61701 Win=64240 Len=0"
"256","3.071211","62.75.195.236","192.168.138.158","TCP","1421","80  >  49189 [PSH, ACK] Seq=61701 Ack=314 Win=64240 Len=1367 [TCP segment of a reassembled PDU]"
"257","3.071266","62.75.195.236","192.168.138.158","TCP","1421","80  >  49189 [PSH, ACK] Seq=63068 Ack=314 Win=64240 Len=1367 [TCP segment of a reassembled PDU]"
"258","3.071335","192.168.138.158","62.75.195.236","TCP","60","49189  >  80 [ACK] Seq=314 Ack=64435 Win=64240 Len=0"
"259","3.072591","62.75.195.236","192.168.138.158","TCP","1421","80  >  49189 [PSH, ACK] Seq=64435 Ack=314 Win=64240 Len=1367 [TCP segment of a reassembled PDU]"
"260","3.072754","62.75.195.236","192.168.138.158","TCP","1421","80  >  49189 [PSH, ACK] Seq=65802 Ack=314 Win=64240 Len=1367 [TCP segment of a reassembled PDU]"
"261","3.072803","192.168.138.158","62.75.195.236","TCP","60","49189  >  80 [ACK] Seq=314 Ack=67169 Win=64240 Len=0"
"262","3.080277","62.75.195.236","192.168.138.158","TCP","1514","80  >  49189 [ACK] Seq=67169 Ack=314 Win=64240 Len=1460 [TCP segment of a reassembled PDU]"
"263","3.080289","62.75.195.236","192.168.138.158","TCP","1328","80  >  49189 [PSH, ACK] Seq=68629 Ack=314 Win=64240 Len=1274 [TCP segment of a reassembled PDU]"
"264","3.080413","192.168.138.158","62.75.195.236","TCP","60","49189  >  80 [ACK] Seq=314 Ack=69903 Win=64240 Len=0"
"265","3.080418","62.75.195.236","192.168.138.158","TCP","1421","80  >  49189 [PSH, ACK] Seq=69903 Ack=314 Win=64240 Len=1367 [TCP segment of a reassembled PDU]"
"266","3.080524","62.75.195.236","192.168.138.158","TCP","1421","80  >  49189 [PSH, ACK] Seq=71270 Ack=314 Win=64240 Len=1367 [TCP segment of a reassembled PDU]"
"267","3.080594","192.168.138.158","62.75.195.236","TCP","60","49189  >  80 [ACK] Seq=314 Ack=72637 Win=64240 Len=0"
"268","3.082195","62.75.195.236","192.168.138.158","TCP","1421","80  >  49189 [PSH, ACK] Seq=72637 Ack=314 Win=64240 Len=1367 [TCP segment of a reassembled PDU]"
"269","3.085369","62.75.195.236","192.168.138.158","TCP","1514","80  >  49189 [ACK] Seq=74004 Ack=314 Win=64240 Len=1460 [TCP segment of a reassembled PDU]"
"270","3.085385","62.75.195.236","192.168.138.158","TCP","1328","80  >  49189 [PSH, ACK] Seq=75464 Ack=314 Win=64240 Len=1274 [TCP segment of a reassembled PDU]"
"271","3.085387","62.75.195.236","192.168.138.158","TCP","1514","80  >  49189 [ACK] Seq=76738 Ack=314 Win=64240 Len=1460 [TCP segment of a reassembled PDU]"
"272","3.085389","62.75.195.236","192.168.138.158","TCP","1328","80  >  49189 [PSH, ACK] Seq=78198 Ack=314 Win=64240 Len=1274 [TCP segment of a reassembled PDU]"
"273","3.085545","192.168.138.158","62.75.195.236","TCP","60","49189  >  80 [ACK] Seq=314 Ack=76738 Win=64240 Len=0"
"274","3.085549","192.168.138.158","62.75.195.236","TCP","60","49189  >  80 [ACK] Seq=314 Ack=79472 Win=64240 Len=0"
"275","3.085551","62.75.195.236","192.168.138.158","TCP","1421","80  >  49189 [PSH, ACK] Seq=79472 Ack=314 Win=64240 Len=1367 [TCP segment of a reassembled PDU]"
"276","3.085606","62.75.195.236","192.168.138.158","TCP","1421","80  >  49189 [PSH, ACK] Seq=80839 Ack=314 Win=64240 Len=1367 [TCP segment of a reassembled PDU]"
"277","3.085742","192.168.138.158","62.75.195.236","TCP","60","49189  >  80 [ACK] Seq=314 Ack=82206 Win=64240 Len=0"
