"No.","Time","Source","Destination","Protocol","Length","Info"
"1","0.000000","192.168.137.113","224.0.0.22","IGMPv3","60","Membership Report / Leave group 224.0.0.252"
"2","0.003202","192.168.137.113","224.0.0.22","IGMPv3","60","Membership Report / Join group 224.0.0.252 for any sources"
"3","0.004858","192.168.137.113","224.0.0.252","LLMNR","72","Standard query 0xea7b ANY Pertruide-PC"
"4","0.065139","192.168.137.113","192.168.137.255","NBNS","110","Registration NB PERTRUIDE-PC<00>"
"5","0.065286","192.168.137.113","192.168.137.255","NBNS","110","Registration NB WORKGROUP<00>"
"6","0.065431","192.168.137.113","192.168.137.255","NBNS","110","Registration NB PERTRUIDE-PC<20>"
"7","0.095812","192.168.137.113","224.0.0.22","IGMPv3","60","Membership Report / Join group 224.0.0.252 for any sources"
"8","0.111548","192.168.137.113","224.0.0.252","LLMNR","72","Standard query 0xea7b ANY Pertruide-PC"
"9","0.261891","192.168.137.113","192.168.137.1","DNS","91","Standard query 0x5999 SRV _ldap._tcp.dc._msdcs.mshome.net"
"10","0.262249","192.168.137.1","192.168.137.113","DNS","91","Standard query response 0x5999 No such name SRV _ldap._tcp.dc._msdcs.mshome.net"
"11","0.263955","192.168.137.113","192.168.137.1","DNS","91","Standard query 0x9f77 SRV _ldap._tcp.dc._msdcs.mshome.net"
"12","0.264186","192.168.137.1","192.168.137.113","DNS","91","Standard query response 0x9f77 No such name SRV _ldap._tcp.dc._msdcs.mshome.net"
"13","0.829076","192.168.137.113","192.168.137.255","NBNS","110","Registration NB PERTRUIDE-PC<20>"
"14","0.829126","192.168.137.113","192.168.137.255","NBNS","110","Registration NB WORKGROUP<00>"
"15","0.829128","192.168.137.113","192.168.137.255","NBNS","110","Registration NB PERTRUIDE-PC<00>"
"16","1.593482","192.168.137.113","192.168.137.255","NBNS","110","Registration NB PERTRUIDE-PC<00>"
"17","1.593525","192.168.137.113","192.168.137.255","NBNS","110","Registration NB WORKGROUP<00>"
"18","1.593526","192.168.137.113","192.168.137.255","NBNS","110","Registration NB PERTRUIDE-PC<20>"
"19","2.357898","192.168.137.113","192.168.137.255","NBNS","110","Registration NB PERTRUIDE-PC<20>"
"20","2.357958","192.168.137.113","192.168.137.255","NBNS","110","Registration NB WORKGROUP<00>"
"21","2.357960","192.168.137.113","192.168.137.255","NBNS","110","Registration NB PERTRUIDE-PC<00>"
"22","3.109921","192.168.137.113","224.0.0.22","IGMPv3","60","Membership Report / Leave group 224.0.0.252"
"23","3.112326","192.168.137.113","224.0.0.22","IGMPv3","60","Membership Report / Join group 224.0.0.252 for any sources"
"24","3.112737","192.168.137.113","224.0.0.252","LLMNR","72","Standard query 0x21ee ANY Pertruide-PC"
"25","3.216020","192.168.137.113","224.0.0.252","LLMNR","72","Standard query 0x21ee ANY Pertruide-PC"
"26","3.605894","192.168.137.113","224.0.0.22","IGMPv3","60","Membership Report / Join group 224.0.0.252 for any sources"
"27","4.881271","192.168.137.113","192.168.137.1","DNS","77","Standard query 0xd328 A isatap.mshome.net"
"28","4.881632","192.168.137.1","192.168.137.113","DNS","77","Standard query response 0xd328 No such name A isatap.mshome.net"
"29","6.893522","192.168.137.113","255.255.255.255","DHCP","342","DHCP Inform   - Transaction ID 0x524b15ab"
"30","6.903699","192.168.137.113","192.168.137.1","DNS","75","Standard query 0xc410 A wpad.mshome.net"
"31","6.903987","192.168.137.1","192.168.137.113","DNS","75","Standard query response 0xc410 No such name A wpad.mshome.net"
"32","6.904431","192.168.137.113","224.0.0.252","LLMNR","64","Standard query 0xf219 A wpad"
"33","6.999269","192.168.137.113","224.0.0.252","LLMNR","64","Standard query 0xf219 A wpad"
"34","7.199456","192.168.137.113","192.168.137.255","NBNS","92","Name query NB WPAD<00>"
"35","7.949226","192.168.137.113","192.168.137.255","NBNS","92","Name query NB WPAD<00>"
"36","8.699238","192.168.137.113","192.168.137.255","NBNS","92","Name query NB WPAD<00>"
"37","9.451067","192.168.137.113","192.168.137.1","DNS","76","Standard query 0xdaf2 A www.msftncsi.com"
"38","10.449272","192.168.137.113","192.168.137.1","DNS","76","Standard query 0xdaf2 A www.msftncsi.com"
"39","11.464275","192.168.137.113","192.168.137.1","DNS","76","Standard query 0xdaf2 A www.msftncsi.com"
"40","13.389341","192.168.137.1","192.168.137.113","DNS","181","Standard query response 0xdaf2 A www.msftncsi.com CNAME www.msftncsi.com.edgesuite.net CNAME a1961.g.akamai.net A 190.98.140.10 A 190.98.140.16"
"41","13.391104","192.168.137.113","190.98.140.10","TCP","66","49157  >  80 [SYN] Seq=0 Win=8192 Len=0 MSS=1460 WS=256 SACK_PERM=1"
"42","14.235045","190.98.140.10","192.168.137.113","TCP","66","80  >  49157 [SYN, ACK] Seq=0 Ack=1 Win=14600 Len=0 MSS=1367 SACK_PERM=1 WS=32"
"43","14.235172","192.168.137.113","190.98.140.10","TCP","60","49157  >  80 [ACK] Seq=1 Ack=1 Win=65536 Len=0"
"44","14.235304","192.168.137.113","190.98.140.10","HTTP","151","GET /ncsi.txt HTTP/1.1 "
"45","15.140395","190.98.140.10","192.168.137.113","TCP","54","80  >  49157 [ACK] Seq=1 Ack=98 Win=14624 Len=0"
"46","15.478076","190.98.140.10","192.168.137.113","HTTP","233","HTTP/1.1 200 OK  (text/plain)"
"47","15.478128","190.98.140.10","192.168.137.113","TCP","54","80  >  49157 [FIN, ACK] Seq=180 Ack=98 Win=14624 Len=0"
"48","15.478224","192.168.137.113","190.98.140.10","TCP","60","49157  >  80 [ACK] Seq=98 Ack=181 Win=65280 Len=0"
"49","15.478291","192.168.137.113","190.98.140.10","TCP","60","49157  >  80 [FIN, ACK] Seq=98 Ack=181 Win=65280 Len=0"
"50","15.993785","190.98.140.10","192.168.137.113","TCP","54","80  >  49157 [ACK] Seq=181 Ack=99 Win=14624 Len=0"
"51","300.123252","192.168.137.113","192.168.137.1","DHCP","350","DHCP Request  - Transaction ID 0xae56e217"
"52","300.147573","192.168.137.113","224.0.0.22","IGMPv3","60","Membership Report / Leave group 224.0.0.252"
"53","300.154619","192.168.137.113","224.0.0.22","IGMPv3","60","Membership Report / Join group 224.0.0.252 for any sources"
"54","300.155184","192.168.137.113","224.0.0.22","IGMPv3","60","Membership Report / Leave group 224.0.0.252"
"55","300.160702","192.168.137.113","224.0.0.22","IGMPv3","60","Membership Report / Join group 224.0.0.252 for any sources"
"56","300.162610","192.168.137.113","224.0.0.252","LLMNR","72","Standard query 0x6eb0 ANY Pertruide-PC"
"57","300.257817","192.168.137.113","224.0.0.252","LLMNR","72","Standard query 0x6eb0 ANY Pertruide-PC"
"58","300.600865","192.168.137.113","224.0.0.22","IGMPv3","60","Membership Report / Join group 224.0.0.252 for any sources"
"59","306.858313","192.168.137.113","192.168.137.1","DNS","75","Standard query 0xa4d5 A wpad.mshome.net"
"60","306.858691","192.168.137.1","192.168.137.113","DNS","75","Standard query response 0xa4d5 No such name A wpad.mshome.net"
"61","306.859643","192.168.137.113","224.0.0.252","LLMNR","64","Standard query 0x478d A wpad"
"62","306.864549","192.168.137.113","255.255.255.255","DHCP","342","DHCP Inform   - Transaction ID 0x1754b0a2"
"63","306.916836","192.168.137.113","192.168.137.1","DNS","88","Standard query 0x3a98 A javadl-esd-secure.oracle.com"
"64","306.966052","192.168.137.113","224.0.0.252","LLMNR","64","Standard query 0x478d A wpad"
"65","307.169214","192.168.137.113","192.168.137.255","NBNS","92","Name query NB WPAD<00>"
"66","307.186439","192.168.137.1","192.168.137.113","DNS","191","Standard query response 0x3a98 A javadl-esd-secure.oracle.com CNAME javadl-esd-secure.oracle.com.edgekey.net CNAME e5486.g.akamaiedge.net A 23.42.245.10"
"67","307.203447","192.168.137.113","23.42.245.10","TCP","66","49158  >  443 [SYN] Seq=0 Win=8192 Len=0 MSS=1460 WS=256 SACK_PERM=1"
"68","307.535480","23.42.245.10","192.168.137.113","TCP","66","443  >  49158 [SYN, ACK] Seq=0 Ack=1 Win=14600 Len=0 MSS=1367 SACK_PERM=1 WS=32"
"69","307.535670","192.168.137.113","23.42.245.10","TCP","60","49158  >  443 [ACK] Seq=1 Ack=1 Win=65536 Len=0"
"70","307.551191","192.168.137.113","23.42.245.10","TLSv1.2","224","Client Hello"
"71","307.916004","23.42.245.10","192.168.137.113","TCP","54","443  >  49158 [ACK] Seq=1 Ack=171 Win=15680 Len=0"
"72","307.919176","23.42.245.10","192.168.137.113","TLSv1.2","1421","Server Hello"
"73","307.919478","192.168.137.113","23.42.245.10","TCP","60","49158  >  443 [ACK] Seq=171 Ack=1368 Win=65536 Len=0"
"74","307.933082","192.168.137.113","192.168.137.255","NBNS","92","Name query NB WPAD<00>"
"75","308.085110","23.42.245.10","192.168.137.113","TLSv1.2","1421","Certificate [TCP segment of a reassembled PDU]"
"76","308.085179","23.42.245.10","192.168.137.113","TLSv1.2","74","Server Key Exchange, Server Hello Done"
"77","308.085424","192.168.137.113","23.42.245.10","TCP","60","49158  >  443 [ACK] Seq=171 Ack=2755 Win=65536 Len=0"
"78","308.164932","192.168.137.113","23.42.245.10","TLSv1.2","204","Client Key Exchange, Change Cipher Spec, Encrypted Handshake Message"
"79","308.462760","23.42.245.10","192.168.137.113","TLSv1.2","129","Change Cipher Spec, Encrypted Handshake Message"
"80","308.462937","192.168.137.113","23.42.245.10","TCP","60","49158  >  443 [ACK] Seq=321 Ack=2830 Win=65536 Len=0"
"81","308.538090","192.168.137.113","23.42.245.10","TLSv1.2","235","Application Data"
"82","308.697493","192.168.137.113","192.168.137.255","NBNS","92","Name query NB WPAD<00>"
"83","308.851448","23.42.245.10","192.168.137.113","TCP","1421","443  >  49158 [ACK] Seq=2830 Ack=502 Win=17824 Len=1367 [TCP segment of a reassembled PDU]"
"84","308.851750","192.168.137.113","23.42.245.10","TCP","60","49158  >  443 [ACK] Seq=502 Ack=4197 Win=65536 Len=0"
"85","309.018103","23.42.245.10","192.168.137.113","TLSv1.2","740","Application Data"
"86","309.018329","192.168.137.113","23.42.245.10","TCP","60","49158  >  443 [ACK] Seq=502 Ack=4883 Win=64768 Len=0"
"87","371.054344","192.168.137.113","192.168.137.255","NBNS","92","Name query NB WPAD<00>"
"88","371.055400","192.168.137.113","255.255.255.255","DHCP","342","DHCP Inform   - Transaction ID 0xb9a4c785"
"89","371.116013","192.168.137.113","192.168.137.1","DNS","72","Standard query 0x7304 A api.bing.com"
"90","371.284823","192.168.137.1","192.168.137.113","DNS","148","Standard query response 0x7304 A api.bing.com CNAME api-bing-com.e-0001.e-msedge.net CNAME e-0001.e-msedge.net A 191.234.5.80"
"91","371.291712","192.168.137.113","191.234.5.80","TCP","66","49159  >  80 [SYN] Seq=0 Win=8192 Len=0 MSS=1460 WS=256 SACK_PERM=1"
"92","371.291912","192.168.137.113","191.234.5.80","TCP","66","49160  >  80 [SYN] Seq=0 Win=8192 Len=0 MSS=1460 WS=256 SACK_PERM=1"
"93","371.590953","192.168.137.113","192.168.137.1","DNS","70","Standard query 0xece4 A google.com"
"94","371.592218","192.168.137.113","191.234.5.80","TCP","66","49161  >  80 [SYN] Seq=0 Win=8192 Len=0 MSS=1460 WS=256 SACK_PERM=1"
"95","371.646800","192.168.137.113","192.168.137.255","NBNS","92","Name query NB WPAD<00>"
"96","371.650324","192.168.137.113","191.234.5.80","TCP","66","49162  >  80 [SYN] Seq=0 Win=8192 Len=0 MSS=1460 WS=256 SACK_PERM=1"
"97","371.788646","192.168.137.113","191.234.5.80","TCP","66","49163  >  80 [SYN] Seq=0 Win=8192 Len=0 MSS=1460 WS=256 SACK_PERM=1"
"98","371.816411","192.168.137.113","192.168.137.255","NBNS","92","Name query NB WPAD<00>"
"99","371.891295","192.168.137.113","191.234.5.80","TCP","66","49164  >  80 [SYN] Seq=0 Win=8192 Len=0 MSS=1460 WS=256 SACK_PERM=1"
"100","371.925193","191.234.5.80","192.168.137.113","TCP","66","80  >  49159 [SYN, ACK] Seq=0 Ack=1 Win=8192 Len=0 MSS=1367 WS=256 SACK_PERM=1"
"101","371.925245","191.234.5.80","192.168.137.113","TCP","66","80  >  49160 [SYN, ACK] Seq=0 Ack=1 Win=8192 Len=0 MSS=1367 WS=256 SACK_PERM=1"
"102","371.925279","191.234.5.80","192.168.137.113","TCP","66","80  >  49161 [SYN, ACK] Seq=0 Ack=1 Win=8192 Len=0 MSS=1367 WS=256 SACK_PERM=1"
"103","371.925325","192.168.137.113","191.234.5.80","TCP","60","49159  >  80 [ACK] Seq=1 Ack=1 Win=65536 Len=0"
"104","371.925369","192.168.137.1","192.168.137.113","DNS","246","Standard query response 0xece4 A google.com A 173.194.42.101 A 173.194.42.96 A 173.194.42.102 A 173.194.42.99 A 173.194.42.98 A 173.194.42.105 A 173.194.42.103 A 173.194.42.104 A 173.194.42.110 A 173.194.42.97 A 173.194.42.100"
"105","371.925376","192.168.137.113","191.234.5.80","TCP","60","49160  >  80 [ACK] Seq=1 Ack=1 Win=65536 Len=0"
"106","371.925377","192.168.137.113","191.234.5.80","TCP","60","49161  >  80 [ACK] Seq=1 Ack=1 Win=65536 Len=0"
"107","371.925685","192.168.137.113","191.234.5.80","HTTP","353","GET /qsml.aspx?query=google&maxwidth=32765&rowheight=20&sectionHeight=160&FORM=IESS02&market=en-US HTTP/1.1 "
"108","372.036243","192.168.137.113","191.234.5.80","TCP","60","49159  >  80 [RST, ACK] Seq=300 Ack=1 Win=0 Len=0"
"109","372.042671","192.168.137.113","192.168.137.255","NBNS","92","Name query NB WPAD<00>"
"110","372.045858","192.168.137.113","191.234.5.80","HTTP","354","GET /qsml.aspx?query=google.&maxwidth=32765&rowheight=20&sectionHeight=160&FORM=IESS02&market=en-US HTTP/1.1 "
"111","372.092803","191.234.5.80","192.168.137.113","TCP","66","80  >  49162 [SYN, ACK] Seq=0 Ack=1 Win=8192 Len=0 MSS=1367 WS=256 SACK_PERM=1"
"112","372.092859","191.234.5.80","192.168.137.113","TCP","66","80  >  49163 [SYN, ACK] Seq=0 Ack=1 Win=8192 Len=0 MSS=1367 WS=256 SACK_PERM=1"
"113","372.092892","191.234.5.80","192.168.137.113","TCP","66","[TCP Out-Of-Order] 80  >  49159 [SYN, ACK] Seq=0 Ack=1 Win=8192 Len=0 MSS=1367 WS=256 SACK_PERM=1"
"114","372.092925","191.234.5.80","192.168.137.113","TCP","66","[TCP Out-Of-Order] 80  >  49160 [SYN, ACK] Seq=0 Ack=1 Win=8192 Len=0 MSS=1367 WS=256 SACK_PERM=1"
"115","372.092951","192.168.137.113","191.234.5.80","TCP","60","49162  >  80 [ACK] Seq=1 Ack=1 Win=65536 Len=0"
"116","372.093021","192.168.137.113","191.234.5.80","TCP","60","49163  >  80 [ACK] Seq=1 Ack=1 Win=65536 Len=0"
"117","372.093023","192.168.137.113","191.234.5.80","TCP","66","[TCP Dup ACK 105#1] 49160  >  80 [ACK] Seq=1 Ack=1 Win=65536 Len=0 SLE=0 SRE=1"
"118","372.146589","192.168.137.113","191.234.5.80","TCP","60","49161  >  80 [RST, ACK] Seq=301 Ack=1 Win=0 Len=0"
"119","372.148022","192.168.137.113","191.234.5.80","HTTP","355","GET /qsml.aspx?query=google.c&maxwidth=32765&rowheight=20&sectionHeight=160&FORM=IESS02&market=en-US HTTP/1.1 "
"120","372.258909","191.234.5.80","192.168.137.113","TCP","66","80  >  49164 [SYN, ACK] Seq=0 Ack=1 Win=8192 Len=0 MSS=1367 WS=256 SACK_PERM=1"
"121","372.258958","191.234.5.80","192.168.137.113","TCP","66","[TCP Retransmission] 80  >  49161 [SYN, ACK] Seq=0 Ack=1 Win=8192 Len=0 MSS=1367 WS=256 SACK_PERM=1"
"122","372.258992","191.234.5.80","192.168.137.113","TCP","54","80  >  49159 [ACK] Seq=1 Ack=300 Win=131072 Len=0"
"123","372.259108","192.168.137.113","191.234.5.80","TCP","60","49164  >  80 [ACK] Seq=1 Ack=1 Win=65536 Len=0"
"124","372.304841","192.168.137.113","191.234.5.80","TCP","60","49160  >  80 [RST, ACK] Seq=302 Ack=1 Win=0 Len=0"
"125","372.309405","192.168.137.113","191.234.5.80","HTTP","356","GET /qsml.aspx?query=google.co&maxwidth=32765&rowheight=20&sectionHeight=160&FORM=IESS02&market=en-US HTTP/1.1 "
"126","372.361579","192.168.137.113","191.234.5.80","TCP","60","49162  >  80 [RST, ACK] Seq=303 Ack=1 Win=0 Len=0"
"127","372.363609","192.168.137.113","191.234.5.80","HTTP","357","GET /qsml.aspx?query=google.com&maxwidth=32765&rowheight=20&sectionHeight=160&FORM=IESS02&market=en-US HTTP/1.1 "
"128","372.409203","192.168.137.113","192.168.137.255","NBNS","92","Name query NB WPAD<00>"
"129","372.580896","192.168.137.113","192.168.137.255","NBNS","92","Name query NB WPAD<00>"
"130","372.597228","191.234.5.80","192.168.137.113","TCP","54","80  >  49161 [ACK] Seq=1 Ack=301 Win=131072 Len=0"
"131","372.597267","191.234.5.80","192.168.137.113","TCP","66","[TCP Retransmission] 80  >  49162 [SYN, ACK] Seq=0 Ack=1 Win=8192 Len=0 MSS=1367 WS=256 SACK_PERM=1"
"132","372.597306","191.234.5.80","192.168.137.113","TCP","66","[TCP Retransmission] 80  >  49163 [SYN, ACK] Seq=0 Ack=1 Win=8192 Len=0 MSS=1367 WS=256 SACK_PERM=1"
"133","372.597338","191.234.5.80","192.168.137.113","TCP","54","80  >  49160 [ACK] Seq=1 Ack=302 Win=131072 Len=0"
"134","372.597371","191.234.5.80","192.168.137.113","TCP","66","[TCP Out-Of-Order] 80  >  49164 [SYN, ACK] Seq=0 Ack=1 Win=8192 Len=0 MSS=1367 WS=256 SACK_PERM=1"
"135","372.597439","192.168.137.113","191.234.5.80","TCP","66","[TCP Dup ACK 116#1] 49163  >  80 [ACK] Seq=304 Ack=1 Win=65536 Len=0 SLE=0 SRE=1"
"136","372.597492","192.168.137.113","191.234.5.80","TCP","66","[TCP Dup ACK 123#1] 49164  >  80 [ACK] Seq=1 Ack=1 Win=65536 Len=0 SLE=0 SRE=1"
"137","372.643015","192.168.137.113","191.234.5.80","TCP","60","49163  >  80 [RST, ACK] Seq=304 Ack=1 Win=0 Len=0"
"138","372.737880","192.168.137.113","192.168.137.1","DNS","77","Standard query 0x48a1 A www.google.com.br"
"139","372.738813","192.168.137.113","173.194.42.101","TCP","66","49165  >  80 [SYN] Seq=0 Win=8192 Len=0 MSS=1460 WS=256 SACK_PERM=1"
"140","372.739303","192.168.137.113","192.168.137.1","DNS","75","Standard query 0x88fd A ssl.gstatic.com"
"141","372.739521","192.168.137.113","192.168.137.1","DNS","75","Standard query 0x5845 A www.gstatic.com"
"142","372.763770","191.234.5.80","192.168.137.113","TCP","54","80  >  49162 [ACK] Seq=1 Ack=303 Win=131072 Len=0"
"143","372.763816","191.234.5.80","192.168.137.113","TCP","54","80  >  49163 [ACK] Seq=1 Ack=304 Win=131072 Len=0"
"144","372.799293","192.168.137.113","192.168.137.255","NBNS","92","Name query NB WPAD<00>"
"145","372.800916","191.234.5.80","192.168.137.113","TCP","1421","80  >  49163 [ACK] Seq=1 Ack=304 Win=131072 Len=1367 [TCP segment of a reassembled PDU]"
"146","372.800987","191.234.5.80","192.168.137.113","TCP","1091","80  >  49163 [PSH, ACK] Seq=1368 Ack=304 Win=131072 Len=1037 [TCP segment of a reassembled PDU]"
"147","372.801030","191.234.5.80","192.168.137.113","TCP","137","80  >  49163 [PSH, ACK] Seq=2405 Ack=304 Win=131072 Len=83 [TCP segment of a reassembled PDU]"
"148","372.930113","191.234.5.80","192.168.137.113","HTTP/XML","59","HTTP/1.1 200 OK "
"149","372.968153","173.194.42.101","192.168.137.113","TCP","66","80  >  49165 [SYN, ACK] Seq=0 Ack=1 Win=42900 Len=0 MSS=1367 SACK_PERM=1 WS=128"
"150","372.968239","192.168.137.1","192.168.137.113","DNS","141","Standard query response 0x48a1 A www.google.com.br A 173.194.42.95 A 173.194.42.79 A 173.194.42.88 A 173.194.42.87"
"151","372.968278","192.168.137.113","173.194.42.101","TCP","60","49165  >  80 [ACK] Seq=1 Ack=1 Win=65536 Len=0"
"152","372.968327","192.168.137.1","192.168.137.113","DNS","139","Standard query response 0x88fd A ssl.gstatic.com A 173.194.42.88 A 173.194.42.87 A 173.194.42.79 A 173.194.42.95"
"153","372.968410","192.168.137.1","192.168.137.113","DNS","139","Standard query response 0x5845 A www.gstatic.com A 173.194.42.95 A 173.194.42.88 A 173.194.42.87 A 173.194.42.79"
"154","372.968437","192.168.137.113","173.194.42.101","HTTP","292","GET / HTTP/1.1 "
"155","372.969017","192.168.137.113","173.194.42.95","TCP","66","49166  >  80 [SYN] Seq=0 Win=8192 Len=0 MSS=1460 WS=256 SACK_PERM=1"
"156","372.969150","192.168.137.113","173.194.42.88","TCP","66","49167  >  443 [SYN] Seq=0 Win=8192 Len=0 MSS=1460 WS=256 SACK_PERM=1"
"157","372.969252","192.168.137.113","173.194.42.95","TCP","66","49168  >  443 [SYN] Seq=0 Win=8192 Len=0 MSS=1460 WS=256 SACK_PERM=1"
"158","372.969278","192.168.137.113","173.194.42.95","TCP","66","49169  >  443 [SYN] Seq=0 Win=8192 Len=0 MSS=1460 WS=256 SACK_PERM=1"
"159","373.173723","192.168.137.113","192.168.137.255","NBNS","92","Name query NB WPAD<00>"
"160","373.324491","173.194.42.101","192.168.137.113","TCP","54","80  >  49165 [ACK] Seq=1 Ack=239 Win=44032 Len=0"
"161","373.563634","192.168.137.113","192.168.137.255","NBNS","92","Name query NB WPAD<00>"
"162","373.700021","173.194.42.95","192.168.137.113","TCP","66","443  >  49169 [SYN, ACK] Seq=0 Ack=1 Win=42900 Len=0 MSS=1367 SACK_PERM=1 WS=128"
"163","373.700090","173.194.42.101","192.168.137.113","HTTP","583","HTTP/1.1 302 Found  (text/html)"
"164","373.700127","173.194.42.95","192.168.137.113","TCP","66","80  >  49166 [SYN, ACK] Seq=0 Ack=1 Win=42900 Len=0 MSS=1367 SACK_PERM=1 WS=128"
"165","373.700166","173.194.42.88","192.168.137.113","TCP","66","443  >  49167 [SYN, ACK] Seq=0 Ack=1 Win=42900 Len=0 MSS=1367 SACK_PERM=1 WS=128"
"166","373.700198","173.194.42.95","192.168.137.113","TCP","66","443  >  49168 [SYN, ACK] Seq=0 Ack=1 Win=42900 Len=0 MSS=1367 SACK_PERM=1 WS=128"
"167","373.700228","192.168.137.113","173.194.42.95","TCP","60","49169  >  443 [ACK] Seq=1 Ack=1 Win=65536 Len=0"
"168","373.700229","173.194.42.95","192.168.137.113","TCP","66","[TCP Out-Of-Order] 443  >  49169 [SYN, ACK] Seq=0 Ack=1 Win=42900 Len=0 MSS=1367 SACK_PERM=1 WS=128"
"169","373.700262","173.194.42.95","192.168.137.113","TCP","66","[TCP Out-Of-Order] 80  >  49166 [SYN, ACK] Seq=0 Ack=1 Win=42900 Len=0 MSS=1367 SACK_PERM=1 WS=128"
"170","373.700341","192.168.137.113","173.194.42.101","TCP","60","49165  >  80 [ACK] Seq=239 Ack=530 Win=65024 Len=0"
"171","373.700367","192.168.137.113","173.194.42.95","TCP","60","49166  >  80 [ACK] Seq=1 Ack=1 Win=65536 Len=0"
"172","373.700369","192.168.137.113","173.194.42.88","TCP","60","49167  >  443 [ACK] Seq=1 Ack=1 Win=65536 Len=0"
"173","373.700406","192.168.137.113","173.194.42.95","TCP","60","49168  >  443 [ACK] Seq=1 Ack=1 Win=65536 Len=0"
"174","373.700429","192.168.137.113","173.194.42.95","TCP","66","[TCP Dup ACK 167#1] 49169  >  443 [ACK] Seq=1 Ack=1 Win=65536 Len=0 SLE=0 SRE=1"
"175","373.700431","192.168.137.113","173.194.42.95","TCP","66","[TCP Dup ACK 171#1] 49166  >  80 [ACK] Seq=1 Ack=1 Win=65536 Len=0 SLE=0 SRE=1"
"176","373.711624","192.168.137.113","173.194.42.95","TLSv1.2","213","Client Hello"
"177","373.711694","192.168.137.113","173.194.42.95","TLSv1.2","211","Client Hello"
"178","373.712598","192.168.137.113","173.194.42.88","TLSv1.2","211","Client Hello"
"179","373.716258","192.168.137.113","173.194.42.95","HTTP","562","GET /?gfe_rd=cr&ei=7jLCVbSlOcuB8Qf-jKbwDg HTTP/1.1 "
"180","373.866381","173.194.42.95","192.168.137.113","TCP","66","[TCP Out-Of-Order] 443  >  49168 [SYN, ACK] Seq=0 Ack=1 Win=42900 Len=0 MSS=1367 SACK_PERM=1 WS=128"
"181","373.866423","173.194.42.88","192.168.137.113","TCP","66","[TCP Out-Of-Order] 443  >  49167 [SYN, ACK] Seq=0 Ack=1 Win=42900 Len=0 MSS=1367 SACK_PERM=1 WS=128"
"182","373.866466","173.194.42.101","192.168.137.113","HTTP","583","[TCP Spurious Retransmission] HTTP/1.1 302 Found  (text/html)"
"183","373.866516","192.168.137.113","173.194.42.95","TCP","66","[TCP Dup ACK 173#1] 49168  >  443 [ACK] Seq=158 Ack=1 Win=65536 Len=0 SLE=0 SRE=1"
"184","373.866588","192.168.137.113","173.194.42.88","TCP","66","[TCP Dup ACK 172#1] 49167  >  443 [ACK] Seq=158 Ack=1 Win=65536 Len=0 SLE=0 SRE=1"
"185","373.866589","192.168.137.113","173.194.42.101","TCP","66","[TCP Dup ACK 170#1] 49165  >  80 [ACK] Seq=239 Ack=530 Win=65024 Len=0 SLE=1 SRE=530"
"186","373.910212","192.168.137.113","192.168.137.1","DNS","72","Standard query 0xedc4 A www.bing.com"
"187","373.910321","192.168.137.113","192.168.137.1","DNS","72","Standard query 0xf066 A www.bing.com"
"188","373.910409","192.168.137.113","192.168.137.1","DNS","72","Standard query 0x16b6 A www.bing.com"
"189","373.910863","192.168.137.113","192.168.137.1","DNS","72","Standard query 0x8945 A www.bing.com"
"190","373.915448","173.194.42.95","192.168.137.113","TCP","54","443  >  49169 [ACK] Seq=1 Ack=160 Win=44032 Len=0"
"191","373.915501","173.194.42.95","192.168.137.113","TLSv1.2","1421","Server Hello"
"192","373.915540","173.194.42.88","192.168.137.113","TCP","54","443  >  49167 [ACK] Seq=1 Ack=158 Win=44032 Len=0"
"193","373.915598","173.194.42.95","192.168.137.113","TCP","1421","443  >  49169 [ACK] Seq=1368 Ack=160 Win=44032 Len=1367 [TCP segment of a reassembled PDU]"
"194","373.915809","192.168.137.113","173.194.42.95","TCP","60","49169  >  443 [ACK] Seq=160 Ack=1368 Win=65536 Len=0"
"195","373.915852","192.168.137.113","173.194.42.95","TCP","60","49169  >  443 [ACK] Seq=160 Ack=2735 Win=65536 Len=0"
"196","374.048704","173.194.42.95","192.168.137.113","TLSv1.2","1247","Certificate, Server Key Exchange, Server Hello Done"
"197","374.048751","173.194.42.95","192.168.137.113","TCP","54","80  >  49166 [ACK] Seq=1 Ack=509 Win=44032 Len=0"
"198","374.048782","173.194.42.95","192.168.137.113","TCP","54","443  >  49168 [ACK] Seq=1 Ack=158 Win=44032 Len=0"
"199","374.048998","192.168.137.113","173.194.42.95","TCP","60","49169  >  443 [ACK] Seq=160 Ack=3928 Win=64256 Len=0"
"200","374.082144","173.194.42.88","192.168.137.113","TLSv1.2","1421","Server Hello"
"201","374.082387","192.168.137.113","173.194.42.88","TCP","60","49167  >  443 [ACK] Seq=158 Ack=1368 Win=65536 Len=0"
"202","374.082893","173.194.42.88","192.168.137.113","TCP","1421","443  >  49167 [ACK] Seq=1368 Ack=158 Win=44032 Len=1367 [TCP segment of a reassembled PDU]"
"203","374.082946","173.194.42.88","192.168.137.113","TLSv1.2","1248","Certificate, Server Key Exchange, Server Hello Done"
"204","374.083199","192.168.137.113","173.194.42.88","TCP","60","49167  >  443 [ACK] Seq=158 Ack=2735 Win=65536 Len=0"
"205","374.083236","192.168.137.113","173.194.42.88","TCP","60","49167  >  443 [ACK] Seq=158 Ack=3929 Win=64256 Len=0"
"206","374.105401","192.168.137.113","173.194.42.95","TLSv1.2","180","Client Key Exchange, Change Cipher Spec, Encrypted Handshake Message"
"207","374.117290","192.168.137.113","173.194.42.88","TLSv1.2","180","Client Key Exchange, Change Cipher Spec, Encrypted Handshake Message"
"208","374.248904","173.194.42.95","192.168.137.113","TLSv1.2","1421","Server Hello"
"209","374.249190","192.168.137.113","173.194.42.95","TCP","60","49168  >  443 [ACK] Seq=158 Ack=1368 Win=65536 Len=0"
"210","374.249632","173.194.42.95","192.168.137.113","TCP","1421","443  >  49168 [ACK] Seq=1368 Ack=158 Win=44032 Len=1367 [TCP segment of a reassembled PDU]"
"211","374.249687","173.194.42.95","192.168.137.113","TLSv1.2","1247","Certificate, Server Key Exchange, Server Hello Done"
"212","374.249732","173.194.42.95","192.168.137.113","HTTP","669","HTTP/1.1 302 Found  (text/html)"
"213","374.249809","192.168.137.1","192.168.137.113","DNS","111","Standard query response 0xedc4 A www.bing.com CNAME any.edge.bing.com A 204.79.197.200"
"214","374.249882","192.168.137.113","173.194.42.95","TCP","60","49168  >  443 [ACK] Seq=158 Ack=2735 Win=65536 Len=0"
"215","374.249937","192.168.137.113","173.194.42.95","TCP","60","49168  >  443 [ACK] Seq=158 Ack=3928 Win=64256 Len=0"
"216","374.249998","192.168.137.1","192.168.137.113","DNS","111","Standard query response 0xf066 A www.bing.com CNAME any.edge.bing.com A 204.79.197.200"
"217","374.250010","192.168.137.113","173.194.42.95","TCP","60","49166  >  80 [ACK] Seq=509 Ack=616 Win=64768 Len=0"
"218","374.322710","192.168.137.113","173.194.42.95","TLSv1.2","180","Client Key Exchange, Change Cipher Spec, Encrypted Handshake Message"
"219","374.416070","192.168.137.1","192.168.137.113","DNS","111","Standard query response 0x16b6 A www.bing.com CNAME any.edge.bing.com A 204.79.197.200"
"220","374.416794","192.168.137.1","192.168.137.113","DNS","111","Standard query response 0x8945 A www.bing.com CNAME any.edge.bing.com A 204.79.197.200"
"221","374.582645","173.194.42.88","192.168.137.113","TLSv1.2","105","Change Cipher Spec, Encrypted Handshake Message"
"222","374.582682","173.194.42.95","192.168.137.113","TLSv1.2","105","Change Cipher Spec, Encrypted Handshake Message"
"223","374.582804","192.168.137.113","173.194.42.88","TCP","60","49167  >  443 [ACK] Seq=284 Ack=3980 Win=64256 Len=0"
"224","374.582857","192.168.137.113","173.194.42.95","TCP","60","49169  >  443 [ACK] Seq=286 Ack=3979 Win=64256 Len=0"
"225","374.627299","192.168.137.113","173.194.42.95","TLSv1.2","602","Application Data"
"226","374.748626","173.194.42.95","192.168.137.113","TLSv1.2","105","Change Cipher Spec, Encrypted Handshake Message"
"227","374.748779","192.168.137.113","173.194.42.95","TCP","60","49168  >  443 [ACK] Seq=284 Ack=3979 Win=64256 Len=0"
"228","374.984157","173.194.42.95","192.168.137.113","TCP","54","443  >  49169 [ACK] Seq=3979 Ack=834 Win=45184 Len=0"
"229","375.019497","173.194.42.95","192.168.137.113","TLSv1.2","1406","Application Data"
"230","375.019574","173.194.42.95","192.168.137.113","TLSv1.2","1406","Application Data"
"231","375.019630","173.194.42.95","192.168.137.113","TLSv1.2","1406","Application Data"
"232","375.019794","192.168.137.113","173.194.42.95","TCP","60","49169  >  443 [ACK] Seq=834 Ack=5331 Win=65536 Len=0"
"233","375.019857","192.168.137.113","173.194.42.95","TCP","60","49169  >  443 [ACK] Seq=834 Ack=6683 Win=64256 Len=0"
"234","375.019927","192.168.137.113","173.194.42.95","TCP","60","49169  >  443 [ACK] Seq=834 Ack=8035 Win=65536 Len=0"
"235","375.184628","173.194.42.95","192.168.137.113","TLSv1.2","1406","Application Data"
"236","375.184917","192.168.137.113","173.194.42.95","TCP","60","49169  >  443 [ACK] Seq=834 Ack=9387 Win=64256 Len=0"
"237","375.185359","173.194.42.95","192.168.137.113","TLSv1.2","1406","Application Data"
"238","375.185413","173.194.42.95","192.168.137.113","TLSv1.2","1406","Application Data"
"239","375.185576","192.168.137.113","173.194.42.95","TCP","60","49169  >  443 [ACK] Seq=834 Ack=10739 Win=65536 Len=0"
"240","375.185734","192.168.137.113","173.194.42.95","TCP","60","49169  >  443 [ACK] Seq=834 Ack=12091 Win=64256 Len=0"
"241","375.186139","173.194.42.95","192.168.137.113","TLSv1.2","1406","Application Data"
"242","375.186354","192.168.137.113","173.194.42.95","TCP","60","49169  >  443 [ACK] Seq=834 Ack=13443 Win=65536 Len=0"
"243","375.261505","192.168.137.113","192.168.137.1","DNS","77","Standard query 0xb5fa A urs.microsoft.com"
"244","375.319432","173.194.42.95","192.168.137.113","TLSv1.2","1421","Application Data"
"245","375.319729","192.168.137.113","173.194.42.95","TCP","60","49169  >  443 [ACK] Seq=834 Ack=14810 Win=65536 Len=0"
"246","375.351319","173.194.42.95","192.168.137.113","TLSv1.2","1391","Application Data"
"247","375.351607","192.168.137.113","173.194.42.95","TCP","60","49169  >  443 [ACK] Seq=834 Ack=16147 Win=64256 Len=0"
"248","375.352066","173.194.42.95","192.168.137.113","TLSv1.2","1406","Application Data"
"249","375.352121","173.194.42.95","192.168.137.113","TLSv1.2","1421","Application Data"
"250","375.352333","192.168.137.113","173.194.42.95","TCP","60","49169  >  443 [ACK] Seq=834 Ack=17499 Win=65536 Len=0"
"251","375.352383","192.168.137.113","173.194.42.95","TCP","60","49169  >  443 [ACK] Seq=834 Ack=18866 Win=65536 Len=0"
"252","375.352844","173.194.42.95","192.168.137.113","TLSv1.2","1421","Application Data, Application Data"
"253","375.352899","173.194.42.95","192.168.137.113","TLSv1.2","1421","Application Data [TCP segment of a reassembled PDU]"
"254","375.353054","192.168.137.113","173.194.42.95","TCP","60","49169  >  443 [ACK] Seq=834 Ack=20233 Win=65536 Len=0"
"255","375.353156","192.168.137.113","173.194.42.95","TCP","60","49169  >  443 [ACK] Seq=834 Ack=21600 Win=65536 Len=0"
"256","375.517333","173.194.42.95","192.168.137.113","TLSv1.2","1421","Application Data [TCP segment of a reassembled PDU]"
"257","375.517731","192.168.137.113","173.194.42.95","TCP","60","49169  >  443 [ACK] Seq=834 Ack=22967 Win=65536 Len=0"
"258","375.518019","173.194.42.95","192.168.137.113","TLSv1.2","1421","Application Data [TCP segment of a reassembled PDU]"
"259","375.518268","192.168.137.113","173.194.42.95","TCP","60","49169  >  443 [ACK] Seq=834 Ack=24334 Win=65536 Len=0"
"260","375.518857","173.194.42.95","192.168.137.113","TLSv1.2","1421","Application Data [TCP segment of a reassembled PDU]"
"261","375.518927","173.194.42.95","192.168.137.113","TLSv1.2","1421","Application Data [TCP segment of a reassembled PDU]"
"262","375.519135","192.168.137.113","173.194.42.95","TCP","60","49169  >  443 [ACK] Seq=834 Ack=25701 Win=65536 Len=0"
"263","375.519183","192.168.137.113","173.194.42.95","TCP","60","49169  >  443 [ACK] Seq=834 Ack=27068 Win=65536 Len=0"
"264","375.519605","173.194.42.95","192.168.137.113","TLSv1.2","1421","Application Data [TCP segment of a reassembled PDU]"
"265","375.519672","173.194.42.95","192.168.137.113","TLSv1.2","1421","Application Data [TCP segment of a reassembled PDU]"
"266","375.519727","173.194.42.95","192.168.137.113","TLSv1.2","1421","Application Data [TCP segment of a reassembled PDU]"
"267","375.519782","173.194.42.95","192.168.137.113","TLSv1.2","1421","Application Data [TCP segment of a reassembled PDU]"
"268","375.519821","192.168.137.113","173.194.42.95","TCP","60","49169  >  443 [ACK] Seq=834 Ack=28435 Win=65536 Len=0"
"269","375.519938","192.168.137.113","173.194.42.95","TCP","60","49169  >  443 [ACK] Seq=834 Ack=29802 Win=65536 Len=0"
"270","375.520043","192.168.137.113","173.194.42.95","TCP","60","49169  >  443 [ACK] Seq=834 Ack=31169 Win=65536 Len=0"
"271","375.520157","192.168.137.113","173.194.42.95","TCP","60","49169  >  443 [ACK] Seq=834 Ack=32536 Win=65536 Len=0"
"272","375.652268","192.168.137.113","173.194.42.88","TLSv1.2","448","Application Data"
"273","375.685338","173.194.42.95","192.168.137.113","TLSv1.2","1421","Application Data [TCP segment of a reassembled PDU]"
"274","375.685658","192.168.137.113","173.194.42.95","TCP","60","49169  >  443 [ACK] Seq=834 Ack=33903 Win=65536 Len=0"
"275","375.686084","173.194.42.95","192.168.137.113","TLSv1.2","1421","Application Data [TCP segment of a reassembled PDU]"
"276","375.686139","173.194.42.95","192.168.137.113","TLSv1.2","1421","Application Data [TCP segment of a reassembled PDU]"
"277","375.686195","173.194.42.95","192.168.137.113","TLSv1.2","1421","Application Data [TCP segment of a reassembled PDU]"
"278","375.686250","173.194.42.95","192.168.137.113","TLSv1.2","1421","Application Data [TCP segment of a reassembled PDU]"
"279","375.686283","192.168.137.113","173.194.42.95","TCP","60","49169  >  443 [ACK] Seq=834 Ack=35270 Win=65536 Len=0"
"280","375.686393","192.168.137.113","173.194.42.95","TCP","60","49169  >  443 [ACK] Seq=834 Ack=36637 Win=65536 Len=0"
"281","375.686506","192.168.137.113","173.194.42.95","TCP","60","49169  >  443 [ACK] Seq=834 Ack=38004 Win=65536 Len=0"
"282","375.686625","192.168.137.113","173.194.42.95","TCP","60","49169  >  443 [ACK] Seq=834 Ack=39371 Win=65536 Len=0"
"283","375.686848","173.194.42.95","192.168.137.113","TLSv1.2","1421","Application Data [TCP segment of a reassembled PDU]"
"284","375.686905","173.194.42.95","192.168.137.113","TLSv1.2","1421","Application Data [TCP segment of a reassembled PDU]"
"285","375.687054","192.168.137.113","173.194.42.95","TCP","60","49169  >  443 [ACK] Seq=834 Ack=40738 Win=65536 Len=0"
"286","375.687163","192.168.137.113","173.194.42.95","TCP","60","49169  >  443 [ACK] Seq=834 Ack=42105 Win=65536 Len=0"
"287","375.716470","173.194.42.95","192.168.137.113","TLSv1.2","1421","Application Data [TCP segment of a reassembled PDU]"
"288","375.716730","192.168.137.113","173.194.42.95","TCP","60","49169  >  443 [ACK] Seq=834 Ack=43472 Win=65536 Len=0"
"289","375.853038","173.194.42.95","192.168.137.113","TLSv1.2","1421","Application Data [TCP segment of a reassembled PDU]"
"290","375.853335","192.168.137.113","173.194.42.95","TCP","60","49169  >  443 [ACK] Seq=834 Ack=44839 Win=65536 Len=0"
"291","375.854518","173.194.42.95","192.168.137.113","TLSv1.2","1421","Application Data [TCP segment of a reassembled PDU]"
"292","375.854795","192.168.137.113","173.194.42.95","TCP","60","49169  >  443 [ACK] Seq=834 Ack=46206 Win=65536 Len=0"
"293","375.855270","173.194.42.95","192.168.137.113","TLSv1.2","1421","Application Data [TCP segment of a reassembled PDU]"
"294","375.855373","192.168.137.1","192.168.137.113","DNS","134","Standard query response 0xb5fa A urs.microsoft.com CNAME urs.microsoft.com.nsatc.net A 131.253.40.70"
"295","375.855392","173.194.42.95","192.168.137.113","TLSv1.2","1421","Application Data [TCP segment of a reassembled PDU]"
"296","375.855538","192.168.137.113","173.194.42.95","TCP","60","49169  >  443 [ACK] Seq=834 Ack=47573 Win=65536 Len=0"
"297","375.855595","173.194.42.95","192.168.137.113","TLSv1.2","1421","Application Data [TCP segment of a reassembled PDU]"
"298","375.855629","192.168.137.113","173.194.42.95","TCP","60","49169  >  443 [ACK] Seq=834 Ack=48940 Win=65536 Len=0"
"299","375.855650","173.194.42.95","192.168.137.113","TLSv1.2","1421","Application Data [TCP segment of a reassembled PDU]"
"300","375.855704","173.194.42.95","192.168.137.113","TLSv1.2","1421","Application Data [TCP segment of a reassembled PDU]"
"301","375.855800","192.168.137.113","173.194.42.95","TCP","60","49169  >  443 [ACK] Seq=834 Ack=50307 Win=65536 Len=0"
"302","375.855912","192.168.137.113","173.194.42.95","TCP","60","49169  >  443 [ACK] Seq=834 Ack=51674 Win=65536 Len=0"
"303","375.856032","192.168.137.113","173.194.42.95","TCP","60","49169  >  443 [ACK] Seq=834 Ack=53041 Win=65536 Len=0"
"304","375.856049","173.194.42.95","192.168.137.113","TLSv1.2","1421","Application Data, Application Data"
"305","375.856254","192.168.137.113","173.194.42.95","TCP","60","49169  >  443 [ACK] Seq=834 Ack=54408 Win=65536 Len=0"
"306","375.857949","192.168.137.113","131.253.40.70","TCP","66","49170  >  443 [SYN] Seq=0 Win=8192 Len=0 MSS=1460 WS=256 SACK_PERM=1"
"307","375.882875","173.194.42.95","192.168.137.113","TLSv1.2","1421","Application Data [TCP segment of a reassembled PDU]"
"308","375.883133","192.168.137.113","173.194.42.95","TCP","60","49169  >  443 [ACK] Seq=834 Ack=55775 Win=65536 Len=0"
"309","375.883614","173.194.42.95","192.168.137.113","TLSv1.2","1421","Application Data, Application Data"
"310","375.883812","192.168.137.113","173.194.42.95","TCP","60","49169  >  443 [ACK] Seq=834 Ack=57142 Win=65536 Len=0"
"311","376.020706","173.194.42.95","192.168.137.113","TLSv1.2","608","Application Data"
"312","376.020888","192.168.137.113","173.194.42.95","TCP","60","49169  >  443 [ACK] Seq=834 Ack=57696 Win=65024 Len=0"
"313","376.021502","173.194.42.88","192.168.137.113","TLSv1.2","1406","Application Data"
"314","376.021568","173.194.42.88","192.168.137.113","TLSv1.2","1406","Application Data"
"315","376.021622","173.194.42.88","192.168.137.113","TLSv1.2","1406","Application Data"
"316","376.021709","192.168.137.113","173.194.42.88","TCP","60","49167  >  443 [ACK] Seq=678 Ack=5332 Win=65536 Len=0"
"317","376.021808","192.168.137.113","173.194.42.88","TCP","60","49167  >  443 [ACK] Seq=678 Ack=6684 Win=64256 Len=0"
"318","376.021922","192.168.137.113","173.194.42.88","TCP","60","49167  >  443 [ACK] Seq=678 Ack=8036 Win=65536 Len=0"
"319","376.022248","173.194.42.88","192.168.137.113","TLSv1.2","1406","Application Data"
"320","376.022307","173.194.42.88","192.168.137.113","TLSv1.2","1406","Application Data"
"321","376.022360","173.194.42.88","192.168.137.113","TLSv1.2","1406","Application Data"
"322","376.022415","173.194.42.88","192.168.137.113","TLSv1.2","1406","Application Data"
"323","376.022451","192.168.137.113","173.194.42.88","TCP","60","49167  >  443 [ACK] Seq=678 Ack=9388 Win=64256 Len=0"
"324","376.022466","173.194.42.88","192.168.137.113","TLSv1.2","1019","Application Data"
"325","376.022555","192.168.137.113","173.194.42.88","TCP","60","49167  >  443 [ACK] Seq=678 Ack=10740 Win=65536 Len=0"
"326","376.022676","192.168.137.113","173.194.42.88","TCP","60","49167  >  443 [ACK] Seq=678 Ack=12092 Win=64256 Len=0"
"327","376.022785","192.168.137.113","173.194.42.88","TCP","60","49167  >  443 [ACK] Seq=678 Ack=13444 Win=65536 Len=0"
"328","376.022862","192.168.137.113","173.194.42.88","TCP","60","49167  >  443 [ACK] Seq=678 Ack=14409 Win=64512 Len=0"
"329","376.178969","192.168.137.113","173.194.42.95","TLSv1.2","448","Application Data"
"330","376.188662","131.253.40.70","192.168.137.113","TCP","66","443  >  49170 [SYN, ACK] Seq=0 Ack=1 Win=8192 Len=0 MSS=1367 WS=256 SACK_PERM=1"
"331","376.188806","192.168.137.113","131.253.40.70","TCP","60","49170  >  443 [ACK] Seq=1 Ack=1 Win=65536 Len=0"
"332","376.189197","192.168.137.113","131.253.40.70","TLSv1.2","213","Client Hello"
